appid,recommendationid,author_steamid,review,voted_up,votes_up,votes_funny,weighted_vote_score,comment_count,steam_purchase,received_for_free,written_during_early_access,game_title
1517970,167070480,76561198025292481,i was enjoying the game until around the two hour mark i entered an area with awful performance issues my specs are above recommended and lowering settings changed nothing this game shouldnt be hard to run and seeing this issue in a game that released in 2021 is pretty concerning  update 103024 a performance update hit today and the performance issues are the exact same so ill be shelving this one,False,2,0,0.5187901258468627,0,False,False,False,Aeterna Noctis
1517970,166061299,76561198879210776,this game is designed to be as hostile as possible to the player and is not fun in any way,False,2,1,0.4914053976535797,0,True,False,False,Aeterna Noctis
1517970,165570075,76561198954969078,"h3 an excellent metroidvania  h3  this game has a great balance of precision platforming combat variety and storytelling over the course of this 30odd hour adventure if you like games like hollow knight this game is certainly worth a try",True,0,0,0.5,0,True,False,False,Aeterna Noctis
1517970,164981999,76561198044946578,this game is only for super elite pro gamers lol it plays really well and it looks pretty good but honestly i wish id never heard of it,False,1,0,0.524507164955139,0,True,False,False,Aeterna Noctis
1517970,164082657,76561198110709246,i dunno about this one i didnt like the movement and the art felt difficult to read the dialogue was not amazingly well translated either the trailer looked amazing but the first hour was such a slog i couldnt really get into it ill update my review if i try it again someday,False,0,1,0.4761904776096343,0,False,False,False,Aeterna Noctis
1517970,163687702,76561197994290222,this game is hollow knight level perfect  havent played a game like this since then  the world map story ability unlocks secrets music  everything is just so perfect  highly recommend this if you love metroidvanias  it even has a touch of dark souls  the bosses are freaking amazing i will try this on hard mode but expect to die often and i love it,True,0,0,0.5,0,True,False,False,Aeterna Noctis
1517970,163074263,76561198034503848,terrible controls and boring story,False,4,1,0.5458540320396423,0,True,False,False,Aeterna Noctis
1517970,162710150,76561198002103931,hidden gem hardcore precision platforming nice combat top notch boss fight great game  be careful as this game is really hard but game will rewards you for your dedication with great experience and for that the difficulty is essential,True,0,0,0.5,0,True,False,False,Aeterna Noctis
1517970,162647746,76561198109335665,a lot of love went to in this game and you can feelit the only problem is that platformer is a bit hardcore and also need specific gem builds so it is humanly possibletime slow gem and tripple jump still one of the best metros out there just give it a bit of time and u will love itto be honest i kinda like it more than hollow knight right now so it is that good,True,1,0,0.5238095521926879,0,True,False,False,Aeterna Noctis
1517970,162449535,76561198240988856,aeterna noctis has a huge map like afterimage but doesnt feel as long and has challenging platforming and bosses but feels more fair than hollow knight the area of no mans land end of the world  edge of reality and the adjacent areas have become some of my most sentimental memories in gaming the music the atmosphere the mechanics wowed me looking forward to the sequel,True,0,0,0.5,0,True,False,False,Aeterna Noctis
1517970,162298600,76561198409020570,game is stupid hard but if you really good at platforming and good at dodging and stuff then you should attempt to finish this game,True,0,0,0.5,0,False,True,False,Aeterna Noctis
1517970,162079989,76561198099007293,great game,True,0,0,0.5,0,False,False,False,Aeterna Noctis
1517970,161763597,76561198219438000,great game for some but not for me,False,0,0,0.4761904776096343,0,False,False,False,Aeterna Noctis
1517970,161394163,76561198021195728,very good and difficult game i enjoyed a lot,True,0,0,0.5,0,True,False,False,Aeterna Noctis
1517970,161225260,76561199001801757,people getting filtered by this game and then acting like it is the game fault and not them are funny,True,0,0,0.5,0,False,False,False,Aeterna Noctis
1517970,160911622,76561197999762718,far more frustrating than rewarding tried to enjoy it but the precision platforming felt like cbt,False,1,0,0.481249988079071,0,True,False,False,Aeterna Noctis
1517970,160886480,76561198377944085,you like heavy platforming metroidvania you arent playing lone fungus  i dislike this game i tried to play it but didnt like that it was celestetype gameplay rather than go around kill enemies and stuff  maybe it gets better but it wasnt my cup of tea,False,1,0,0.481249988079071,0,False,False,False,Aeterna Noctis
1517970,160823902,76561198093320663,great mix between platforming like celeste and metroidvaina like hollow knight truly a great combination and a great game quite beefy in length and content too btw make sure to grab the dlc after finnishing this,True,0,0,0.5,0,True,False,False,Aeterna Noctis
1517970,160786560,76561198039850512,better than hollow knight ignore the bad reviews those people just mad that they suck because this game can be difficult,True,0,0,0.5,0,True,False,False,Aeterna Noctis
1517970,160590729,76561198889047849,game is great it is the longest metroidvania i ever played combat is great platforming is top notch i absolutely advice to play this game but only if you are familiar to the genre game is hard,True,0,0,0.5,0,True,False,False,Aeterna Noctis
