appid,recommendationid,author_steamid,review,voted_up,votes_up,votes_funny,weighted_vote_score,comment_count,steam_purchase,received_for_free,written_during_early_access,game_title
1669000,199898419,76561198032155469,great game  great graphics and the customization  i hope they keep it the same in the next age of wonders in the series  i like the story missions and how it feels like my character is the one to fix the mess the systems are just like they were in aw2 the game i started with  i would recommend it hands down,True,1,0,0.5,0,False,False,False,Age of Wonders
1669000,199896980,76561197993256124,ye,True,1,0,0.5,0,True,False,False,Age of Wonders
1669000,199870937,76561197985649641,its familiar yet new i spent most of my time in age of wonders 2 this is the same age of wonders but just a lot more of it,True,0,0,0.5,0,True,False,False,Age of Wonders
1669000,199835177,76561198158570094,i just bought this on the first day of summer sale and im already 80 hours in man i wish i wouldve bought this in stead of civ 7for the price i paid for civ 7 i could get this base game plus tons of dlc and have a hell of a lot more fun highly recommend,True,1,0,0.5,0,True,False,False,Age of Wonders
1669000,199822281,76561198053226900,its masters of magic on steroids,True,1,0,0.5,0,True,False,False,Age of Wonders
1669000,199818556,76561199550998617,i did a thing,True,1,0,0.5,0,True,False,False,Age of Wonders
1669000,199810894,76561198045248468,yes,True,1,0,0.5,0,False,False,False,Age of Wonders
1669000,199810791,76561198005246778,what a beautiful and utterly replayable game this is  it will take many hours before i will understand how everything works completely ergo before i get bored,True,1,0,0.5,0,True,False,False,Age of Wonders
1669000,199796561,76561198101994714,3,True,0,0,0.5,0,True,False,False,Age of Wonders
1669000,199746674,76561198061255959,gonna keep it short so i can go back to playing age of wonders 4 is awesome it is consuming all of my time i am buying the dlc one after the other like an addict 910 for me overall,True,0,0,0.5,0,True,False,False,Age of Wonders
1669000,199722118,76561198101930508,2 years later servers are still unstable as hell not recommended until the issue is fixed,False,4,0,0.5167167782783508,0,False,False,False,Age of Wonders
1669000,199691426,76561198023886735,absolute banger of a game im keep getting fucked by ai though its like heroes but expanded a lot there are things i dont really understand i tend to learn the game by losing and finding out stuff by myself instead of reading so it might take me a while to get used to all the systems but i absolutely recommend,True,0,0,0.5,0,False,False,False,Age of Wonders
1669000,199638168,76561198041464826,neat,True,1,0,0.5,0,True,False,False,Age of Wonders
