appid,recommendationid,author_steamid,review,voted_up,votes_up,votes_funny,weighted_vote_score,comment_count,steam_purchase,received_for_free,written_during_early_access,game_title
238910,34966287,76561198111375946,good for potato not so good playing on an actual pc  looks old too reminds me of a certain game i used to play back in browsers,True,0,0,0.4184756875038146,0,False,True,False,Bionic Dues
238910,34951215,76561198052254672,quick fun pacing is weird but redeemable amazing title music,True,0,0,0.4414170980453491,0,False,False,False,Bionic Dues
238910,34395002,76561198251146402,very cool game to play on potato pc  we can just unlock and customise your character and so on the mission,True,0,1,0.4577407240867614,0,False,False,False,Bionic Dues
238910,33901352,76561198040649499,an enjoyable game with a few niggling issues it definitely gets tedious and repetitive by the end of a campaign but the gradual advancement and improvement and tactics along the way are enough to earn a recommendation,True,0,1,0.5,0,False,False,False,Bionic Dues
238910,33779084,76561198013296662,worth it just for the mainscreen music alone,True,0,0,0.4664933383464813,0,True,False,False,Bionic Dues
238910,33547516,76561198133910393,fun with a bit of a challenge even on lower difficulties,True,0,0,0.5,0,False,False,False,Bionic Dues
238910,32335898,76561198113965959,if someones got a low end pc and is into retro games or a something similar you wont be dissapointed with this game,True,2,0,0.5149552822113037,0,False,False,False,Bionic Dues
238910,31655113,76561197971288377,ignore the name and give it a try if you like randomly generated roguelike turn based combat,True,4,1,0.5187059640884399,0,True,False,False,Bionic Dues
238910,30592620,76561198184553638,i acctually very like this game its worthy the 10 bucks,True,0,0,0.4666800498962402,0,False,False,False,Bionic Dues
238910,30256160,76561198006430824,good game but a little confusing at first,True,0,0,0.5,0,False,False,False,Bionic Dues
238910,29952883,76561198126081939,it was fun until it lasted it worked well on linux platform until it started to get huge response delays tried repairing reinstalling with no luck the next patches havent fixed that so needed to delete it it is sad really as the game was ok nice strategy elements with ok graphic,False,5,1,0.4426106810569763,1,False,False,False,Bionic Dues
238910,29648880,76561198077364838,great game i cant stop playing it whenver i started a new game ,True,4,0,0.4477902054786682,0,False,False,False,Bionic Dues
238910,29267346,76561198007989815,good,True,3,0,0.5278672575950621,0,False,False,False,Bionic Dues
238910,29123258,76561198075875415,thats my game ,True,1,0,0.4124642014503479,0,False,False,False,Bionic Dues
238910,29091926,76561197973669178,remember that game you cant remember from when you were a kid this is it,True,1,1,0.4903039336204528,0,True,False,False,Bionic Dues
238910,29022204,76561197999776191,this is a fun lite game with tons of replayability  if you like ftl or out there youll like this too,True,1,1,0.4909886717796325,0,True,False,False,Bionic Dues
