appid,recommendationid,author_steamid,review,voted_up,votes_up,votes_funny,weighted_vote_score,comment_count,steam_purchase,received_for_free,written_during_early_access,game_title
239250,162219327,76561198118210659,"castlevania lords of shadow 2 is a meticulously detailed game with highly creative environments the castle areas look absolutely brilliant and the character designs especially those of the bosses are insanely awesome and original   if youre a fan of dark and rich tones this game delivers an engaging experience that stands apart from most others",True,0,0,0.5,0,False,False,False,Castlevania: Lords of Shadow 2
239250,162154852,76561199036516634,amazing and fun game ,True,0,0,0.5,0,True,False,False,Castlevania: Lords of Shadow 2
239250,161994139,76561199236978144,fun,True,0,0,0.5,0,True,False,False,Castlevania: Lords of Shadow 2
239250,161895113,76561198104189070,good game play and i like the new take on the dracula story line,True,0,0,0.5,0,True,False,False,Castlevania: Lords of Shadow 2
239250,161352219,76561198035332447,"very good game a bit worse than the first has some powerful emotional scenes  the bosses are the highlight",True,0,0,0.5,0,True,False,False,Castlevania: Lords of Shadow 2
239250,160551744,76561198082983881,cant recommend it enough played the guts out of it back when i had an xbox one and now replaying it for the first time on pc just remember to change the resolution manually inside documentsmercurysteam ,True,0,0,0.5,0,True,False,False,Castlevania: Lords of Shadow 2
239250,160541156,76561198086887501,great game 910,True,0,0,0.4755944907665252,0,False,False,False,Castlevania: Lords of Shadow 2
239250,160474882,76561198858228553,oh god the difference with the first one is abyssmal and not in good way the stealth missions are really boring and the platforming and combat are really tedious play the first one and mirror of fate and forget this game exists,False,2,0,0.4768098890781402,0,True,False,False,Castlevania: Lords of Shadow 2
239250,159242803,76561199037920034,still good to play,True,1,0,0.5,0,True,False,False,Castlevania: Lords of Shadow 2
239250,158702513,76561198129950934,great fun,True,1,0,0.5,0,True,False,False,Castlevania: Lords of Shadow 2
239250,158211580,76561198169429161,good game,True,1,0,0.5,0,True,False,False,Castlevania: Lords of Shadow 2
239250,158032947,76561199126665499,played it on the 360 replayed for nostalgia p,True,2,0,0.5,0,True,False,False,Castlevania: Lords of Shadow 2
