appid,recommendationid,author_steamid,review,voted_up,votes_up,votes_funny,weighted_vote_score,comment_count,steam_purchase,received_for_free,written_during_early_access,game_title
1016800,190452829,76561198236804210,very fun,True,0,0,0.5,0,True,False,False,Chernobylite
1016800,190362327,76561199576478340,one of my favorite games i have ever played if you have never played it get it wonderfull survival game,True,0,0,0.5,0,True,False,False,Chernobylite
1016800,190360344,76561198260504186,simple game cool atmosphere good game play give it a shot friend,True,0,0,0.5,0,True,False,False,Chernobylite
1016800,190311239,76561199561085493,absolute cinema  1010,True,0,0,0.5,0,True,False,False,Chernobylite
1016800,190292514,76561199506702103,a very good game for those who love chernobyl,True,0,0,0.5,0,True,False,False,Chernobylite
