appid,recommendationid,author_steamid,review,voted_up,votes_up,votes_funny,weighted_vote_score,comment_count,steam_purchase,received_for_free,written_during_early_access,game_title
256290,201458117,76561198061877564,this game is a lot of fun  highly recommended,True,0,0,0.5,0,True,False,False,Child of Light
256290,201380765,76561198060975246,amazing game truly great work by the devs using the mouse for different actions is so interactive   the dialogue is super  everything rimes its just a well rounded game and should be an example for future game devs i only paid 5 dollars and its worth a lot more   super happy with the game and would recommend to anyone,True,0,0,0.5,0,True,False,False,Child of Light
256290,200428530,76561198078028340,everything about this game is beutiful music artwork and even the game play is smooth if you like turn based games you need to play this one,True,2,0,0.5272932052612304,0,False,False,False,Child of Light
256290,200373160,76561197974081705,this is an intriguing concept that isnt implemented very well the art style implies a rich and captivating setting but the actual game is bland and unengaging it gets some bonus points for a character whose inability to make rhymes got me to laugh out loud a few times but its not enough for a recommendation,False,3,0,0.4818840324878692,0,True,False,False,Child of Light
256290,200361182,76561198201649618,a lovely little game,True,0,0,0.5,0,True,False,False,Child of Light
256290,199958847,76561198156118003,oh this game looks nice lets open it and  cant open the singleplayer game without creating ubisoft account and being connected to the internet   immediately deletes the game gives a bad review and blocks anything and everything from ubisoft forever ,False,10,3,0.5982378721237182,0,True,False,False,Child of Light
256290,199941991,76561198040859934,good,True,0,0,0.5,0,True,False,False,Child of Light
256290,199282928,76561198822296678,a beautiful game,True,0,0,0.5,0,True,False,False,Child of Light
256290,198951409,76561198314681012,i love this game the storybook aesthetic is fantastic and and the story is charming this continues to be one of my favorite games i come back to it often its nothing groundbreaking but if you want a solid turnbased rpg that isnt super long and is very cozy then this is the game for you the story is solid if not complicated,True,3,0,0.5571955442428588,0,True,False,False,Child of Light
256290,198792152,76561198863841379,game runs smooth on console ps4 but for some reason it never gets to the menu without crashing i even tried all the solutions and none worked i hope that they fix this but given its a game through steam i wont hold my breath,False,0,0,0.5,0,True,False,False,Child of Light
256290,198787122,76561199473949870,been waiting 11 years worth it,True,1,0,0.4961831867694854,0,True,False,False,Child of Light
256290,198473844,76561199057402415,"the game is really good and its got a nice way to mess around with your emotions sometimes its a fun rpg but can get a bit repetitive but its fun thinking whats the best things for each fight n all fun game overall",True,0,0,0.5,0,True,False,False,Child of Light
256290,198312158,76561197972482544,simply one of the best independent games out there  thoroughly replayable and such a story the watercolor art and soundtrack are chefs kiss,True,0,0,0.4761904776096343,0,True,False,False,Child of Light
256290,197936832,76561197982075056,ubisoft launcher has broken half my games,False,4,0,0.5431472063064575,0,True,False,False,Child of Light
256290,197908232,76561198072940565,one of my favorite games the art style is beautiful the music is epic and harmonic along with all of the characters rhyming in a charming way the game is one of the best examples of this art in gaming however unfortunately it is completely unable to launch for me and many others if you have any other platforms playstation xbox nintendo id recommend purchasing the game there it very often goes on sale,False,5,0,0.5478097200393676,0,True,False,False,Child of Light
256290,197744452,76561198167330403,i never actually played this game all the way through the protagonist moved so slow i almost immediately got annoyed and put it down,False,2,0,0.4581258594989776,0,True,False,False,Child of Light
256290,197434012,76561198080706431,used to really enjoy this game came back to play it only to not be able to launch it crashes instantly on startup and none of the fixes ive tried have resolved the problem i would have recommended this game years ago but now you cant even play it,False,4,0,0.5491329431533813,0,True,False,False,Child of Light
256290,197328468,76561198050145998,this game awakened a feeling i thought i had lost about playing videogames so beautiful,True,0,0,0.5,0,False,False,False,Child of Light
256290,197269744,76561197985367184,have to create an ubisoft account  nope  guess i wasted my cash on this one  im not messing around with that crap,False,2,0,0.5177969336509703,0,True,False,False,Child of Light
256290,197102870,76561198847384952,please dont buy  crashes instantly  unplayable,False,4,0,0.5478261113166809,0,True,False,False,Child of Light
256290,197038442,76561199572692599,song is nice,True,0,0,0.5,0,True,False,False,Child of Light
256290,196638656,76561198025950893,does not support steam family as advertised forces to create a ubisoft account forces download ubisoft connect  only to not even run when launched   classic ubisoft,False,5,0,0.5966193079948425,0,True,False,False,Child of Light
256290,196342174,76561198026197664,a sweet and charming rpg with some fun turnbased combat elements,True,1,0,0.5,0,True,False,False,Child of Light
256290,196307277,76561197993603694,my six years old daughter says its her a favorite game because it has a female protagonist there are few game for kids where you can play with a female protagonist  this game will likely be too boring and basic for adults compared to platformers like rayman or western rpgs this is a poor coop game so dont buy it for that,True,4,0,0.4992496371269226,0,True,False,False,Child of Light
256290,195592059,76561199734024386,this game is a strong memory from my childhood i love love love it,True,3,0,0.5165745615959167,0,True,False,False,Child of Light
256290,194900883,76561198352175737,great story fun rpg mechanics would love to see steam achievements added to the game but not needed to enjoy the game,True,0,0,0.5,0,True,False,False,Child of Light
256290,194637957,76561199376101159,a beautiful game inside and out i thought the turn based fighting was really interesting and unique with the speeds and the set backs etc it was a little weird tbh the main character sharing my name and also losing her mom but i really enjoyed it overall and think it was worth the money definitely a new favourite,True,0,0,0.5,0,True,False,False,Child of Light
256290,193902039,76561197993403362,replaying currently after beating the game almost a decade ago still fire,True,5,0,0.5882352590560913,0,True,False,False,Child of Light
256290,193726032,76561198118158004,ive played this game 11 years ago and it still charms me most play for any jrpg fan,True,0,0,0.5,0,True,False,False,Child of Light
256290,193485654,76561197991180290,"while exceptionally beautiful visually the gameplay loop isnt super fun and is incredibly slow and repetitive  i also dont like the rhyming thing but appreciate the effort",False,4,0,0.4612675905227661,0,True,False,False,Child of Light
256290,193306684,76561198844793632,i was sleeping like a log after i played this game ever i got subdued and calming peaceful feelings from it and i absolutely was absorbed in this game,True,0,0,0.5,0,True,False,False,Child of Light
256290,193302642,76561198009951571,crashing while opening cant play edit to fix check here httpssteamcommunitycomapp256290discussions03825289852129186055,True,1,0,0.5238095521926879,0,True,False,False,Child of Light
256290,193174405,76561198276503054,short but very sweet,True,0,0,0.5,0,True,False,False,Child of Light
256290,192770304,76561198064241079,a good game but it does require a bit of technical knowhow depending on your computer in order for it to run properly otherwise a very good game with good music,True,0,0,0.5,0,False,False,False,Child of Light
256290,192493661,76561198277363917,crashes when launched,False,5,1,0.5416666865348815,0,True,False,False,Child of Light
256290,192292713,76561198408012990,the combat mechanic is quite nice and while it may be cozy it still holds a lot of intrigue,True,0,0,0.5,0,True,False,False,Child of Light
256290,192291013,76561198160700469,the light made the child blind maybe shouldntve look at the sun for so long,True,3,0,0.4951664209365844,0,True,False,False,Child of Light
256290,191742010,76561198024055363,game crash at opening,False,4,0,0.5,0,True,False,False,Child of Light
256290,191736122,76561199553377128,this game is just such a vibe girl  3,True,2,0,0.52173912525177,0,True,False,False,Child of Light
256290,191518236,76561198005482051,short but sweet amazing game,True,1,0,0.5238095521926879,0,True,False,False,Child of Light
256290,190755427,76561199065188327,beautiful art and soundtrack gameplay is fun and not too difficult for more casual players easy to figure out if youre new to turn based combat played this game on the playstation as a kid over and over years later and it still has the same magic this game has a special place in my heart,True,1,0,0.493397831916809,0,True,False,False,Child of Light
256290,190238347,76561199119792704,game wont open,False,7,1,0.5199999809265136,0,True,True,False,Child of Light
256290,189456265,76561198019289003,really good game honestly i played on console or something but its a lovely experience beautiful game,True,1,0,0.5238095521926879,0,True,False,False,Child of Light
256290,189009748,76561197984715433,2d games remind me of the earlier genre of games in arcades,True,0,0,0.5,0,True,False,False,Child of Light
256290,188957415,76561198265394207,requires ubisoft login ubisoft wont accept my password and is unable to reset it shame,False,7,1,0.5416666865348815,0,True,False,False,Child of Light
256290,188549800,76561199094784386,love this game big childhood staple,True,0,0,0.5,0,True,False,False,Child of Light
256290,187048062,76561198135566717,beautiful game and world fun turn based combat side scrolling exploration wisp mechanic is unique and fun shame its owned by ubisoft but other then that one of the best games out there,True,2,0,0.5238095521926879,0,True,False,False,Child of Light
256290,186474329,76561198042282695,slow to start but ultimately fantastic,True,1,0,0.5,0,False,False,False,Child of Light
256290,186059454,76561198048450730,tried to load the game up and cant play it as its asking me to login to ubisoft connect of which i dont have an account i paid for this game but cant play it without creating an account on a third party service wtf is this,False,15,1,0.6003364324569702,0,True,False,False,Child of Light
256290,185949198,76561199550705884,the music art everything is just mwah,True,1,0,0.4935897290706634,0,True,False,False,Child of Light
256290,185607200,76561198309928934,breathtaking experience,True,0,0,0.4697986543178558,0,True,False,False,Child of Light
256290,185304544,76561197963142083,beautiful adventure with gameplay that you can enjoy together with your child or just on your own the adventure is quite linear which in a game like this is a plus i would say its like playing a storybook and the turn based battles are well balanced and you have time to explain what the different skills and attacks do rather than having to take over battles because its too difficult or fast for a younger player,True,1,0,0.5,0,True,False,False,Child of Light
256290,185145756,76561198142584415,overall fun game good mechanics design story good controls,True,1,0,0.5238095521926879,0,True,False,False,Child of Light
256290,184765827,76561198807817318,"pros beautiful art style touching story cool party members innovative fighting system a lot to explore  cons sidequests can be confusing  conclusion overall child of light is a breathtakingly beautiful rpg that masterfully blends art story and gameplay into a heartfelt fairy tale adventure despite occasional confusion with sidequests its charm and creativity make it a mustplay experience",True,2,0,0.4947218000888824,0,True,False,False,Child of Light
256290,183867792,76561199200786348,its great and addicting super recommend,True,4,0,0.5604808330535888,0,True,False,False,Child of Light
256290,183631989,76561197963740626,very fun rpg with beautiful art though it is a little short and the rpg elements are a little shallow i would play more like it worth the price,True,0,0,0.5,0,True,False,False,Child of Light
256290,183385973,76561198051587638,the art is exceptional and the combat system is fun everything rhymes and the story is nice i had a lot of fun and really started getting into it and then it suddenly it just finished unexpectedly i wish it would have been a longer game as it can be completed in just 10 hours totally fun and worth it though,True,5,0,0.5454545617103576,0,True,False,False,Child of Light
256290,183313085,76561198136721098,i think this is cute but you have to be ok with the endless poetry its a lot,True,1,0,0.5181218981742858,0,True,False,False,Child of Light
256290,182075566,76561198970527987,"very charming and fun game  the music stays in my mind long after ive stopped playing  the gameplay is simple enough to get used to but not too easy as to get bored with    not flawless there is a glitch that makes only a fourth of the dialogue appear unless a new save file is started  also about half the time i open the game it and hit continue it crashes but then runs perfectly when i open it again",True,1,0,0.5,0,True,False,False,Child of Light
256290,181595938,76561199379228815,the moment i am writing this is the moment i finished the game and what i can say is this game is a masterpiece good soundtrack  good lorestorytelling good bosses and a good ending everytime i hear the flute song i cry definitely a 1010 from ubisoft if you have the money buy and play it perfect game,True,0,0,0.5,0,True,False,False,Child of Light
256290,181486755,76561199011361148,awesome,True,0,0,0.5,0,True,False,False,Child of Light
256290,181296027,76561198398112315,"beautiful and concise i feel it was quite hard at the start played in casual easier as we go but enough difficulty overall really love the battle system with its active time and slowing mechanic  the writing and the world is beautiful the dialogues are like poetry and the world feels like a nicely illustrated storybook especially the towns",True,1,0,0.5,0,True,False,False,Child of Light
256290,181156420,76561198312893989,very fun similar to a dnd campaign in terms of story,True,0,0,0.5,0,True,False,False,Child of Light
256290,180854215,76561198185951998,i just hope this beautiful game needs to be sequel i really like the characters like aurora or norahnox but fuck the ubisoft they really shutdown the ubiart framework like rayman series and then opening the game need to open uplay account and i lost my savegame because uplay update,False,10,0,0.5515433549880981,0,True,False,False,Child of Light
256290,180625792,76561198352259892,genuinely one of the most nostalgic games for me totally worth all the battles for the story,True,0,0,0.5,0,True,False,False,Child of Light
256290,179771769,76561198042020171,very fun with minimal grinding and a good story and art combat can be a little repetitive but that can be said for any game after a while would say if you enjoy rpgs get this game has everything you could want in that category 910,True,0,0,0.5,0,True,False,False,Child of Light
256290,178802548,76561198008081447,wish the whole game would be voiced but its still a good game,True,2,0,0.5435684919357299,0,True,False,False,Child of Light
256290,178579888,76561198830235752,growing as i fly i dream in watercolor why should i wake up,True,0,0,0.5,0,True,False,False,Child of Light
256290,178514569,76561198446813802,i played it many years ago ive always wanted to for the sake of the games visuals and sound effects beautiful my friend got this for me and ive been able to finish the storyline in less than a week lol,True,0,0,0.5,0,False,True,False,Child of Light
256290,177938095,76561198056381365,this game crashes on start up do not purchase,False,3,0,0.4987795054912567,1,True,False,False,Child of Light
256290,177812773,76561198256728918,the art and soundtrack really make this game what it is the gameplay is serviceable but far from great,True,0,0,0.5,0,True,False,False,Child of Light
256290,177363173,76561198121663538,"and ill be waiting for a sign youre coming back and you have found your path ",True,1,0,0.5238095521926879,0,True,False,False,Child of Light
256290,177355063,76561197992013023,i had this back on xbox and loved it  i wanted to try playing it with my daughter and it was on sale but apparently even though the steam deck recognizes the 8bitdo 2 controller ubisoft doesnt so we cant play this on the tv  ubisoft you didnt even have to make a new game just make sure it doesnt treat the steam deck like a pc and actually allow bluetooth controllers to work  this is pathetic,False,6,0,0.5866948366165161,0,True,False,False,Child of Light
256290,177166404,76561198068017936,work of art,True,0,0,0.5,0,True,False,False,Child of Light
256290,177073282,76561198065788572,gotta love this one good story and visuals,True,0,0,0.5,0,True,False,False,Child of Light
256290,177066420,76561198025490757,a great turnbased rpg that feels like playing through a fairy tale which was very much the intent of the developers beautiful music and art direction,True,3,0,0.5429815053939819,0,True,False,False,Child of Light
256290,176771273,76561198083086542,what a delightful piece of magic 3 so incredibly enjoyable from start 2 finish w amazing turnbased combat  a wholesome tale to accompany it so charming a must play ,True,2,0,0.5,0,True,False,False,Child of Light
256290,176447544,76561198059804297,passable rpg with cute characters and theming get it on sale and you wont regret it,True,3,0,0.548872172832489,0,True,False,False,Child of Light
256290,176431663,76561198008899197,absolutely beautiful game from start to finish  the gameplay didnt grab me that much as someone who doesnt play many turnbase rpgs but the story characters and presentation is what sells it and it doesnt overstay its welcome all of it would make an awesome sequel which id love to see one day even if its unlikely we would get one,True,2,0,0.518750011920929,0,True,False,False,Child of Light
256290,176043899,76561199010059989,this game is one of the most unique games ive ever played its amazing and fun and the story is intriguing and the gameplay is fun it requires some skill in strategy but its a great game to play for all ages,True,6,0,0.5812562108039855,0,True,False,False,Child of Light
256290,175785927,76561199122301324,peak,True,0,0,0.4655009508132934,0,True,False,False,Child of Light
256290,175776119,76561198060480446,really engaging turn based combat highly recommend,True,0,0,0.5,0,True,False,False,Child of Light
256290,175728122,76561198006530348,requires ubi soft play network which is defunct for this game  basically unplayable  a real shame it had promise,False,5,0,0.5568181872367858,0,True,False,False,Child of Light
256290,175698557,76561198111302308,i love this game,True,0,0,0.5,0,True,False,False,Child of Light
256290,175668516,76561198046559721,monarchic doki doki literature club,True,1,0,0.5199999809265136,0,True,False,False,Child of Light
256290,175584920,76561198069476320,ubisoft wont let me play because uplay doesnt recognize that i have this even though i bought it here on steam and went back and forth with their terrible support team for over 3 hours and gave them every bit of evidence they asked for to show i owned it  uplay games on steam need the same warningnotice that games that require a psn account have,False,2,0,0.5214481353759765,0,True,False,False,Child of Light
256290,175119143,76561198107936755,do not purchase ubisoft will take your right to your game away from you they said they cannot find a purchase on my account with all the proof ive shown do not give them your money unless you are willing to lose the game,False,6,0,0.588469088077545,0,True,False,False,Child of Light
256290,175078869,76561199041505082,i was enamored by this game since i was 12 often watching full game play playthroughs yearly a decade later i finally got the opportunity to play it myself and its as charming and beautiful as i remembered i will likely return to this fairytale every year and if i have children someday this is definitely a game i would love to show them 3,True,0,0,0.5,0,True,False,False,Child of Light
256290,174826410,76561198155477952,probably in my top 3 favorite games of all time,True,0,0,0.5,0,True,False,False,Child of Light
256290,174748824,76561198208738944,,True,0,0,0.5,0,True,False,False,Child of Light
256290,174485626,76561197985211843,whats not to like great story nice combat wonderful artwork,True,0,0,0.5,0,True,False,False,Child of Light
256290,174221555,76561199178788640,this disgustingly outstanding masterpiece will forever hold a place in my heart,True,0,0,0.5,0,True,False,False,Child of Light
256290,174197465,76561197969836735,the game has never launched successfully for me massive failure by the required ubisoft game launcher application ill have to remember never to buy an ubisoft game again,False,7,0,0.6056041121482849,0,True,False,False,Child of Light
256290,174115990,76561198043850137,beautiful game with cute story and dialogs,True,0,0,0.5,0,True,False,False,Child of Light
256290,173570500,76561198142055617,played this game on console 10y ago and now on pc  still amazing and equally good the dialogue rhymes in english and in german theres a decent character development throughout the game for the mc and companions minor crafting with crystals riddles side quests and very calming soundtrack by cur de pirate if youre looking for a cozy strategic turnbased rpg  this is it,True,0,0,0.5,0,True,False,False,Child of Light
256290,173461702,76561198144073806,i found this game on a whim years ago after watching someone on youtube play the first 30 minutes or so of the game ive loved it ever since and always find a way back to it the story the characters and the visuals are so beautiful,True,0,0,0.5,0,True,False,False,Child of Light
256290,173281246,76561198312678649,"adorable and whimsical game one of my favorites  but you must use this fix httpssteamcommunitycomapp256290discussions03825289852129186055 to avoid a crash on start if your pc has more than 16 cores works like a charm annoying that i have to do that at all",True,1,0,0.5153061151504515,0,True,False,False,Child of Light
256290,173022049,76561198028088050,great artstyle fun story,True,0,0,0.5,0,True,False,False,Child of Light
256290,172928323,76561197961281109,just a wonderful experience,True,0,0,0.5,0,True,False,False,Child of Light
256290,172587332,76561199355793203,only ubisoft game i will ever respect  artstyle is gorgeous music great and overall is a pretty entertaining rpg my favourite part is the rhymes in every dialogue and even in my mother tongue spanish,True,2,0,0.5258620381355285,0,True,False,False,Child of Light
256290,172433111,76561198230944388,very elegant rpg with interesting combat mechanics  on top of that it has gorgeous art style and outstanding soundtrack navigating throught the world in 2d painting like envirments is always pleasant other than that its a very standard game of its genre a very competent one thought,True,0,0,0.5,0,True,False,False,Child of Light
256290,172280189,76561198831221055,very good game used to play it on the ps3 with my dad very pretty,True,0,0,0.5,0,False,False,False,Child of Light
256290,172250571,76561198010164929,absolutely beautiful if a bit unfinished rpg intended to be played with a child on your lap,True,0,0,0.5,0,False,False,False,Child of Light
256290,172062272,76561198302548069,this is one of my favorite games i love the storyline art and this games style of turnbased fighting,True,0,0,0.5,0,True,False,False,Child of Light
256290,172032188,76561198159760055,great,True,0,0,0.5,0,True,False,False,Child of Light
256290,172019738,76561198105618086,gameplay is ok music and art are amazing,True,0,0,0.5,0,True,False,False,Child of Light
256290,171275553,76561199192811489,best game for pc and playstation 4 pc is better tho ubisoft still w ea and adobe the worst company still greatest game of all time,True,1,0,0.5238095521926879,0,True,False,False,Child of Light
256290,170760453,76561198283856558,another aurora to cherish too bad it came from ubisoft,True,1,0,0.5,0,True,False,False,Child of Light
256290,170709386,76561198028136081,cute game with a great score,True,0,0,0.5,0,True,False,False,Child of Light
256290,170444713,76561198018673435,so i did the 16 core hack and it got me past the white screen and i played up to level 15  now though whenever i get to the main menu and select anything options new game continue the game crashes so i give up  it is a pretty game but apparently it doesnt want to be played,False,0,0,0.4761904776096343,1,True,False,False,Child of Light
256290,170395398,76561198176737871,not clicking super well with the turn based part of this game but it is so so pretty,True,0,0,0.5,0,True,False,False,Child of Light
256290,170354632,76561198388890281,played this years ago and still holds up amazing game with beautiful artwork,True,0,0,0.5,0,True,False,False,Child of Light
256290,170313745,76561197973934139,child of light is not so difficult to play there are games i had to quit i just couldnt get pass level 2 or 3  i hate that child of light is for the artist or people that take there time in life exploring museums people watching    the pastels are beautiful  iv played it twice,True,1,0,0.5238095521926879,0,True,False,False,Child of Light
