appid,recommendationid,author_steamid,review,voted_up,votes_up,votes_funny,weighted_vote_score,comment_count,steam_purchase,received_for_free,written_during_early_access,game_title
256290,170106242,76561198042682787,runs perfectly on the steam deck despite it being an ea title,True,2,0,0.5074626803398132,0,True,False,False,Child of Light
256290,169732456,76561198051519329,nostalgic game great ost,True,0,0,0.5,0,True,False,False,Child of Light
256290,169362354,76561198297407271,wonderful atmosphere pleasant gameplay and one of the most beautiful soundtracks auroras theme has been my obsession for years now and its not going to stop any time soon one of my favorite indie games ever,True,0,0,0.5,0,True,False,False,Child of Light
256290,169253994,76561198418001360,1010 for storyline puzzles combat  artstyle 3,True,0,0,0.5,0,True,False,False,Child of Light
256290,169163605,76561197993641208,a fairy tale in videogame format,True,0,0,0.5,0,True,False,False,Child of Light
256290,168936352,76561198981935960,my favorite game maybe of all time beautiful music and art fun and interesting characters a lovely story that all happens through rhymes an amazing fairy tale game,True,2,0,0.538922131061554,0,True,False,False,Child of Light
256290,168601751,76561199491323083,i try to play it but it just kept crashing,False,3,0,0.5394313335418701,0,True,False,False,Child of Light
256290,168296534,76561198121712085,nice game would play again,True,0,0,0.5,0,True,False,False,Child of Light
256290,168287535,76561198040615358,i played this one through to the end  very rare i do that thought i better pipe in with the mixed recent reviews its really the artistic style that kept me going its rather too easy to make it a proper fulfilling experience still i would recommend after you try the demo,True,0,0,0.5,0,True,False,False,Child of Light
256290,168116218,76561198982150264,doesnt work on my modern pc even with community made fixes  and ubisoft isnt going to update it to fix it,False,0,0,0.5341728925704956,0,True,False,False,Child of Light
256290,168106159,76561198283103844,good game beautiful art style and soundtrack good exploring and gameplay reminiscing of jrpgs,True,0,0,0.5,0,True,False,False,Child of Light
256290,167825841,76561198880925268,nice relaxing game for a few hours,True,0,0,0.5,0,True,False,False,Child of Light
256290,167718228,76561198189284883,i watched jesse cox play this game at 10 years old and i played it at 20 years old,True,0,0,0.5,0,True,False,False,Child of Light
256290,166731922,76561197993873024,ubisoft connect,False,13,0,0.5712316632270812,0,True,False,False,Child of Light
256290,166706099,76561199583655727,the game is absolutely beautiful the art  the music and the story  however i couldnt finish it due to the technical issues i experienced with this game launching the game was a horrible experience and playing it is worse it keeps kicking me out of the game constantly save your time and money and find another game until they fix this problem,False,4,0,0.5349296927452087,1,False,False,False,Child of Light
256290,166649075,76561198107642435,great game,True,0,0,0.5,0,True,False,False,Child of Light
256290,166646926,76561198022407708,this game is so beautiful and the writings are so poetic which sometimes makes it hard to understand the art style is water coloured and the a journey with friends  memorable characters  to save a world from devastation  is not a long game and well suited for busy adults like me  splendid  highly recommend to pick this one up rate 85  10,True,1,0,0.518750011920929,0,True,False,False,Child of Light
256290,166097401,76561198441935160,fun game and the art style  dialogue is amazing,True,0,0,0.5,0,True,False,False,Child of Light
256290,166073624,76561198059003109,a beautiful game with wonderful music and also great gameplay i play this every year or so its one of my favorites,True,0,0,0.5,0,True,False,False,Child of Light
256290,165978376,76561198167762874,their launcher wont even let me play the game trying to bind it a second time to another account which obviously wont work theres even no way of changing anything so im basically locked out of the game after only playing it one time stay away from their shitty launcher shame since the game seemed good,False,3,0,0.5464006662368774,0,True,False,False,Child of Light
256290,165698967,76561199652271951,great story graphicsart and soundtrack everything about it was pretty amazing but the turnbased fights were a rough time for me highly recommend to play just for the story alone,True,0,0,0.5,0,False,False,False,Child of Light
256290,165636841,76561198398991544,beautiful,True,0,0,0.5,0,True,False,False,Child of Light
256290,165615187,76561198131565458,i like this game used to play it on my shit laptop and it plays well,True,0,0,0.5,0,True,False,False,Child of Light
256290,165425063,76561197960960793,if it wasnt ubisoft this game would have a better review ratio this is a great game,True,3,0,0.5138888955116271,0,True,False,False,Child of Light
256290,165265520,76561199216770356,w game,True,0,0,0.5,0,True,False,False,Child of Light
256290,164938531,76561198084147535,amasinggggggg,True,0,0,0.5,0,True,False,False,Child of Light
