appid,recommendationid,author_steamid,review,voted_up,votes_up,votes_funny,weighted_vote_score,comment_count,steam_purchase,received_for_free,written_during_early_access,game_title
595520,201809644,76561199142182661,"like story gameplay progress dislike too dark",True,0,0,0.5,0,True,False,False,Final Fantasy XII: The Zodiac Age
595520,201806441,76561198193842167,love the zodiac job system much better than the ps2 original,True,0,0,0.5,0,True,False,False,Final Fantasy XII: The Zodiac Age
595520,201721435,76561198210694820,"favorite game in the series ivalice is the most fleshed out and interesting world the franchise has ever created and its a shame they dont explore it more  the gambit system is really cool and makes this game play incredibly smooth 1010 cannot recommend it highly enough",True,0,0,0.5,0,True,False,False,Final Fantasy XII: The Zodiac Age
595520,201476244,76561198178547607,fan for a long time have adhd and for some reason am about to complete my third play threw of this game love it its jank its game breaking qualities if you know them but its very rewarding,True,0,0,0.5,0,True,True,False,Final Fantasy XII: The Zodiac Age
595520,201443591,76561198070819210,i played this originally on ps2 it was one of my favorite games im now playing it with the struggle for freedom mod with some graphics upgrades im enjoying it sooooo much,True,0,0,0.5,0,True,False,False,Final Fantasy XII: The Zodiac Age
595520,201404823,76561198258418674,this game is sick and since you can play it in japanese you dont have to listen to vaans whiny voice which was really the only major bummer from the og 1010 would play again,True,0,1,0.5,0,True,False,False,Final Fantasy XII: The Zodiac Age
595520,201324707,76561198062483972,1010 one of the best ff game i played,True,0,1,0.5,0,False,False,False,Final Fantasy XII: The Zodiac Age
595520,201299693,76561199127628696,nostalgia,True,0,0,0.5,0,True,False,False,Final Fantasy XII: The Zodiac Age
595520,201195805,76561198070856373,bunny girl and her friends save the world,True,1,0,0.5,0,True,False,False,Final Fantasy XII: The Zodiac Age
595520,201107769,76561198040209894,this game has a lot of content and fun rpg mechanics  the jobs are fun to play around with and build and the story is intriguing once it gets going  all the characters are fun but none of them are necessarily iconic  the fast forward button is a godsend in this game,True,0,0,0.5,0,False,False,False,Final Fantasy XII: The Zodiac Age
595520,200998511,76561198020439373,hidden gem of the classic ff series it kind of starts playing itself towards the end of the game but the character writing makes up for many flaws,True,0,0,0.5,0,True,False,False,Final Fantasy XII: The Zodiac Age
595520,200936732,76561197960454691,the last good final fantasy,True,0,0,0.5,0,True,False,False,Final Fantasy XII: The Zodiac Age
595520,200852474,76561198188844905,one of the best from the final fantasy series,True,0,0,0.5,0,True,False,False,Final Fantasy XII: The Zodiac Age
595520,200842851,76561197960920323,absolutely fantastic 1010,True,0,0,0.5,0,True,False,False,Final Fantasy XII: The Zodiac Age
595520,200779129,76561198031916390,"gambits are my favorite rpg game mechanic avoids the usual issue of having braindead party members and manually inputting fira 50x times against fire weak enemies  my only gripe with this rerelease is the difficulty its way too easy trial mode gives access to broken gear early and dual classing grants too many stats",True,0,0,0.5,0,False,False,False,Final Fantasy XII: The Zodiac Age
595520,200732129,76561198063145653,where to start i think this game is amazing the combat gambit system is fun feels very real time not turn based final fantasy 10 use to be my favorite game but unfortunately rouge galaxy for ps2 took the crown i love how this games story is this is definitely one of my favorite final fantasys i wish it were even longer ha,True,0,0,0.5,0,True,False,False,Final Fantasy XII: The Zodiac Age
595520,200707304,76561198031609146,this game was the pinnacle of this style of final fantasy game to which they never returned imo their best execution of jrpg combat after having played most of the titles from i to xii still worth playing in current day,True,0,0,0.5,0,True,False,False,Final Fantasy XII: The Zodiac Age
595520,200385664,76561198044121334,i like games that play themselves,True,0,0,0.5,0,True,False,False,Final Fantasy XII: The Zodiac Age
595520,200352245,76561198269606793,its peam,True,0,0,0.5,0,True,False,False,Final Fantasy XII: The Zodiac Age
595520,200280490,76561198098866084,great game well ported,True,0,0,0.5,0,True,False,False,Final Fantasy XII: The Zodiac Age
595520,200214613,76561198009635881,its a good port ff12 is a fun game with an interesting story and some cool hunt mechanics the style of combat is different from a lot of the older ff games,True,0,0,0.5,0,True,False,False,Final Fantasy XII: The Zodiac Age
595520,200149703,76561198018345890,after years i was able to play this game again and feel like a child again im glad that even after all this time the game still handles pretty well compared to newer titles i truly recommend it to anybody who wants to try a game from different time back in the ps2 era,True,0,0,0.5,0,True,False,False,Final Fantasy XII: The Zodiac Age
595520,200125459,76561198115878297,i love this game so much,True,0,0,0.5,0,True,False,False,Final Fantasy XII: The Zodiac Age
595520,200097840,76561199323500841,got 14 hours in and now it just black screens on launch uninstall reinstall drivers are updated still black screen loved the original hate that i wasted my time with this,False,0,1,0.5,0,True,False,False,Final Fantasy XII: The Zodiac Age
595520,200084351,76561198083446343,i like the final fantasy serie very much,True,0,0,0.5,0,True,False,False,Final Fantasy XII: The Zodiac Age
595520,200052358,76561198352027957,possibly the best final fantasy experience someone else hasnt already told you to play,True,0,0,0.5,0,True,False,False,Final Fantasy XII: The Zodiac Age
595520,200045935,76561198047158397,"ive only just started and i am very into this game it reminds me of the ffx days the combat is fun and similar enough to old ff to still have that turn based strategic feel but with enough difference to carry the style forward  somehow i missed this gem so i get to experience it for the first time now happy days",True,1,0,0.5,0,True,False,False,Final Fantasy XII: The Zodiac Age
595520,200013916,76561198077413910,fun,True,0,0,0.5,0,True,False,False,Final Fantasy XII: The Zodiac Age
595520,199886163,76561199666303517,had this game back when i was a kid on ps2 loved it then and i still love it now one of my all time favorite final fantasy games,True,0,0,0.5,0,True,False,False,Final Fantasy XII: The Zodiac Age
595520,199787936,76561198061915423,someone please erase my memories so i can experience this for the first time once more,True,0,0,0.5,0,True,False,False,Final Fantasy XII: The Zodiac Age
595520,199684147,76561199069579357,great game 100 completed the achievements and had a blast doing it 1000 rng heavy but that honestly makes the grind twice as fun highly recommend,True,0,0,0.5,0,True,False,False,Final Fantasy XII: The Zodiac Age
595520,199382877,76561198064273337,the game has long has issues with crashing and they are still not fixed its really a very good game otherwise id recommend it if you can play it elsewhere,False,5,8,0.5117074847221375,0,True,False,False,Final Fantasy XII: The Zodiac Age
595520,199149544,76561198177286609,,True,0,0,0.5,0,True,False,False,Final Fantasy XII: The Zodiac Age
595520,199069202,76561198210084013,8510,True,0,0,0.5,0,True,False,False,Final Fantasy XII: The Zodiac Age
595520,199044287,76561198066248283,i aint knew you was chill like that,True,0,1,0.5,0,True,False,False,Final Fantasy XII: The Zodiac Age
595520,198882540,76561198050758697,im captain basch fon ronsenburg of dalmasca,True,2,2,0.5,0,False,False,False,Final Fantasy XII: The Zodiac Age
595520,198851787,76561198052372298,"love this game zodiac age makes it much better than the original without losing anything i have been on a ps1ps2 jrpgrpg kick later and this has been a really fun game to revisit i almost but not quite beat it back in 2006 this time i plan on finishing  just a shame vaans in ithe adds nothing and sounds like a whiny sidekick who wandered into the wrong story",True,1,1,0.5,0,True,False,False,Final Fantasy XII: The Zodiac Age
595520,198710426,76561198951065131,fantastic game trust me get past the first 12 hours and its a fun ride i clocked 49 hours from start to finish just remember there is a game speed option and an open interface map toggle you dont need to keep pausing lol,True,1,0,0.5,0,True,False,False,Final Fantasy XII: The Zodiac Age
595520,198682615,76561199022774452,another good entry in the ff series with a great storyline and characters as usual the altered combat system is a bit of a disappointment for me the turnbyturn strategic choices of the previous games are an important part of ff and in this version it was too difficult to follow the results of each action and adapt strategy accordingly which meant i ended up just taking a brute force approach to most combat still a very good game despite that though,True,0,0,0.5,0,True,False,False,Final Fantasy XII: The Zodiac Age
595520,198604482,76561198058070887,fun,True,0,0,0.5,0,True,False,False,Final Fantasy XII: The Zodiac Age
595520,198498319,76561198167220239,underrated,True,1,0,0.5,0,True,False,False,Final Fantasy XII: The Zodiac Age
595520,198412593,76561198111865003,i like that you can play the story line or explore the world but you also have the options of doing side quests and other tid bits so it is never boring also the npcs all have unique character log and personalities so you are quite compelled to actually read what they are saying some of it can be quite humorous,True,1,0,0.5,0,True,False,False,Final Fantasy XII: The Zodiac Age
595520,198338589,76561198042522900,i think this might be my favorite 3d ff game ever its so good you just keep wanting to play cuz youre like what cool shit is the game gunna throw my way next amazing vaan is boring but i think its needed to make the rest of the cast feel equally important gameplay is what if mmo but single player i love it music is great and catchy visuals and aesthetic is pure kino everything is fire,True,0,2,0.5,0,True,False,False,Final Fantasy XII: The Zodiac Age
595520,198318428,76561197978446243,27 days,True,0,0,0.5,0,True,False,False,Final Fantasy XII: The Zodiac Age
595520,197943305,76561199483241673,classic,True,0,0,0.5,0,False,False,False,Final Fantasy XII: The Zodiac Age
595520,197803270,76561197997142656,,True,1,0,0.5063984990119934,0,False,False,False,Final Fantasy XII: The Zodiac Age
595520,197649913,76561198424487716,ty for the cloud saves steam i was able to pick up where i left off 2 yrs ago id removed unplayed games from my disc drive since then and you guys had them stored on your cloud ty so much,True,0,1,0.5,0,True,False,False,Final Fantasy XII: The Zodiac Age
595520,197528565,76561198038794846,"rebought on steam even after i got the platnium trophey on ps4 love the combat itemization and party building systems  only downside is that its locked to 60fps tears on my 60 fps tv and cannot enable vsync on my 144hz cause it causes the game to speed up",True,0,0,0.5,0,True,False,False,Final Fantasy XII: The Zodiac Age
595520,197474505,76561199231783727,first time playing even though ive owned the game for several years nowboth on the ps2 and now on pc and it is sooooo much better than i thought it would be i wish i had more thumbs to give this game 4 thumbs up,True,0,0,0.5,0,True,False,False,Final Fantasy XII: The Zodiac Age
595520,197367485,76561198155017194,just started playing this after ffx ffx has better characters and a better story but this has better gameplay and music imo   walkthrough httpsgamefaqsgamespotcomps4191202finalfantasyxiithezodiacagefaqs78871introduction,True,0,0,0.5,0,True,False,False,Final Fantasy XII: The Zodiac Age
595520,197363567,76561198171487498,an amazing jrpg lovely story and amazing characters,True,0,0,0.5,0,True,False,False,Final Fantasy XII: The Zodiac Age
595520,197329176,76561198152884989,i have been playing ff12 since it released in 2006 as a kid to today owning it for both console and pc tza is honestly a huge upgrade with how the license boards work making it seem like there is a way to buildcraft a team the way you want to play in combination with a great story and unique combat system that pushed away from the previous games its a great game to be introduced into the series with,True,0,0,0.5,1,False,False,False,Final Fantasy XII: The Zodiac Age
595520,197255206,76561198025181661,ill be honest at first i didnt like this entry into final fantasy i thought the protagonist vaan was insufferable still do actually like japanese take on aladdin butthankfully there are many other characters and stories in this game combat system is different with gambits but ends up being fun to tweak story was entertaining and im impressed with the graphics they managed to squeeze out of the ps2 on its original release recommended,True,0,0,0.5,0,True,False,False,Final Fantasy XII: The Zodiac Age
595520,197193238,76561198171120730,final fantasy but with a semiopen world and smooth combat systems,True,0,0,0.5,0,True,False,False,Final Fantasy XII: The Zodiac Age
595520,197146999,76561198043869912,not good,False,0,0,0.5,0,True,False,False,Final Fantasy XII: The Zodiac Age
595520,197079351,76561198391794888,gabranth my goat,True,0,0,0.5,0,False,False,False,Final Fantasy XII: The Zodiac Age
595520,197023587,76561198192735709,very nostalgic,True,0,0,0.5,0,True,False,False,Final Fantasy XII: The Zodiac Age
595520,197017519,76561198081388722,offline ff 14,True,0,0,0.5,0,False,False,False,Final Fantasy XII: The Zodiac Age
595520,196938765,76561198054505340,the game itself is not bad so far think is a bit challenging but not much love the auto battle system cool sets of main characters 910,True,0,0,0.5,0,True,False,False,Final Fantasy XII: The Zodiac Age
595520,196769773,76561199138912341,d,True,0,0,0.5,0,True,False,False,Final Fantasy XII: The Zodiac Age
595520,196739093,76561198203603579,,True,0,0,0.5,0,False,False,False,Final Fantasy XII: The Zodiac Age
595520,196723282,76561198074428120,joguei pela primeira vez em 2006 no ps2 ano de lanamento do jogo e desde ento virou meu jogo favorito de todos os tempos zerei no ps2 verso original e international zodiac job system no ps4 no switch e agora no pc no canso de rejogar isso,True,0,0,0.5,0,True,False,False,Final Fantasy XII: The Zodiac Age
595520,196709970,76561198007589726,nice,True,0,0,0.5,0,True,False,False,Final Fantasy XII: The Zodiac Age
595520,196676670,76561198027885786,the zodiac version is so much better especially with the speed boost to speed up walking and combat,True,0,0,0.5,0,True,False,False,Final Fantasy XII: The Zodiac Age
595520,196660061,76561198163614302,do you like final fantasy 12 that is what this is,True,0,0,0.5,0,True,False,False,Final Fantasy XII: The Zodiac Age
595520,196586766,76561198196530249,this game is such a spin from the classic final fantasy game it mixes nearly turnbased combat with a more openworld concept,True,1,0,0.5053004026412963,0,True,False,False,Final Fantasy XII: The Zodiac Age
595520,196357482,76561198049118471,"played back when it first came out and it has always been one of my favorite ff games new systems actually make you think about combat and how you level you characters and not just treat them all as interchangeable health bars playing at x2 speed really lets you blow thru the game but its almost to fast since you dont really get to dig into the game if i play it again i would only turn on x2 while grinding",True,0,0,0.5,0,True,False,False,Final Fantasy XII: The Zodiac Age
595520,196214921,76561198352937360,an equivalent of my childhood crushnow even better thanks to the job system and x4 speed mode downsides you have to grind a lot for cool weapons,True,0,0,0.5,0,True,False,False,Final Fantasy XII: The Zodiac Age
595520,196119452,76561198156305418,solid good art good story good dialogue,True,0,0,0.5,0,True,False,False,Final Fantasy XII: The Zodiac Age
595520,196069432,76561198105250623,this game is a masterpiece everything bad i would have to say are just nitpicks one of my favorites from now on,True,0,0,0.5,0,True,False,False,Final Fantasy XII: The Zodiac Age
595520,195751655,76561198171880786,this game is undrated as fuck,True,0,0,0.5,0,True,False,False,Final Fantasy XII: The Zodiac Age
595520,195730789,76561198062708186,zodiac age is solid,True,0,0,0.5,0,True,False,False,Final Fantasy XII: The Zodiac Age
595520,195697582,76561198039507094,my childhood at one point i stole the physical disc to this game on ps2 at a vintage stock when they stopped taking older games out of the cases and leaving them in,True,0,0,0.5,0,False,False,False,Final Fantasy XII: The Zodiac Age
595520,195697012,76561199119881118,great game the game has a lot of star war vibes especially the prequels,True,0,0,0.5,0,True,False,False,Final Fantasy XII: The Zodiac Age
595520,195633693,76561198059846843,"one of my favorite games ever played it a ton on ps2 years and years ago cant recommend it enough",True,0,0,0.5,0,True,False,False,Final Fantasy XII: The Zodiac Age
595520,195327503,76561198039820310,good,True,0,0,0.5,0,True,False,False,Final Fantasy XII: The Zodiac Age
595520,195262633,76561198094723120,"with an ever expanding backlog to burn through i do find myself coming back to this game in particular every so often for the member berries ill finish it someday im sure as it was a wonderful game on the ps2 and this version is superior in every way imo  wish squeenix would show ivalice some love in the future over yet another ff7 spinoff the world is incredible with deep history mythology and cultures to explore also hitoshi sakamotos music is objectively incredible",True,0,0,0.5,0,True,False,False,Final Fantasy XII: The Zodiac Age
595520,195238264,76561199145698443,these are the moogles we really want square enix please bring them back,True,0,0,0.5,0,True,False,False,Final Fantasy XII: The Zodiac Age
595520,195106702,76561198011128160,i bought this game to stream to my friends they got so bored that they fell asleep while watching they have since moved on to play their own games and no longer ever attend my stream sessions anymore,True,0,1,0.5,0,True,False,False,Final Fantasy XII: The Zodiac Age
595520,195064791,76561198064793826,my favorite ff game,True,0,0,0.5,0,True,False,False,Final Fantasy XII: The Zodiac Age
595520,194978371,76561199755906447,best ff ive played enjoyed it as a kid still do today,True,0,0,0.5,0,True,False,False,Final Fantasy XII: The Zodiac Age
595520,194971711,76561198032652405,storytelling music betrayal battles  honestly this game has aged really well many years ago i wasnt a fan since i was stuck in the turn based era and didnt really like the camera issues during battle still not the best but if you can overlook that  this is a brilliant game,True,0,0,0.5,0,True,False,False,Final Fantasy XII: The Zodiac Age
595520,194785544,76561198242803122,its like single player ff11 very good 1010 would grind again,True,0,0,0.5,0,True,False,False,Final Fantasy XII: The Zodiac Age
595520,194737095,76561198051145994,"still a great game worth buying on a sale dustia still works",True,0,0,0.5,0,True,False,False,Final Fantasy XII: The Zodiac Age
595520,194668378,76561199111609738,nice classic game,True,0,0,0.5,0,True,False,False,Final Fantasy XII: The Zodiac Age
595520,194339537,76561198796462612,sadly the game crashed 12 seconds after launch without fail except when i clicked new game where it would immediately crash where in both cases it stated fatal error occurred sounds like itd be fun but i could not experience it,True,2,0,0.4987059235572814,0,True,False,False,Final Fantasy XII: The Zodiac Age
595520,194107442,76561199822834054,it was fine for a bit but then now upon start up this is the only game in my library that stays on a black screen good game just odd black screen that happened randomly,False,2,1,0.499692678451538,0,True,False,False,Final Fantasy XII: The Zodiac Age
595520,193879601,76561198140314571,best ff ever,True,0,0,0.5,0,True,False,False,Final Fantasy XII: The Zodiac Age
595520,193347952,76561198446935441,what a grand and satisfying ending i just hope there was more story sequences throughout the game,True,0,0,0.5,0,True,False,False,Final Fantasy XII: The Zodiac Age
595520,193215278,76561198147439803,sugoiii,True,2,0,0.5055016279220581,0,True,False,False,Final Fantasy XII: The Zodiac Age
