appid,recommendationid,author_steamid,review,voted_up,votes_up,votes_funny,weighted_vote_score,comment_count,steam_purchase,received_for_free,written_during_early_access,game_title
282900,168664413,76561198333474822,uwoooh  nep peak would begin and continue here,True,0,0,0.5,0,True,False,False,Hyperdimension Neptunia Re;Birth1
282900,168209531,76561198011985425,a classic up there with the greats like persona 5 and xenoblade 2,True,4,0,0.5504087209701538,0,True,False,False,Hyperdimension Neptunia Re;Birth1
282900,167567632,76561198840410465,this game is addicting its like coke when u understand the mechanics oohhh man its good and the plot and the jokes are top nep nep,True,0,0,0.5,0,False,False,False,Hyperdimension Neptunia Re;Birth1
282900,167091897,76561198843874082,i wish blanc was real,True,0,0,0.5,0,True,False,False,Hyperdimension Neptunia Re;Birth1
282900,167047335,76561198067788722,100,True,0,0,0.5,0,True,False,False,Hyperdimension Neptunia Re;Birth1
282900,166718073,76561198381451552,one of my favorite rpgs ive ever played and thats mainly because of the characters the neptunia series deserves more recognition,True,0,0,0.5,0,False,False,False,Hyperdimension Neptunia Re;Birth1
