appid,recommendationid,author_steamid,review,voted_up,votes_up,votes_funny,weighted_vote_score,comment_count,steam_purchase,received_for_free,written_during_early_access,game_title
7110,202020371,76561198048844217,just old school gaming with a decent storyline if you can ignore the graphics and play it for what it is its a great game,True,0,0,0.5,0,True,False,False,Jade Empire
7110,201881084,76561199860168772,so buggy its unplayable,False,0,0,0.5,0,True,False,False,Jade Empire
7110,201402048,76561198050770124,classic game from the golden age of bioware beautiful environment amazing story and fun combat system yeah its old but people just dont write games like this anymore but if lack of frames bother you you can use lossless scaling to help that out only 7 usd and works like a charm,True,0,0,0.4713493287563323,0,True,False,False,Jade Empire
7110,201122187,76561198046653713,glad to have been able to play through a title from an era of gaming that i wasnt able to get to when younger story characters and location were great with gameplay level progression and pacing felt lacking,True,0,0,0.5,0,True,False,False,Jade Empire
7110,200419900,76561198055732786,this game has charm like no other game,True,2,0,0.5102040767669677,0,True,False,False,Jade Empire
7110,200048641,76561198144392178,"this is one of old biowares best games theyve ever made  jade empire is an amazing game with an amazing story and surprisingly good combat that stills holds up buy it play it enjoy it",True,1,0,0.5,0,True,False,False,Jade Empire
7110,199942122,76561197985918142,clsica bioware que mas decir el punto medio entre kotor y mass effect pero ms corto que cualquiera de estos dos quiz ahora tenga ms valor histrico que cualquier otra cosa,True,0,0,0.5,0,True,False,False,Jade Empire
7110,199478744,76561198090914542,this is one of my fav rpgs as well are martial arts themed games up there with okami it is obviously dated as far as graphics but it is still incredibly beautiful there are tons of really cool npcs and locations that are a delight to explore,True,2,0,0.5,0,True,False,False,Jade Empire
7110,198681330,76561198062506049,this game still holds up even today the chinese martial arts kotor this was back when bioware was one of the best videogame developers i still have a hard time finding many companies as good as bioware when they were in their prime the story is amazing the soundtrack is well done and the world is one i always go back to one of biowares best and one of the best rpgs ever made i highly recommend jade empire can we get a remaster that would be awesome,True,6,2,0.5994812250137329,0,True,False,False,Jade Empire
7110,198181679,76561198241533920,its a good game although pretty clumsy lots of good but little thats actually great recommend the game still though,True,0,0,0.5,0,True,False,False,Jade Empire
7110,198140985,76561197993634955,a fantastic game from the good old days of bio ware runs great playing on the steam deck and it natively supports controllers which is great too  as for the game itself its quite a bit shorter than your average bio ware rpg 25 hours if going for a completionist run but its fun regardless with all the interesting characters and story beats youd usually find as well as some surprises along the way   overall a solid 910,True,2,0,0.4897812604904174,0,True,False,False,Jade Empire
7110,197860923,76561198062858244,a bit dated but it has great story and companions the moral choices are a high point either to walk the path of the open palm with good and noble decisions or instead to follow the path of the closed fist and embrace an absolutely evil route a pretty classic bioware experience that if you wish for more mass effect or dragon age this is a good option,True,2,0,0.5087718963623046,0,True,False,False,Jade Empire
7110,197569019,76561198042465234,all time favorite game absolutely loved this game when it released on xbox i have replayed this game more times than i can count if they ever did a remake i wouldnt want a single thing changed other than the graphics being updated you should play this game,True,2,0,0.5238095521926879,0,True,False,False,Jade Empire
7110,197511070,76561198126333438,doesnt work because it fails to find steam,False,16,3,0.622235596179962,2,False,False,False,Jade Empire
7110,197096408,76561198128081248,"an all time classic that i adore from biowares heyday beautiful world fantastic story and wonderful characters  55",True,1,0,0.5,0,True,False,False,Jade Empire
7110,196615955,76561197993999733,i liked it nice quick and relaxing old bioware game not the best game i ever played ofc but it was enjoyable nevertheless  id say 710,True,1,0,0.5,0,True,False,False,Jade Empire
7110,194977073,76561198018938646,so big fantastical world and i actually came to like the clunky combat many choices to be made many friends to have towards the end,True,1,0,0.495495468378067,0,True,False,False,Jade Empire
7110,194169860,76561199084284008,bioware cooked very underrated game easily one of my favorites such a shame this didnt sell well on release,True,6,0,0.5919881463050842,0,True,False,False,Jade Empire
7110,194152588,76561198148892932,launch isnt launching audio isnt audioing save isnt saving bioware isnt fixing,False,8,8,0.5715751647949218,0,True,False,False,Jade Empire
7110,193748534,76561198358366905,great game,True,1,0,0.5238095521926879,0,True,False,False,Jade Empire
7110,193516848,76561198149306756,great game drunken master is best style,True,2,0,0.5495495200157166,0,True,False,False,Jade Empire
7110,192277653,76561198199731562,i have owned this game for around 10 years and have replayed it seldom since its purchase due to the fact that i was supposed to have the extra characters and access to the special edition content but have yet to manage to access it still this is one of my favorites of all time and would gladly suggest this to anyone if they wish to enjoy a story of intrigue,True,1,0,0.5275590419769287,2,False,False,False,Jade Empire
7110,192174296,76561198312893207,this game is insanely fun for no reason unironically some of the most interesting and engaging combat from a game that ive ever played one of my favourite parts is that everyone who voices this predominantly asian setting game is your standard english salaryman,True,11,1,0.632072627544403,0,True,False,False,Jade Empire
7110,191663792,76561198044572373,this game was fantastic in its day but you wont get it to run unless you want to jump through a large number of technical hoops to get it to not only run but run at a stable framerate with 0 stuttering i wish with all my heart that ea would see the value in remastering this title but barring that just making it run and updating it for modern controller support would be peak,False,0,0,0.5,0,True,False,False,Jade Empire
7110,190265212,76561198804192694,amazing gem,True,0,0,0.5,0,True,False,False,Jade Empire
7110,189032207,76561198123478494,i thought this was onimusha it was in fact not also it does not work out of the box,False,2,1,0.3975090086460113,0,True,False,False,Jade Empire
7110,187308942,76561198031883875,played the game when it came out and loved it apparently today it needs some tinkering on newer windows versions check google though i cannot confirm this because i ditched windows some time ago game runs perfectly on linux using flatpak steam version and steamdeck no tinkering needed just click on install and then on play ,True,4,0,0.5833333134651184,0,True,False,False,Jade Empire
7110,186943991,76561197984966618,i like having all my games in one spot but this is probably better played on an emulator need extra files,False,2,0,0.4451072216033935,0,True,False,False,Jade Empire
7110,186800253,76561199821875945,710,True,3,0,0.5352112650871276,0,True,False,False,Jade Empire
7110,186784395,76561198321956424,this was a great game from my childhood i remember beating this on the original xbox when i was 6ish years old one bummer about the steam version is that you need to copypaste the steamdll into the games folder make a new empty systeminformationxml file edit the jadeempireini file then change the button mapping in the settings before you can actually play but overall its just as great as i remember minus the fact that theres camera bugs,True,0,0,0.5,0,True,False,False,Jade Empire
7110,186724035,76561198042771157,game is ultra choppy after trying all fixes ie clampfps0 and some other things but nothing works fix your games its not that hard ea,False,7,1,0.5228561758995056,0,True,False,False,Jade Empire
7110,185750439,76561199052547636,this game is an underrated classic such a complex and immersive world for its time,True,12,1,0.6339509487152098,0,True,False,False,Jade Empire
7110,184757551,76561197996659237,pc port has the worst camera control rig you could possibly imagine for a fluidmovement kungfu rpg just emulate it bioware doesnt care about their older niche titles enough to fix them,False,3,1,0.5206422209739685,0,False,False,False,Jade Empire
7110,184331657,76561197982472823,"i recommend the game not necessarily buying it at this point i played this a very long time ago now i was able to run through it a couple times on xbox the steam version has worked like twice for me a decade ago for like 7 hours    anyways good game fun to play plays a little like kotor iirc story was goodenuff replay value is low 2 maybe three times i enjoyed my time with this game shame i cant really revisit it easily whatever we all have a backlog",True,2,0,0.5199999809265136,0,False,False,False,Jade Empire
7110,184182072,76561198107054669,i played this on the original xbox and completed it and it is actually much better on pc i have really enjoyed the series and i highly recommend it if your into feeling some nostalgia and enjoying a really good story in a mythical similar ancient china but not quite,True,0,0,0.5,0,True,False,False,Jade Empire
7110,183405555,76561199228530770,the game wont run no ports on this app are playable waste of time and money do not buy,False,10,4,0.550919234752655,0,True,False,False,Jade Empire
7110,182199055,76561198283205660,good game took a little while to get it running but is well worth it if you are willing to put 30 minutes to an hour into getting it to work,True,0,0,0.5,0,True,False,False,Jade Empire
7110,181619656,76561198032125201,tight empire of jades,True,0,1,0.5,0,False,False,False,Jade Empire
7110,181596305,76561198119790640,horrible hongli approves,True,0,0,0.5,0,True,False,False,Jade Empire
7110,181480566,76561199698498019,sometimes buggyan old game to be fair but still worth playing at least once in a lifetime,True,2,0,0.5324719548225402,0,True,False,False,Jade Empire
7110,179619916,76561198028541386,its a bioware game im hella biased its good though so have fun,True,3,0,0.502371072769165,0,True,False,False,Jade Empire
7110,179559484,76561198093350207,kotor but ancient chinese threesome,True,6,3,0.587511122226715,0,True,False,False,Jade Empire
7110,178947569,76561198150282368,yes,True,1,0,0.5199999809265136,0,True,False,False,Jade Empire
7110,178701821,76561198076128554,click the guides tab on the game page to learn how to make the game function its basically running the game in windows vista sp2 compatibility mode and copying and pasting some files it is a shame it doesnt just work but this classic gem is worth the minor hassle,True,8,0,0.6134926676750183,0,True,False,False,Jade Empire
7110,178624812,76561198012111379,underrated hidden gem the game is great the combat is nice but some styles are better than others for sure longswords are basically the strongest weapon style but its such a nice way to pass time the story is good the setting is interesting the music is beautiful really recommend it,True,0,1,0.5,0,True,False,False,Jade Empire
7110,178430220,76561198044116627,classic martialarts game,True,1,0,0.5,0,True,False,False,Jade Empire
7110,178410172,76561197999248914,"historically accurate simulator of chinese history where all combat is settled by martial arts and transforming into giant frog demons and throwing fireballs and icicle spears  also youll have to go through a lot of faff to get this game working as opposed to being able to just install and play but all kidding aside its worth it this is peak bioware",True,0,1,0.5,0,True,False,False,Jade Empire
7110,177995447,76561198110334770,i absolutely love this game and dearly hope it sees a modern remake its probably too archaic in design for a remaster some day but this version is barely playable and requires pretty extensive modding to function as intended the modding tools are just as ancient as the game is so getting it all to work properly can be a real test of patience  i cant recommend it in its current state and highly doubt theyll ever fix it if its sold on gog i might check it out there instead,False,19,1,0.66993248462677,0,True,False,False,Jade Empire
7110,175808888,76561198097765372,1010 game been playing it ever since it released on the og xbox back in the day but  there are a few hoops you gotta go through first you need to copy the steamdll file from your steam install into the game or it will not launch at all second you need to rename the launcher as jadeempirelauncherbackup and the exe file as jadeempirelauncher then you are good to go graphics are a bit dated now but plenty of nexus mods to smooth out the jagged textures and make the cutscenes prettier   rr,True,8,0,0.6087032556533813,0,True,False,False,Jade Empire
7110,175286814,76561198002485475,kung fu rpg that definitely feels its age i had technical issues and had to look online to get the game to run without crashing what i saw was very charming and the story was surprisingly good even the kung fu was pretty fun but i didnt stick with it because i just have better games to play its not bad and the idea is good enough that i would be interested in a jade empire 2 or a reboot or some similar class based magical kung fu rpg system but i wont hold my breath,True,6,0,0.5945945978164672,0,True,False,False,Jade Empire
7110,175267037,76561198436967067,one of the best games and storylines ever played countless of times always good,True,0,0,0.5,0,True,False,False,Jade Empire
7110,174827464,76561198044301242,i havent played this game in years and i got me a new computer which is more powerful than my other one i just installed the game and when i press play a message pops up and says cant find steam what the hell im mad and its not cool for this to happen,False,3,3,0.4771457016468048,0,True,False,False,Jade Empire
7110,174811742,76561198015668562,you have to go through so many hoops to just be able to start the game and then trying to get 144hz or even just your controller to work correctly is such a hassle,False,8,2,0.5700379610061646,0,True,False,False,Jade Empire
7110,174653172,76561198066248283,launch game through the folder w the exe profit,True,8,1,0.6255850195884703,0,True,False,False,Jade Empire
7110,174584926,76561198137645743,og bioware back when did still made good games,True,3,0,0.541984736919403,0,True,False,False,Jade Empire
7110,174485669,76561198108828061,there are multiple issues with this game i have spent hours trying to get the controls to work correctly with no luck this was all after spending an hour just figuring out how to even get the game to launch i shouldnt have to get into the games configuration and rewrite code for the game to work correctly  i loved this game on xbox when it came out but this is a rip off these developers need to be held accountable for collecting money for defective products,False,1,1,0.5209580659866333,0,True,False,False,Jade Empire
7110,174332947,76561198961359296,amazing game some of the best characters choices and sidequests in bioware rpg history there is trouble getting the game to play and no achievements however,True,2,0,0.5238095521926879,0,True,False,False,Jade Empire
7110,172469889,76561198001670739,55 give me a sequel,True,3,0,0.5428571701049804,0,True,False,False,Jade Empire
7110,172125178,76561198010710116,probably the weakest classic bioware game but certainly worth playing for the die hard fans it will however need some fixes to get it working on modern systems   similar story beats as kotor but in a wuxia kungfu setting its not going to blow you away with the writing or mechanics but theres an undeniable charm underneath it all it takes you back to a simpler relaxed era of gaming,True,1,0,0.4873892366886138,0,False,False,False,Jade Empire
7110,172117539,76561198801037867,game will not run on windows 11,False,3,1,0.5008196830749511,0,False,False,False,Jade Empire
7110,171808866,76561198045907531,this game was made as an xbox exclusive and it feels like its not truly ported for pc  if you had a old xbox and game disc i would fully recommend this is in my top fav games of all time  alas the pc version having clunkier controls and poor resolution settings on top of being an old dated game  just have to accept the fun experience is lost to the past,False,3,1,0.5610972642898558,0,True,False,False,Jade Empire
7110,171717286,76561198052331508,so broken on legion go and steam deck,False,1,1,0.4470146894454956,0,True,False,False,Jade Empire
7110,171593364,76561197994545035,one of the most unique rpgs with a solid story  intriguing world  peak orginal xboxps2 era video game,True,3,0,0.5454545617103576,0,True,False,False,Jade Empire
7110,171472599,76561199200741842,a wonderful game that brings back my childhood,True,1,0,0.5238095521926879,0,False,False,False,Jade Empire
7110,171458515,76561198261830207,loved the story and enjoyed the chinese setting a lot companions were well done  the combat was enjoyable but became kind of a chore in the last third of the game  wish they bioware still made games like these tho,True,3,0,0.562043786048889,0,True,False,False,Jade Empire
7110,170849830,76561198139024514,thanks to my steamdeck i can finally play this gem  winter2019cooldogwinter2019cooldogwinter2019cooldog,True,2,0,0.5370370149612426,0,True,False,False,Jade Empire
7110,170734618,76561198259833126,its a good game but you need to edit files to even launch the game and near the end i opened the game to find tons of stuttering suddenly you can can find fixes for these issues,True,1,0,0.5238095521926879,0,True,False,False,Jade Empire
7110,170308112,76561198168179374,yes  710,True,0,0,0.5,0,True,False,False,Jade Empire
7110,169786846,76561198011062253,absolute classic bioware game youll have to make some slight modifications to get it to work properly on new pcs but its totally worth it they dont make games like this anymore sadly,True,0,0,0.5,0,True,False,False,Jade Empire
7110,169375983,76561198108571489,its going to need some optimizing check the guides and youtube and o would say get a controller if your not used to keyboard and mouse i use a voyee i had my mom order on amazon and i had to do a little bit of stuff to make it run good  cant remember what it didnt take long or i would have gave up,True,0,0,0.5,0,True,False,False,Jade Empire
7110,168922146,76561198038106400,game will not run on windows 11,False,2,3,0.5428571701049804,0,True,False,False,Jade Empire
7110,168899155,76561198278328120,game isnt without its flaws  dialogue that doesnt quite flow even if individual passages are great glitches unfortunate orientalism way too short for its own good it feels like a game thats 70 complete but its got a  lot of heart and youd be surprised how far that can take a game ive been thinking about it weeks after finishing it,True,2,0,0.5201342105865479,0,True,False,False,Jade Empire
7110,168126895,76561198015652512,its good but youll need to do some work to get it playable,True,0,0,0.5,0,True,False,False,Jade Empire
7110,167846556,76561198001254806,underrated gem used to play it a lot on xbox back in the day,True,1,0,0.5,0,True,False,False,Jade Empire
7110,167664117,76561197984318586,the will of the emperor and his wives shall not be denied,True,0,0,0.4605263471603393,0,True,False,False,Jade Empire
7110,167631903,76561198046218654,doesnt work missing steam garbage port,False,0,2,0.5,0,True,False,False,Jade Empire
7110,167591728,76561198074564388,steam version works best game of its time,True,2,0,0.5238095521926879,0,True,False,False,Jade Empire
7110,167236238,76561198152859663,my favorite martial art is gun,True,0,0,0.4605263471603393,0,True,False,False,Jade Empire
7110,166751208,76561198002555238,it is a really old title but still enjoyable not so much for the combat but story and presentation are decent for its time,True,1,0,0.5238095521926879,0,True,False,False,Jade Empire
7110,166576920,76561198162904778,good game,True,0,0,0.4605263471603393,0,True,False,False,Jade Empire
7110,166519936,76561198174881771,game is boring as sht the plot is so fcking generic its ridiculous not to mention the painful writing literal anime weeb tier dialogues like oh wow you so strong and handsome you must be da chosen one type shit all the time at one point you go to heaven which is more like hell since its filled with furries but what crossed the line for me is when you get a jailbait that can turn into a demon as a companion sht game dont waste your time,False,8,0,0.458703339099884,2,True,False,False,Jade Empire
7110,166366720,76561198397731989,doesnt work with controllers which sucks because i owned this game a long time ago on the og xbox and it was a great game when i saw it here and it was on sale i jumped at it then it wasnt controller compatible,True,0,0,0.5,0,True,False,False,Jade Empire
7110,164519819,76561198155641430,one of the best bioware game very unique storytelling and gameplay,True,4,0,0.5565761923789978,0,True,False,False,Jade Empire
7110,164151213,76561197978501849,the game is great but it cant run on modern os and for some reason no one has bothered to fix it if youre on w10 dont bother,False,14,1,0.5793725848197937,0,True,False,False,Jade Empire
7110,163870002,76561198028739521,do not buy this wont work out of the box on modern systems 2012 even if you can turn it on by pasting steamdll into games folder copy jadeempireexe and name it jadeempireconfig  resolution is fucked up text is stretched and pixelated not even mods can fix this frame pacing is also off even with the fix not to mention that witcher 1 works on the same engine and has no problems stated above well witcher 1 works on 1080p with beautiful scaling and 144fps,False,26,4,0.6385273933410645,5,True,False,False,Jade Empire
7110,163538054,76561198797996055,good stuff,True,0,0,0.5,0,True,False,False,Jade Empire
7110,163368713,76561198029534981,love this game,True,1,0,0.5238095521926879,0,True,False,False,Jade Empire
7110,163290399,76561198196149814,wuxia kotor 2 basically,True,11,0,0.6470540761947631,0,True,False,False,Jade Empire
7110,163152680,76561199059857758,this was the first videogame i played so much winters ago on my own classic xbox if a dev of this videogame one day read this i want to say thanks to do a really funny and good game,True,5,0,0.5903770923614501,0,True,False,False,Jade Empire
7110,162452145,76561199213739305,100000000000000000,True,0,0,0.5,0,True,False,False,Jade Empire
7110,162379115,76561198425706922,underrated game,True,0,0,0.5,0,True,False,False,Jade Empire
7110,161841875,76561198319584066,the closest thing to a decent avatar the last airbender game,True,6,1,0.5481986999511718,0,True,False,False,Jade Empire
7110,161031125,76561198044841761,in the mighty powerful name of jesus christ i bind all unclean spirits demons satanists warlocks witches or any type of evil operating within this area i cover this area in the precoius sinless pure blood of the christ jesus,True,2,3,0.4114498794078826,0,True,False,False,Jade Empire
7110,160835641,76561198044457534,i really did just spend hours getting a game that treats me like an idiot to even work john cleeses quest was amusing the arena was cool naked fox furry titty heaven was nice the game lets you be gay but not with the black whirlwind 010 stars,False,4,1,0.4222978353500366,0,False,False,False,Jade Empire
7110,160446430,76561199416561087,"wont run straight off and the higher difficulty is just tedious but the story and the game itself is quite good",True,4,0,0.5668779015541076,0,True,False,False,Jade Empire
7110,160264599,76561199367221095,the most fun ive had out of any rpgs,True,3,0,0.5355299711227416,0,True,False,False,Jade Empire
7110,159864447,76561198250141468,,True,1,0,0.4746778905391693,0,True,False,False,Jade Empire
7110,159610574,76561197975896985,do not buy game doesnt start on modern machines,False,15,0,0.6072609424591064,0,True,False,False,Jade Empire
7110,158354565,76561199493790897,jade empire,True,3,0,0.5052137374877929,0,True,False,False,Jade Empire
7110,157881710,76561198007509392,one of the greats,True,6,0,0.6096584796905516,0,True,False,False,Jade Empire
7110,157798417,76561198807804524,great game,True,1,1,0.5199999809265136,0,False,False,False,Jade Empire
7110,156794993,76561199530657039,pretty good game remember playing this when i was younger and had an original xbox so its awesome they brought it back one problem is that i couldnt launch in the actual game file which i believe is typical reading other comments but with a workaround i had to use jadeempireexe which made the game run perfect,True,0,0,0.5,0,True,False,False,Jade Empire
7110,156368269,76561198013713145,doesnt work get it on ea instead,False,2,0,0.4779005646705627,0,True,False,False,Jade Empire
7110,156079213,76561199569572577,great game brings back good memories once you get it working correctly,True,4,0,0.5833333134651184,0,True,False,False,Jade Empire
7110,155209824,76561198020563444,the combat it just so clunky and its very hard even getting the game to run,False,2,2,0.4339622557163238,0,True,False,False,Jade Empire
7110,155131828,76561198016952129,game is an antique,True,0,1,0.4761904776096343,0,True,False,False,Jade Empire
