appid,recommendationid,author_steamid,review,voted_up,votes_up,votes_funny,weighted_vote_score,comment_count,steam_purchase,received_for_free,written_during_early_access,game_title
7110,155005676,76561198021307296,this isa  fun and old school martial arts fighting game with a good story along with it from the golden age of bioware i wish they would make a sequel or another story,True,7,0,0.6170958876609802,0,True,False,False,Jade Empire
7110,154601359,76561198417379378,great on steamdeck  cut scenes dont wrk though nah mean,True,13,0,0.6548904776573181,0,True,False,False,Jade Empire
7110,154193862,76561198056856555,how you fuck up controller on a game originally designed for it is beyond me there is a way to fix it by editing an ini file google will help you out,True,11,0,0.6685937047004699,0,True,False,False,Jade Empire
7110,152738688,76561198053648635,masterpiece,True,1,0,0.4808988869190216,0,True,False,False,Jade Empire
7110,151756490,76561198058899496,literally broken steam should just remove it from the store,False,8,0,0.5675403475761412,0,True,False,False,Jade Empire
7110,149824120,76561198064464224,abandon your hopes of taking this nostalgia trip and add this to the long list of steam games that just dont work at least not on a pc made after 2006,False,3,0,0.4951584339141845,0,True,False,False,Jade Empire
7110,149573698,76561197963769406,its a good game but sort of boring and repetitive to play its cheesy as hell but in a very charming way and i really enjoyed the dialogue and plot in many ways its more of the same from bioware but this was made before they settled into their rut its mass effect in ancient china and it actually really works the combat is incredibly tedious and dull,True,1,0,0.5238095521926879,0,True,False,False,Jade Empire
7110,149074065,76561198031451817,jade empire is a lost gem from bioware kind of absurd that steam cant release a version that actually works though,True,10,0,0.6125496625900269,0,True,False,False,Jade Empire
7110,148838658,76561198020619702,great stoyline,True,0,1,0.5,0,True,False,False,Jade Empire
7110,148510599,76561198071435501,i used to rent this from the video store every weekend good memories this game has held up surprisingly well though it may be difficult to enjoy if your playing it now for the first time as it is hella old but the vibe still hits always sad they never made another,True,9,0,0.6308134198188781,2,True,False,False,Jade Empire
7110,148100384,76561198138915647,love it,True,0,0,0.5,0,True,False,False,Jade Empire
7110,147248353,76561198400987067,if bioware ever returns to visit this universe ill be a happy man   i took silver fox any other romance option is a mistake  played it offline for a time my actual playtime is 18 hours,True,7,0,0.5963571071624755,0,True,False,False,Jade Empire
7110,146985249,76561199025117814,it dont work,False,5,0,0.5023645162582397,0,True,False,False,Jade Empire
7110,146813689,76561199007184148,this game was really one of the very best ever made i love the system of looking at books for experience and completing book sets to gain extra skills i just really loved and still love this game,True,6,0,0.5701925754547119,0,True,False,False,Jade Empire
7110,146497810,76561198071244160,one of the best rpgs ever made,True,9,0,0.5891309380531311,0,True,False,False,Jade Empire
7110,146016356,76561198167966861,its difficult to get running but its a fun game when it works,True,1,0,0.5111110806465148,0,True,False,False,Jade Empire
7110,145426660,76561198243812358,d,True,0,0,0.5,0,True,False,False,Jade Empire
7110,145342539,76561198001095020,still holds up the test of time,True,4,0,0.5537525415420532,0,True,False,False,Jade Empire
7110,144940809,76561197970400865,this game is peak okay  the combat is just way too buttonmashy for my taste its got the bioware story with mildly interesting characters but this came out during the height of biowares greatness but it falls so incredibly short compared to everything else they put out i would say if you are set on playing it get it on sale and put it on easy the game is still challenging and the story and characters are the main focus dont bog yourself down with really boring combat,False,0,0,0.4035874307155609,0,True,False,False,Jade Empire
7110,144929189,76561198000998015,didnt age well,False,4,0,0.463600754737854,0,True,True,False,Jade Empire
7110,144741798,76561197971944212,combat is clunky and easily cheesable but aside from that this is peak bioware if you like their other games you will love this as well  ignore the bad reviews about technical issues it takes 5 seconds to get it working if you arent smoothbrain,True,0,0,0.5,0,True,False,False,Jade Empire
7110,143512430,76561198257805349,awesome game sort funny and great story at the base,True,0,0,0.5,0,True,False,False,Jade Empire
7110,143446449,76561198092571462,its not a perfect game considering its old which is pc port of the xbox version of the game it has great storytelling that makes a great wushu wuxia fantasy it has great gameplay makes you feel like your in a kung fu movie keep in mind this game can sometimes work on modern hardware it wont look pretty it can play somewhat well,True,0,0,0.5,0,True,False,False,Jade Empire
7110,143282685,76561198053982622,do not buy this the steam version of this game no longer works,False,16,1,0.6522642970085144,0,False,False,False,Jade Empire
7110,143031665,76561198043388988,this is a wonderful game it was stunning on release the game play is reminiscent of star wars kotr and this is a good thing this time force powers becoming chi powers instead  the gameplay still holds well today and with a fantastic story a beautiful gem of a game,True,0,0,0.5,0,True,False,False,Jade Empire
7110,142723783,76561198018246949,an average port that is an exercise in frustration to get running on modern systems the gameplay definitely feels dated but the bioware formula and engaging writing remain compelling,True,2,0,0.5435684919357299,0,True,False,False,Jade Empire
7110,141654362,76561198886488706,2 sweet,True,0,0,0.5,0,True,False,False,Jade Empire
7110,140162172,76561199010898321,great game,True,0,0,0.5,0,True,False,False,Jade Empire
7110,139743251,76561198062534148,great game story is good but gets annoying near end explaining thing that was already explain over and over is fucking dumb and pointless great characters especially henpecked hou combat is good with lots of styles to learn even drunken fist,True,0,0,0.5,0,True,False,False,Jade Empire
7110,139607751,76561198035469181,this game is the only way a white guy can safely engage in cultural appropriation without being canceled,True,1,1,0.4386706948280334,0,True,False,False,Jade Empire
7110,139518337,76561199064618790,wont let me play anymore says unable to find steam if youre like me and not a very techsavvy person to be trying to rename files and create folders in different files just save your money on this one,False,12,0,0.6448616981506347,0,True,False,False,Jade Empire
7110,139346623,76561199203206480,great game i would love to play a part 2,True,0,0,0.5,0,True,False,False,Jade Empire
7110,139092003,76561198040333499,despite the extra steps to get it to work its still good,True,0,0,0.5,0,True,False,False,Jade Empire
