appid,recommendationid,author_steamid,review,voted_up,votes_up,votes_funny,weighted_vote_score,comment_count,steam_purchase,received_for_free,written_during_early_access,game_title
42120,200625307,76561197970539229,i played this once a long time ago  it was alright  not sure id get into it now but if people are still playing  you might enjoy it,True,0,0,0.5,0,True,False,False,Lead and Gold: Gangs of the Wild West
42120,199890322,76561197993703113,dead game,False,0,0,0.5,0,True,False,False,Lead and Gold: Gangs of the Wild West
42120,199828591,76561198014236956,this game needs to be revived,True,0,0,0.5,0,False,False,False,Lead and Gold: Gangs of the Wild West
42120,198076768,76561198414017716,dead servers quite nice vibe aiming at long range is little wonky but its fine game,True,1,0,0.5,0,False,False,False,Lead and Gold: Gangs of the Wild West
42120,195362267,76561198028854449,dead game   neat class based wild west third person shooter but basically dead no servers and no ability to play with bots,False,1,0,0.5238095521926879,0,True,False,False,Lead and Gold: Gangs of the Wild West
42120,192532834,76561198126973045,i remember gifting this to an old friend in 2018 but they never played the game saw it on sale so i bought it the game still holds up in gameplay and visuals it reminds me of tf2 and rdr i wish i had given it a chance all those years ago because unfortunately the servers are dead so i just cant recommend it in its current state im definitely gonna refund it but if they had a campaign i definitely wouldve kept and played,False,1,0,0.5238095521926879,0,True,False,False,Lead and Gold: Gangs of the Wild West
42120,190200082,76561199546702693,extremely dead sadly its pretty fun,True,0,0,0.5,0,False,True,False,Lead and Gold: Gangs of the Wild West
42120,184855385,76561198007374759,great game shame no one plays it ,True,2,0,0.5454545617103576,0,False,False,False,Lead and Gold: Gangs of the Wild West
42120,184828200,76561198053229942,it was mediocre when it released and now its dead,False,6,0,0.4912253022193908,0,False,False,False,Lead and Gold: Gangs of the Wild West
42120,183245350,76561198149280150,its peak,True,1,0,0.5238095521926879,0,True,False,False,Lead and Gold: Gangs of the Wild West
42120,179623389,76561198103952613,it sounds like a good idea in the paper but is only meant to be a pvp game so its dead,False,0,0,0.5,0,False,False,False,Lead and Gold: Gangs of the Wild West
42120,179455196,76561198061208589,was going through my games and found this old gem boy did this bring memories this used to be my tf replacement this was actually a really fun game too bad fatshark didnt try to revive this rip lag,False,3,0,0.5597484707832336,0,False,False,False,Lead and Gold: Gangs of the Wild West
42120,176614594,76561197971260880,1010 legendary,True,0,0,0.5,0,True,False,False,Lead and Gold: Gangs of the Wild West
42120,175557110,76561198809128354,although there arent many players playing this game this games quite good if you play with friends,True,6,0,0.5752403736114501,0,False,False,False,Lead and Gold: Gangs of the Wild West
42120,168461373,76561197999424584,played during the initial release 10 years ago bought it yesterday to see if it was alive launched the game didnt work lobbies are dead started a refund request steam denied it 3x times because i have 2 hours of play time from a free weekend almost fifteen years ago actually predatory behavior dont waste your money buying this game if youve played it before and think youll get your money back because you wont,False,11,2,0.4588329792022705,0,True,False,False,Lead and Gold: Gangs of the Wild West
42120,167777092,76561198884978601,a dead game sadly               ,True,10,0,0.547882080078125,0,True,False,False,Lead and Gold: Gangs of the Wild West
42120,167391278,76561198802062118,good fun game shame its abandoned by players and somehow tf2 is still alive and this isnt,True,7,1,0.5416200757026672,0,True,False,False,Lead and Gold: Gangs of the Wild West
42120,165707585,76561197998056968,awesome game by nowadays considered to be retro however it is lacking player base ever since the first generation of players grew older,True,5,0,0.554541826248169,0,True,False,False,Lead and Gold: Gangs of the Wild West
42120,156716304,76561198126689177,lead and gold gangs of the wild west,True,1,1,0.483959674835205,0,False,False,False,Lead and Gold: Gangs of the Wild West
42120,155442459,76561199078040170,i wish i had someone to play this with,True,6,0,0.6007362008094786,0,True,False,False,Lead and Gold: Gangs of the Wild West
42120,152300983,76561198184464365,old but gold,True,4,0,0.5765605568885803,0,False,False,False,Lead and Gold: Gangs of the Wild West
42120,151042046,76561198023254436,its a kind of cod in the wild wild west unfortunately now if you want to play it you have to have friends to play with because no one plays this game anymore enjoy,True,4,2,0.5457376837730407,0,False,False,False,Lead and Gold: Gangs of the Wild West
42120,150455557,76561197965584264,great game but not so active playerbase,True,2,0,0.5440881848335266,0,True,False,False,Lead and Gold: Gangs of the Wild West
42120,149650154,76561198355924301,this game is actually pretty decent unfortunately the player count is low its not completely dead im finding full games with around 10 people in this game just needs a little influx of players and its a great blast,True,4,0,0.5641262531280516,0,True,False,False,Lead and Gold: Gangs of the Wild West
42120,149035984,76561198061301757,i recommend,True,1,0,0.4915627539157867,0,False,False,False,Lead and Gold: Gangs of the Wild West
42120,146995034,76561198142592490,terrible pings no servers and a tiny player base,False,0,1,0.5,0,False,False,False,Lead and Gold: Gangs of the Wild West
42120,146222086,76561197972244467,its a shame this game died  of all the shameless tf2 ripoffs this is probably the best ripoff,True,5,0,0.5931686162948608,0,True,False,False,Lead and Gold: Gangs of the Wild West
42120,145874689,76561199081583135,ive seen enough give goty to this masterpiece,True,0,0,0.5,0,True,False,False,Lead and Gold: Gangs of the Wild West
42120,145147172,76561198000998015,boring not for me,False,1,0,0.4955235421657562,0,False,False,False,Lead and Gold: Gangs of the Wild West
42120,144638119,76561198100863835,cheaper than red dead 2 and a more authentic experience of the west circa whenever its set,True,0,1,0.4724409580230712,0,False,False,False,Lead and Gold: Gangs of the Wild West
42120,143060353,76561198027421333,its a great multiplayer game but dont buy cause theres no one to play with,False,3,0,0.5592862367630004,0,True,False,False,Lead and Gold: Gangs of the Wild West
42120,141502921,76561197976354302,fun concept but the game is dead no other players and its pvp only,False,3,0,0.5450325012207031,0,False,False,False,Lead and Gold: Gangs of the Wild West
42120,140769786,76561198079974561,one of the best games you will ever play,True,1,0,0.4861773252487182,0,False,False,False,Lead and Gold: Gangs of the Wild West
42120,139331488,76561198005707401,very good game but dead,True,0,0,0.5,0,True,False,False,Lead and Gold: Gangs of the Wild West
42120,139009203,76561199385158615,710 when you have friends to play it with btw the servers are already dead,True,0,0,0.5,0,False,False,False,Lead and Gold: Gangs of the Wild West
42120,138544738,76561198122635474,good game to play with the squad if you are lonely you would relate with servers you will find,True,0,0,0.5,0,True,False,False,Lead and Gold: Gangs of the Wild West
42120,137533712,76561197961181505,revive this game ,True,0,0,0.5,0,True,False,False,Lead and Gold: Gangs of the Wild West
42120,136953049,76561198036823388,old but gold,True,2,1,0.541984736919403,0,False,False,False,Lead and Gold: Gangs of the Wild West
42120,136875685,76561197970705552,feels like a rdr minigame nt,False,0,0,0.5,0,True,False,False,Lead and Gold: Gangs of the Wild West
42120,136781355,76561198332178072,really good game pretty dead though worth playing with friends,True,0,0,0.5,0,True,False,False,Lead and Gold: Gangs of the Wild West
42120,134002225,76561198025022039,i love this game  it is a classic favorite amongst my game group  my only gripe is that it could use a go over to streamline the online experience  but i get it fatshark has tide things to do,True,0,0,0.5,0,True,False,False,Lead and Gold: Gangs of the Wild West
42120,133367250,76561198020131680,is it smth like resident evil or what,True,0,0,0.4356933236122131,0,True,False,False,Lead and Gold: Gangs of the Wild West
42120,132297258,76561198165683834,took a picture of the steam key at a thrift shop seems alright,True,0,1,0.4571428596973419,0,False,True,False,Lead and Gold: Gangs of the Wild West
42120,130787756,76561197961801772,good game but no players,True,0,0,0.5,0,True,False,False,Lead and Gold: Gangs of the Wild West
42120,121435395,76561197983301475,great game  sorry i was so long with the review only about 12 years,True,5,7,0.5892796516418457,0,True,False,False,Lead and Gold: Gangs of the Wild West
42120,121007623,76561198281215729,team fortress 2 in the wild west and third person definitely like it,True,5,0,0.5878899097442626,0,True,False,False,Lead and Gold: Gangs of the Wild West
42120,119870886,76561198866942343,19 of 200 games 2021  httpsauncollectivemediumcomreviewing200randomsteambuytoplaygamespartxithetop204af3a7552c35,True,0,0,0.4761904776096343,0,True,False,False,Lead and Gold: Gangs of the Wild West
42120,116671138,76561199082911061,good but dead,True,5,0,0.5424981713294982,0,False,False,False,Lead and Gold: Gangs of the Wild West
42120,116667673,76561198124133504,good game always wishes more people played it,True,2,0,0.5305832028388977,0,False,False,False,Lead and Gold: Gangs of the Wild West
42120,114587534,76561197997684627,i had a lot of fun with it back in the day and even relatively recently a bit clunky but really solid in other aspects 810,True,3,1,0.5291765928268432,0,True,False,False,Lead and Gold: Gangs of the Wild West
42120,114169149,76561199071373909,better than fortnite,True,19,6,0.5752230286598204,0,False,False,False,Lead and Gold: Gangs of the Wild West
42120,113708123,76561198028268970,i bought it on the condition that it will have an active server but the game unfortunately does not have an active server it is dead the only way to play this game is if you are lucky and a friend has bought it if in the future the developer gives life to the game i will change my critique,False,9,1,0.5908995270729064,0,True,False,False,Lead and Gold: Gangs of the Wild West
42120,112283940,76561198212612265,i got shot down for owning land,True,2,0,0.47849702835083,0,True,False,False,Lead and Gold: Gangs of the Wild West
42120,111937241,76561198864791695,kenapa gamenya sepi sekali aku bosan main sama bot kak tolong kasih tau ke developernya kalo bikin game jangan kaya gini ,True,0,0,0.5,0,True,False,False,Lead and Gold: Gangs of the Wild West
42120,109366579,76561197994623075,mum can we get rdr2 no we have rdr2 at home rdr2 at home,True,4,2,0.4441677331924438,0,True,False,False,Lead and Gold: Gangs of the Wild West
42120,109058286,76561198119682401,dead game,False,8,0,0.5705833435058593,0,False,True,False,Lead and Gold: Gangs of the Wild West
42120,107709570,76561198027789141,bro make it free to play it might bring it new life,False,16,0,0.6182235479354858,0,True,False,False,Lead and Gold: Gangs of the Wild West
42120,106504112,76561198038072772,i remember playing this for a limited time for free back in 2011 the game was actually really fun and unique after all those years passed i finally bought the game for 99 cents,True,0,0,0.5,0,True,False,False,Lead and Gold: Gangs of the Wild West
42120,106005769,76561198059361840,dead multiplayer game  average player count 15 players,False,1,1,0.4999111294746398,0,False,False,False,Lead and Gold: Gangs of the Wild West
42120,104794397,76561199168250185,why the server of this game quiet,True,0,1,0.5,0,True,False,False,Lead and Gold: Gangs of the Wild West
42120,103460832,76561198028118888,fun game but the achievements are pretty much broken,True,2,0,0.4864449799060821,0,False,False,False,Lead and Gold: Gangs of the Wild West
42120,102654439,76561198143716428,make it free or just delete it from steam,True,0,1,0.5,0,False,True,False,Lead and Gold: Gangs of the Wild West
42120,102459346,76561198020284484,i have to agree with every other review of this game ive read it seems like it could be amazing as a f2p game otherwise its completely dead and too simpleunrefined to justify spending money on it,False,6,0,0.5068603754043579,0,False,False,False,Lead and Gold: Gangs of the Wild West
42120,101176248,76561198022952126,gud gaem,True,1,0,0.4686581194400787,0,False,False,False,Lead and Gold: Gangs of the Wild West
42120,100977424,76561198007774157,very cool,True,1,0,0.4686581194400787,0,False,False,False,Lead and Gold: Gangs of the Wild West
42120,99825534,76561199207811447,its obviously a small game however it does have smooth controlling and good models for a 1 gb game the third person view is okay only one problem with it too less players i went on the game every day to find somebody to play with guess what not even one,True,0,0,0.5,0,True,False,False,Lead and Gold: Gangs of the Wild West
42120,99750166,76561199023065645,good game,True,0,0,0.5,0,True,False,False,Lead and Gold: Gangs of the Wild West
42120,99310536,76561198097688083,the sum of every single review  make this game free to play   its a dead game otherwise  the concept is simply better in games like overwatch or tf2,False,7,0,0.5631083250045776,0,False,True,False,Lead and Gold: Gangs of the Wild West
42120,97551125,76561198015003424,lead and gold is a rather average thirdperson wild west multiplayer shooter aside from nice graphics there really isnt anything remarkable about it so even if anyone was still playing this i dont see why anyone would invest time and money there is no single player mode no story or even any interesting mechanics to set lead and gold aside from other games,False,0,0,0.4779411852359771,0,False,False,False,Lead and Gold: Gangs of the Wild West
42120,96892594,76561198332667499,it isnt worth buying and spending time on not in 2021 not at all even with a 90 discount,False,11,0,0.5853186249732971,0,True,False,False,Lead and Gold: Gangs of the Wild West
42120,96429306,76561198113222896,its a shame nobody plays this anymore ,False,0,0,0.5,0,False,False,False,Lead and Gold: Gangs of the Wild West
42120,93998844,76561199121635397,that im good lol and its 1 vs 5 im the 1,True,0,0,0.5,0,True,True,False,Lead and Gold: Gangs of the Wild West
42120,92953795,76561197970620496,fun in coop with my son9,True,0,0,0.5,0,True,False,False,Lead and Gold: Gangs of the Wild West
42120,90027249,76561198229477204,its pretty swaggy u get to be a cowboy baby,True,2,0,0.517373502254486,0,False,False,False,Lead and Gold: Gangs of the Wild West
42120,89497809,76561198152621939,unfinished game great graphics and gameplay just wish their was more their are only 2 servers and always empty game is based on vs their is no coop about it,False,0,0,0.419301152229309,0,False,False,False,Lead and Gold: Gangs of the Wild West
42120,89071759,76561198853051204,awesome game just not enough players,True,1,0,0.5104064345359802,0,False,False,False,Lead and Gold: Gangs of the Wild West
42120,87880723,76561198094393577,just make it free and load it with costly cosmetics,True,11,4,0.6177478432655334,0,False,False,False,Lead and Gold: Gangs of the Wild West
42120,86531874,76561197972398628,avoid  this is a dead game  multiplayer only and there are no other players  picked up as part of the fatshark sale bundle so unable to refund be warnd multiplayer only and there are no other players waited in lobby and connected to an empty game waiting and no other playrs joined tried other servers nobody  should not be allowed to sell gales that o not work as expected,False,3,0,0.4971969127655029,0,True,False,False,Lead and Gold: Gangs of the Wild West
42120,85929646,76561197967182526,well at its time i had a server for this i was great fun me and my friends played its a total shame the devels did not push this game more forward and build on this as of right now i think more people play space invaders 1988 then this its dead and abandon i recommend waiting til this if free dont waste your cash,False,7,0,0.5876527428627014,0,True,False,False,Lead and Gold: Gangs of the Wild West
42120,85150320,76561198352402686,pretty fun shooter for the small size matchmaking is quick and matches go on smoothly in its somewhat decent maps,True,3,1,0.5454545617103576,0,False,True,False,Lead and Gold: Gangs of the Wild West
42120,85115753,76561198058682525,after 10 years of playing this i think i might like it,True,10,10,0.5403919219970703,2,False,False,False,Lead and Gold: Gangs of the Wild West
42120,84274922,76561198252940819,a wholesome game that is best enjoyed with friends game is discontinued by the devs so you might have a little trouble finding servers but as i said one of the best games to play with friends,True,6,0,0.5579793453216552,0,False,False,False,Lead and Gold: Gangs of the Wild West
42120,83336727,76561198256438378,game is unfortunately dead but i really enjoyed what little time i spent here,True,6,0,0.5960832238197326,0,False,False,False,Lead and Gold: Gangs of the Wild West
42120,82689233,76561197961418102,it was one of those games that made time fly by  it was great just shooting it out with others maybe they could add coop team versus computer,True,2,0,0.5454545617103576,0,True,False,False,Lead and Gold: Gangs of the Wild West
42120,75012650,76561198020807725,deader than a blowdried tumbleweed in pvp but still worth a pickup for a lowlow price for its loot and haulingbased coop mode intuitive controls and very pleasant graphics  ui  dang i miss the hayday of this game,True,1,0,0.5238095521926879,0,True,False,False,Lead and Gold: Gangs of the Wild West
42120,73132139,76561197988953776,i want to play it but no one else does make it free to play,True,9,0,0.6369117498397827,0,True,False,False,Lead and Gold: Gangs of the Wild West
42120,73086703,76561198001651183,it is all online but not even one opponent is online they should do something to attract players this way this game isnt playable right now although the mechanics look to be ok,False,5,0,0.5839899182319641,0,False,False,False,Lead and Gold: Gangs of the Wild West
42120,72099684,76561198269324986,its a good game but theres no players  please make it free ,True,3,1,0.4402145743370056,0,False,True,False,Lead and Gold: Gangs of the Wild West
42120,72006948,76561197963425061,one of the most underrated games ever a real shame battleroyales which are garbage managed to poach most fps communities,True,8,1,0.5852123498916625,0,False,False,False,Lead and Gold: Gangs of the Wild West
42120,71194550,76561198399488294,it is really fun but not that many people play,True,4,0,0.5696852803230285,0,False,True,False,Lead and Gold: Gangs of the Wild West
42120,70501510,76561198838092419,great game,True,0,0,0.4305272102355957,0,False,True,False,Lead and Gold: Gangs of the Wild West
42120,69993541,76561198354286612,amazing game needs to be for free  updated  update   fatshark make it f2p theres no official servers  and no actual money to lose on and have some respect to the loyal community ,True,7,0,0.604921281337738,0,True,False,False,Lead and Gold: Gangs of the Wild West
42120,69826704,76561198097693835,real life simulator in terms of loneliness,False,1,3,0.4859984219074249,0,False,False,False,Lead and Gold: Gangs of the Wild West
42120,69416873,76561198352567248,uninstall  1o,True,3,0,0.517599046230316,0,True,False,False,Lead and Gold: Gangs of the Wild West
42120,68396530,76561198968980974,great game and recommend everyone to get it it has full lobbys everyday,True,6,2,0.5215689539909362,0,True,False,False,Lead and Gold: Gangs of the Wild West
42120,67369924,76561198219100969,a great game but it is dead right now,True,0,0,0.5,0,False,True,False,Lead and Gold: Gangs of the Wild West
42120,67090878,76561198359061435,nice game,True,1,0,0.5043103098869323,0,False,False,False,Lead and Gold: Gangs of the Wild West
42120,66476484,76561198010740615,dead game,False,1,0,0.4943040013313293,0,True,False,False,Lead and Gold: Gangs of the Wild West
42120,66362082,76561198392005962,0000,False,0,0,0.4707969427108764,0,False,False,False,Lead and Gold: Gangs of the Wild West
42120,66194239,76561197991451962,bring it back,True,4,0,0.5323842167854309,0,True,False,False,Lead and Gold: Gangs of the Wild West
42120,65821029,76561198035299175,good game but only buy if you have friends willing to play with you,True,2,0,0.5277207493782043,1,False,False,False,Lead and Gold: Gangs of the Wild West
42120,62447896,76561198443965343,very good game amazing product  nice  must try,True,2,2,0.439267873764038,0,False,True,False,Lead and Gold: Gangs of the Wild West
42120,61850051,76561198401295397,very wellmade game shame that game like this is dead,True,5,0,0.561683177947998,0,False,False,False,Lead and Gold: Gangs of the Wild West
42120,61833222,76561198094550605,best game of all time on my momma,True,0,1,0.4659714102745056,0,False,False,False,Lead and Gold: Gangs of the Wild West
42120,60554758,76561197963325037,its a fun game but give it for free you devs  give it for free then put some microstuff pay init,True,0,0,0.5,0,False,False,False,Lead and Gold: Gangs of the Wild West
42120,60437174,76561198296472299,dead game dont buy it,False,6,0,0.58001309633255,0,False,False,False,Lead and Gold: Gangs of the Wild West
42120,59661313,76561197996618273,good game to have fun for couple hours with some friends in a lan party,True,5,0,0.547907531261444,1,True,False,False,Lead and Gold: Gangs of the Wild West
42120,55931583,76561197963029157,this game is dead now and should be deleted from the library,False,6,0,0.4881044328212738,0,True,False,False,Lead and Gold: Gangs of the Wild West
42120,55160780,76561198229712692,dead servers,False,6,0,0.5662377476692199,0,False,False,False,Lead and Gold: Gangs of the Wild West
42120,54813629,76561198023666926,game is not bad but pretty old and its not easy to find someone to play with this days,False,5,0,0.5304985046386718,0,False,False,False,Lead and Gold: Gangs of the Wild West
42120,54603265,76561198387421862,you wanna feel like a cowboy well lead and gold gangs of wild west is a good shot its only weaknesses are the classes you cant change and there arent too many players online,True,0,0,0.5,0,False,False,False,Lead and Gold: Gangs of the Wild West
42120,54440107,76561198024263291,even though my pcs could barely handle the games back then it was a solid and pretty fun game its such a shame that this game is dead now,False,4,0,0.5060623884201049,0,True,False,False,Lead and Gold: Gangs of the Wild West
42120,54401598,76561197995653596,shame that no one plays this game now very wellmade game with pleasing visuals and gameplay and i think this online shooter in that kind of setting is definitely one of the best,True,7,0,0.5884388089179992,0,True,False,False,Lead and Gold: Gangs of the Wild West
42120,54149628,76561197990453351,terrible pings no servers and a tiny player base,False,3,1,0.4706962704658508,0,True,False,False,Lead and Gold: Gangs of the Wild West
42120,53888526,76561198009385361,best game i ever played 1010,True,1,6,0.4595871865749359,0,False,False,False,Lead and Gold: Gangs of the Wild West
42120,52758155,76561198069051764,nice,True,2,0,0.4849518239498138,0,False,False,False,Lead and Gold: Gangs of the Wild West
42120,52662384,76561197983735489,i use to play this game a long time ago on a friends steam i saw the sale on it and picked it up for myself finally very fun game nice range of classes and game modes to play with smooth mechanics and entertaining gameplay however the game is dead like dead dead no one plays it anymore  so if youre in to playing every game against bots and not actual people pick it up if youre looking for a community to play with then dont get it,False,3,0,0.52654230594635,0,True,False,False,Lead and Gold: Gangs of the Wild West
42120,52613053,76561198045368508,i wanna be a cowboy baby,False,0,2,0.4176442921161651,0,False,True,False,Lead and Gold: Gangs of the Wild West
42120,52358993,76561198009143152,i wish this game got revived had sooo much fun,True,1,0,0.5054741501808167,0,True,False,False,Lead and Gold: Gangs of the Wild West
42120,52152438,76561198312527618,good game wish there was more players online,True,1,19,0.5,0,False,False,False,Lead and Gold: Gangs of the Wild West
42120,51950419,76561197989290281,no video for this review  sorry  however it is hard to make a video review of a multiplayer only game when no one is playing it it has been dead and abandoned for years so why have fatshark or steam not pulled it from sale  httpssteamchartscomapp42120  shame because it was a cracking game back in the day basically tf2 with cowboys save your cash for an active game with people playing,False,3,0,0.5365341305732727,0,True,False,False,Lead and Gold: Gangs of the Wild West
42120,51931600,76561198144406590,waw,True,0,0,0.4595219492912292,0,False,False,False,Lead and Gold: Gangs of the Wild West
42120,51636178,76561198069112468,good but empty like the wild west,True,6,3,0.5938262939453125,0,False,False,False,Lead and Gold: Gangs of the Wild West
42120,51495877,76561198327812436,dead game dont try to buy it,False,0,0,0.5,0,False,False,False,Lead and Gold: Gangs of the Wild West
42120,51341873,76561198226249960,jes  it took a bit to get ere but get ere e did    been having a fun lots with this game  e learned how to fan ze pistol day yester tell you what  that ole boy ad a big ole ole in him  head shot,True,0,0,0.5,0,True,False,False,Lead and Gold: Gangs of the Wild West
42120,51027569,76561198010251378,this shit was doa but it was fun,True,0,0,0.5,0,False,False,False,Lead and Gold: Gangs of the Wild West
