appid,recommendationid,author_steamid,review,voted_up,votes_up,votes_funny,weighted_vote_score,comment_count,steam_purchase,received_for_free,written_during_early_access,game_title
42120,50931824,76561197984280082,this game is very fun has decent balancement and favors teamwork instead of lone wolfers  so bad few people play this game i wish there were more updates and sales to revive this fun game,True,0,2,0.5,0,True,False,False,Lead and Gold: Gangs of the Wild West
42120,50906069,76561198201528028,really good game the only problem is that no one is playing it,True,0,0,0.5,0,False,False,False,Lead and Gold: Gangs of the Wild West
42120,50898362,76561198267843818,not the best game personally i thought it was cunfusing and uninteresting,False,1,0,0.4619565308094024,0,False,True,False,Lead and Gold: Gangs of the Wild West
42120,50743670,76561197993589983,looks fun shame it sat in my library all these years and now when i get around to playing it nobody else is,False,2,1,0.4762411415576934,0,True,False,False,Lead and Gold: Gangs of the Wild West
42120,50662611,76561197976950339,it was awesome and way better than vermintide 1 not really the same game i know im glad fatshark managed so well with vermintide 2 they already had potential with lead and gold i dont know if it is still played but that nervous team cowboy game is a good memory,True,0,0,0.5,0,True,False,False,Lead and Gold: Gangs of the Wild West
42120,50560686,76561198040929577,dead game,False,2,0,0.5118827819824218,0,True,False,False,Lead and Gold: Gangs of the Wild West
42120,50253942,76561198000162428,good multiplayer shooter but its dead i had fun in its prime,True,2,0,0.5117011666297911,0,False,False,False,Lead and Gold: Gangs of the Wild West
42120,50237021,76561198403962288,gd,True,0,0,0.4871060252189636,0,False,True,False,Lead and Gold: Gangs of the Wild West
42120,49900553,76561198341120859,gud game,True,0,0,0.4871060252189636,0,False,True,False,Lead and Gold: Gangs of the Wild West
42120,49835583,76561197979643793,its dead dont bother,False,5,0,0.569920003414154,0,True,False,False,Lead and Gold: Gangs of the Wild West
42120,49602314,76561197986161383,awesome game i dont think anyone plays it though,True,0,2,0.5,0,False,False,False,Lead and Gold: Gangs of the Wild West
42120,49579304,76561197980206809,not bad ,True,0,0,0.5,0,False,False,False,Lead and Gold: Gangs of the Wild West
42120,49383024,76561198856047396,lead and guns critic  poor design control problems graphics okay keyboard control is too vague poorly thoughtout  and last of all  totally unworthy of any better review  once they fix these issues then i will play it again  in it current state it is not worth the 999 i paid for it  msrachelm,False,1,1,0.4474024772644042,0,True,False,False,Lead and Gold: Gangs of the Wild West
42120,49225617,76561198001494272,one of the decent games in its era but all communities have since left it is not a live service and has no microtransactions but no one has much reason to revive it even if you have a nice group to play i cant recommend it for the price ride on partner,False,0,0,0.5,0,True,False,False,Lead and Gold: Gangs of the Wild West
42120,49163110,76561198018071139,this game was good when it started but soon became really bad by players using cheats,False,0,0,0.5,0,False,False,False,Lead and Gold: Gangs of the Wild West
42120,49156933,76561198057538996,the game seem interesting but it has no player basemake it free to play,False,4,0,0.5565713644027709,0,False,False,False,Lead and Gold: Gangs of the Wild West
42120,49001047,76561198044136848,best western,True,0,0,0.4662643671035766,0,False,False,False,Lead and Gold: Gangs of the Wild West
42120,48995585,76561198293979500,the concept could be fun if there were players around to play with without any active server an only multiplayers mode game is just dead  i could just play the tutorial map with the bots   ps in theory you can host so if you have a bunch of buddies you still could have fun with it,False,0,0,0.5,2,False,False,False,Lead and Gold: Gangs of the Wild West
42120,48801878,76561198096401593,this game would be a right laugh if more people played it servers are literally dead if you can get the lads together and get a group playing this it would be so much fun,True,3,0,0.5344346761703491,0,True,False,False,Lead and Gold: Gangs of the Wild West
42120,48694797,76561197984656039,ill chime in with everyone else and say this is a good game but its dead so i cant recommend it,False,0,0,0.5,0,True,False,False,Lead and Gold: Gangs of the Wild West
42120,47932056,76561198121777245,its a great game sadly it lacks players maybe they should go free to play or something,True,4,0,0.565815269947052,2,False,True,False,Lead and Gold: Gangs of the Wild West
42120,47732223,76561197980991791,great game they need to make a freetoplay and bring it back  but this game is not playable right now theres not enough player base,True,0,0,0.5,0,True,False,False,Lead and Gold: Gangs of the Wild West
42120,47712826,76561198106907382,pretty fun   its kinda dead and got some hackers probably  even though ive only found one so far  kinda sad if you think about it    also it cured my lumbago,True,1,0,0.5,0,False,True,False,Lead and Gold: Gangs of the Wild West
42120,47487533,76561198159531350,dead gameno players to be found on any server fun concept and gameplay if have 46 friends to play with y not give it a try  not recomendedif no friends to play with,True,0,0,0.5,0,False,True,False,Lead and Gold: Gangs of the Wild West
42120,47470054,76561198009314063,this game was awesome the classes were balanced easy to learn unique and satisfying animation levels  all beautiful ton of fun as a multiplayer fps3ps as people have noted pretty much no one plays the game anymore but it was great while it lasted i wonder if theres any way to revive it or rerelease it with more marketing,True,1,0,0.5170454382896423,0,True,False,False,Lead and Gold: Gangs of the Wild West
42120,46932227,76561198366233818,ok,True,0,0,0.5,0,False,False,False,Lead and Gold: Gangs of the Wild West
42120,46897239,76561198334644068,game is pretty good but a bad thing is nobody playing this game such a shame that this good game has no active players or story mode,True,2,0,0.5075757503509521,0,False,True,False,Lead and Gold: Gangs of the Wild West
42120,46564349,76561198173888702,overwatchs biggest competitor,True,2,2,0.5237267613410949,2,False,True,False,Lead and Gold: Gangs of the Wild West
42120,46493336,76561198051712901,lead and gold good fun of the wild west  servers are pretty much dead but if you can get a group of friends together its hecka fun,True,1,0,0.5238095521926879,0,False,False,False,Lead and Gold: Gangs of the Wild West
42120,45776442,76561198020739906,50000 people used to play here now its a ghost town  being serious though this is a good game unfortunate that time has forgotten it and nobody really plays it anymore even more shame that the only offline mode with bots is a small training sort of thing on one map where you stand alone against a few enemy bots as said before the servers are basically dead on all platforms including the ps3 version in which i was never able to find any other players to begin with,True,3,2,0.5172414183616638,0,False,False,False,Lead and Gold: Gangs of the Wild West
42120,45750778,76561197999435672,who needs red dead redemption when you have this masterpiece for pc,True,20,15,0.6361194252967834,0,False,False,False,Lead and Gold: Gangs of the Wild West
42120,45659126,76561198058579498,best cowboy simulator since fistful of frags dead game tho its really fun if you play with a bunch of friends but you need balanced teams or its not fun,True,0,0,0.5,0,False,False,False,Lead and Gold: Gangs of the Wild West
42120,45626164,76561198053033680,my first ever steam game had it since around 2011 and enjoyed it so much now nearly no one is playing it but i will never forget the good times of shooting people with the gatling gun or throwing dynamites at people and watching them explode while smokin a cigar  1010 just like loadout too bad it died,True,5,0,0.5401041507720947,0,False,False,False,Lead and Gold: Gangs of the Wild West
42120,45501849,76561198436987916,hey this game is good but there are a problem in the servers i can see only 1,True,0,0,0.5,0,False,False,False,Lead and Gold: Gangs of the Wild West
42120,45333787,76561198010934969,fun but no no one plays anymore waste of money and really it kinda sucks now,False,0,0,0.5,0,True,False,False,Lead and Gold: Gangs of the Wild West
42120,45309018,76561198225901848,game is average but could have been better if the development was more focused the characters are limited to what they can do and the map interaction is bad however concept is really good and would have been better if they could have worked abit more on the game,True,0,1,0.5,0,False,False,False,Lead and Gold: Gangs of the Wild West
42120,45282024,76561198307890446,fun but the server not managed for now,True,0,0,0.5,0,False,False,False,Lead and Gold: Gangs of the Wild West
42120,45195816,76561198010302041,this game was an amazing find imho simple yet detailed populated yet not over populated graphics are decent not to many bad glitchs  the players all seem to be focused on having fun which makes any multiplayer even that much more fun to play  well done for a free game no pay 2 win just a simple fun frag fest set in the old west fps game  recommend to anyone,True,0,0,0.5,0,True,True,False,Lead and Gold: Gangs of the Wild West
42120,45164605,76561198182972598,it loks fun and stuff but no1 is online any more once i foud a match cas the game was given out for free  and i had a blast 1 server online 0 peoples on it 410,False,6,1,0.5777668356895446,1,False,False,False,Lead and Gold: Gangs of the Wild West
42120,44908537,76561198026022945,got this off a g2a premium key game looks 2009 id play it for the amount i paid for it but god damn theres noone on the servers like literally nobody has anyone even played this game they dont even have a top100 players,False,0,0,0.4761904776096343,0,False,False,False,Lead and Gold: Gangs of the Wild West
