appid,recommendationid,author_steamid,review,voted_up,votes_up,votes_funny,weighted_vote_score,comment_count,steam_purchase,received_for_free,written_during_early_access,game_title
246760,78634014,76561198103358395,very raw  unpolished played majority of heroes and kings bounty games  this did not engage me  indie 610,True,0,0,0.4889975488185882,0,True,False,False,Legends of Eisenwald
246760,77082847,76561198941369657,great game,True,0,0,0.4717414677143096,0,True,False,False,Legends of Eisenwald
246760,76815061,76561198167638093,tis a good game,True,0,0,0.4717414677143096,0,True,False,False,Legends of Eisenwald
246760,76222335,76561198006687940,ithe one who sacrifices his conscience for justice receives not justice but its illusion alas i understood that too latei  berthold  ithe body is more valuable than the armor that protects it and personal conscience is more valuable than the ideas about justice that are impressed upon us by othersi  lady elisabeth   iif you can forgive it is never too latei  whispers in the wind of eisenwald,True,5,0,0.4876965880393981,0,True,False,False,Legends of Eisenwald
246760,75829302,76561198070988807,great,True,0,0,0.4717414677143096,0,True,False,False,Legends of Eisenwald
246760,74724802,76561197970950854,mehits cute,True,0,0,0.4889975488185882,0,True,False,False,Legends of Eisenwald
246760,74176854,76561198018476195,the game is unstable and ive had issues with it crashing randomly as well as save files not properly saving leading to crashes as i try to load them the quests are vague and unintuitive after the tutorial the game gives you little direction and its very easy to screw things up for yourself it shows promise and id stick with it if it wasnt for the fact that it keeps crashing on me randomly,False,1,0,0.4747277498245239,0,True,False,False,Legends of Eisenwald
246760,72295143,76561198208011179,good and well made game liked everything about it aside from the fact you generally lose all your amulets equipment and soldiers when you move to the next stage especially felt in the stage where you have to fight the landgrave would strongly recommend playing it regardless,True,2,0,0.5103999972343444,0,True,False,False,Legends of Eisenwald
246760,72060213,76561197998821719,fun,True,1,0,0.4993973076343536,0,False,False,False,Legends of Eisenwald
246760,71025204,76561198018727439,sadly i cannot recommend this game i am a lover of squad strategy turn based games and thus had a lot of hope for this game   too repetitive too clumsy too simplistic combat no story progression there are way better options out there,False,3,0,0.4762383103370666,0,False,False,False,Legends of Eisenwald
246760,70119403,76561198009505260,is ok,True,1,0,0.4399961531162261,0,True,False,False,Legends of Eisenwald
246760,70019793,76561197991825315,its cool but the devs used the engine of this game to make clones of itself so buy the newer ones instead,True,3,0,0.5276439189910888,0,True,False,False,Legends of Eisenwald
246760,69309919,76561198117321395,one of the best strategy rpg mixups the gameplay mechanics are great the story and historicalmythical background even better,True,3,0,0.5103999972343444,0,True,False,False,Legends of Eisenwald
246760,69060820,76561197973054802,i love the medieval setting but there was just something about this game that just refused to pull me in not sure if it was the slow pacing dull characters or lackluster combat all i know is that i really wanted to like this game but i couldnt,False,3,0,0.5395709872245787,0,True,False,False,Legends of Eisenwald
246760,68457506,76561197989022084,makes you feel like a 10 year old listening to epic stories good game,True,2,0,0.4895999729633331,0,True,False,False,Legends of Eisenwald
246760,68397010,76561198118995522,ive played about 26 hrs now great game nice visuals and some good story telling the game has chapters you must complete in order to progress the story  the game is quite difficult but once you learn how to maintain your units and learn how the healer works it becomes a little easier recommend saving often and having multiple saves as you never know what can happen next,True,5,0,0.5693453550338745,0,True,False,False,Legends of Eisenwald
246760,67911051,76561198000848041,the game never loads you start the game select start the tutorial the loading bar loads then the game freezes forever totally broken and the devs response is never more than have you tried rebooting your computer,False,1,1,0.4492624104022979,0,True,False,False,Legends of Eisenwald
246760,67403891,76561198111919556,i really enjoyed this game and now they have some new stuff out too im just waiting until it goes on sale which i would recommend to anyone wanting to try these games the game is very choice oriented which i also really enjoyed i would recommend these games to anyone really esspecially if you enjoy turn based tactics and choice matter games,True,4,0,0.536854863166809,0,True,False,False,Legends of Eisenwald
246760,67173972,76561198383264094,interesting and good humor togather with challaging tasks,True,2,0,0.5103999972343444,0,True,False,False,Legends of Eisenwald
246760,67121001,76561198063942713,its a great game good story and interesting game play,True,2,0,0.5103999972343444,0,True,False,False,Legends of Eisenwald
246760,66814687,76561198301019494, much better than i expected  turn based rpg  game  low system requirenment  rpg style quest system   battle system is mediocre  battle camera viev is bad  7 out of 10,True,1,0,0.5103999972343444,0,True,False,False,Legends of Eisenwald
246760,66631528,76561197997628831,i like the older european style of the world with light magic  to make it so you dont become too overpowered for the campaign you lose some of your troops items or gold between chapters so be on the watch for the chapter transitions  you always keep your character level and equipment which is good  if you look up what you lose differently at each chapter transition youll be fine,True,1,0,0.5103999972343444,0,False,False,False,Legends of Eisenwald
246760,66373522,76561198064336797,i tried to play this game a few times and did not like itfirstly i do not like to micro manage a kingdom secondly i do enjoy micro managing a battle like the bounty series of games or homm vi did enjoy the story telling but not the questslastly this game is far from intuitive and newbies will find it frustrating even on easy modebig on promiselittle on deliverywait for a huge discount it might be worth it then,False,3,1,0.4883694946765899,0,True,False,False,Legends of Eisenwald
246760,66081933,76561198007390596,great stories solid tbs battles interesting rpg elements i heartily recommend  ps played offline,True,4,0,0.5367981791496276,0,True,False,False,Legends of Eisenwald
246760,66023770,76561198019990324,all time classic game for the fans of turn based strategy games,True,3,0,0.533251941204071,0,True,False,False,Legends of Eisenwald
246760,65444527,76561197976988118,hidden gem,True,1,0,0.5103999972343444,0,False,False,False,Legends of Eisenwald
246760,65002507,76561198025814216,not tested for alternatives you have to either guess the pass written by developers or your game crashes to desktop,False,0,0,0.426011174917221,0,False,False,False,Legends of Eisenwald
246760,64022977,76561198369712930,dont bother with this game theres no rpg elements whatsoever because this game forces you to play as evil noble who kills and betrays people so have no choices in roleplaying your character,False,0,0,0.5323865413665771,0,True,False,False,Legends of Eisenwald
246760,63667901,76561198113019359,a lot of exploration and a great storyline,True,1,0,0.5103999972343444,0,True,False,False,Legends of Eisenwald
246760,62647329,76561198027763570,good game 3 0,True,3,0,0.5205614566802979,0,True,False,False,Legends of Eisenwald
246760,61635142,76561198083111881,this is awesome game rough around the edges sure but gamplay is fun and addictive think it as bastard child of kings bounty and disciples,True,1,0,0.5103999972343444,0,False,False,False,Legends of Eisenwald
246760,60332783,76561198288403784,this game can be a little frustrating but overall i do like the low fantasy world it is set in and i also like the very medieval look of the characters   i dont think ive got this game totally down yet but the learning curve is not steep  overall i highly recommend this one,True,4,0,0.5558663606643676,0,True,False,False,Legends of Eisenwald
246760,59337209,76561198229761548,i need to edit  post explanation but this one issue is what makes this review a negative and not a positive original post below  what is with the sick fucks that made this game they continually take away everything you spent hours earning and i mean everything they take your items they take all of your units that you leveled up and equipped with good gear they even take all of your money  wtf,False,2,1,0.4884537756443023,0,True,False,False,Legends of Eisenwald
246760,57150504,76561198143304094,old school vibes good story,True,3,0,0.4807101190090179,0,True,False,False,Legends of Eisenwald
246760,57056457,76561198113188006,easy to play quest are very interesting some going back and forth but storyline demands that,True,1,0,0.5103999972343444,0,True,False,False,Legends of Eisenwald
246760,56906755,76561198022378098,they still didnt fix the resolution scale until then my vote is no,False,4,0,0.5485485792160034,0,True,False,False,Legends of Eisenwald
246760,55945734,76561198442151411,cant even start it,False,0,0,0.4222542643547058,0,True,False,False,Legends of Eisenwald
246760,55325794,76561198007404427,i played it for 72 hours i must have liked it  i liked the combat system the writing the music and the story ,True,7,1,0.5603455901145935,0,True,False,False,Legends of Eisenwald
246760,55158902,76561197994782858,great strategy rpg with a very good settingsome tough decisions and a very good storythe only problem might be the high difficulty,True,1,0,0.5,0,True,False,False,Legends of Eisenwald
246760,55099801,76561197972465191,a nice game in principle but the strategic map interface is just too buggy frequently can see exactly where you want to go but cant issue to the command to get there gave up because i could not figure out how to exit the chapter 3 map even though i could see the destination and seemed to have a clear shot at it,False,3,0,0.5663540363311766,0,True,False,False,Legends of Eisenwald
246760,54628082,76561198032154637,gameplay reminds me of kings bounty but this is low fantasy setting much darker than kb the story is really good its worth to beat the game multiple times,True,1,0,0.5238095521926879,0,False,False,False,Legends of Eisenwald
246760,54359215,76561198061736988,this game is alright but theres really not much to the tactical side of this game its very simple and unintuitive also the the battle map is extremely small if you get it get it on a big sale,True,2,0,0.5010756254196166,0,False,False,False,Legends of Eisenwald
246760,54162865,76561197990453351,for me its unplayable due to slow paced gameplay take a quest and then travel 5 minutes in slow motion to get somewere then go back to heal units all in slow motion very sleepy game and the great combat aka disciple 2 cant save it,False,3,0,0.4651693999767303,1,False,False,False,Legends of Eisenwald
246760,53161996,76561198019099497,great tbsrpg game reminded me of oldschool disciples series i played long time ago just in a different setting thumbs up,True,1,0,0.5,0,True,False,False,Legends of Eisenwald
246760,52123437,76561198006975816,interesting blend of heroes of might and magic game play in real time and a fantastic story campaign highly recommended,True,1,0,0.5074626803398132,0,True,False,False,Legends of Eisenwald
246760,51478051,76561197996972957,simplistic combat massive unit upkeep bland story no magic or fantasy  i dont even know how i managed to score over 6h in this game must be that i like homm lookalikes or something  but no it is really not worth the time and money i could have got me a pizza and watch some old tv show and it would be time better spent   save yourself cash and disappoinment buy flowers for your mother instead or something,False,3,0,0.4754968285560607,0,True,False,False,Legends of Eisenwald
246760,51166548,76561198134194078,used to love this game wanted to get back into it but somehow getting 2 different error messages when trying to load into the game not at the launch but after the main menu  what i remember of the game was good but since i cant get into the game to provide a better review ill leave it as a game i dont recommend if you can get it to work then its recommended,False,1,0,0.4810874760150909,0,True,False,False,Legends of Eisenwald
246760,50926030,76561197993589983,not a bad little game but some awkward pathfinding problems and annoying quests make it somewhat boring,True,1,0,0.5187165737152098,0,True,False,False,Legends of Eisenwald
246760,50603962,76561198394015017,a great strategy challenge with strong rpg features,True,0,0,0.4673988819122314,0,True,False,False,Legends of Eisenwald
246760,50580310,76561198091949345,i got completely bored by this game history gameplay combat everything is plain the only reason i wont ask for a refund is because i want to give a moral suport to this indie developer,False,3,2,0.5059154033660888,0,True,False,False,Legends of Eisenwald
246760,50405419,76561198008447684,fun game liked it a lot  too bad it now crashes when trying to load a saved game   edit 5172019  decided to try a new game as a mystic  not sure why i liked this before the combat system is absolutely horrible  cant move characters except to engage in melee that has to be the worst idea ive ever heard ,False,1,0,0.4904631972312927,0,False,False,False,Legends of Eisenwald
246760,49313085,76561198042765523,i enjoyed the game for a while but it can be very frustrating i also despise any game where you work super hard to build yourself up just to have everything you have achieved ripped away at the next story chapterlookin at you age of wonders it needs some sort of strategy map outside the combat too if you get it in a humble bundle or super cheap sure give it a go otherwise move on,True,0,0,0.5,0,False,False,False,Legends of Eisenwald
