appid,recommendationid,author_steamid,review,voted_up,votes_up,votes_funny,weighted_vote_score,comment_count,steam_purchase,received_for_free,written_during_early_access,game_title
241930,199561589,76561198862768535,lithariel still got me bricked up,True,0,0,0.5,0,False,False,False,Middle-earth: Shadow of Mordor
241930,199551541,76561198219933216,ic xc ni ka,True,0,0,0.5,0,False,False,False,Middle-earth: Shadow of Mordor
241930,199546303,76561198853273044,gg,True,0,0,0.5,0,False,False,False,Middle-earth: Shadow of Mordor
241930,199482134,76561198072187466,"amazing gameplay a short but epic story good graphics even in todays standard 910",True,0,0,0.5,0,False,False,False,Middle-earth: Shadow of Mordor
