appid,recommendationid,author_steamid,review,voted_up,votes_up,votes_funny,weighted_vote_score,comment_count,steam_purchase,received_for_free,written_during_early_access,game_title
360960,201394017,76561199496599210,its more linear than postal 2 but i like story and sandbox games so its fine i played postal 2 and after beating it and apocalypse weekend it became my favorite game so i had to play this the new weapons arent really that good but the game is still fun i love that it keeps to the original postal 2 while still trying to be different 810  the original postal 2 was a 95 for me,True,0,0,0.5,0,False,False,False,Postal 2: Paradise Lost
360960,201160793,76561198850752745,that viagra sht works,True,0,0,0.5,0,True,False,False,Postal 2: Paradise Lost
360960,201090190,76561199817912711,this game is so awesome it changed my life,True,0,0,0.5,0,True,False,False,Postal 2: Paradise Lost
360960,201012181,76561199569887631,i regret nothing,True,0,0,0.5,0,True,False,False,Postal 2: Paradise Lost
360960,200967866,76561199793932972,new weapons thats great and maps and more bosses its fun,True,0,0,0.5,0,True,False,False,Postal 2: Paradise Lost
360960,200932280,76561198880357195,dlc piss,True,0,0,0.5,0,False,False,False,Postal 2: Paradise Lost
360960,200868523,76561199507931073,yes,True,0,0,0.5,0,True,False,False,Postal 2: Paradise Lost
360960,200259351,76561199223819887,not much to say if you enjoyed the base game of postal 2 this gives you one more week of it,True,0,0,0.5,0,True,False,False,Postal 2: Paradise Lost
360960,200234287,76561198147720654,i love it i feel like a kid again playing games in 2010 with postal it may be old but im a slut for nostalgia,True,0,0,0.4782608747482299,0,True,False,False,Postal 2: Paradise Lost
360960,200198527,76561198272371205,awesome,True,0,1,0.5,0,True,False,False,Postal 2: Paradise Lost
360960,200060941,76561199284453568,i regret nothing,True,0,0,0.5,0,False,False,False,Postal 2: Paradise Lost
360960,199976395,76561199209559935,more postal  i regret nothing,True,0,0,0.5,0,True,False,False,Postal 2: Paradise Lost
360960,199470752,76561199497843983,its not as good as the main postal game but it features some cool new weapons and an extra story campaign among some pretty funny jokes as to be expected i suggest you buy it after youve played the main game of course but its a pretty good time,True,0,0,0.5,0,True,False,False,Postal 2: Paradise Lost
360960,198436299,76561199233685857,ts game made me realize that i regret nothing,True,2,4,0.541984736919403,1,True,False,False,Postal 2: Paradise Lost
360960,197978578,76561198331026813,pizza,True,0,0,0.5,0,True,False,False,Postal 2: Paradise Lost
360960,197666288,76561199645146118,best dlc i bought,True,0,0,0.5,0,True,False,False,Postal 2: Paradise Lost
360960,197633213,76561199386364466,the best game ive ever played in my life,True,4,0,0.5783132910728453,0,True,False,False,Postal 2: Paradise Lost
360960,196831341,76561198019968469,if you liked the base game and wanted more this is it right here,True,0,0,0.5,0,True,False,False,Postal 2: Paradise Lost
360960,196280868,76561198397348135,combined with postal 2 this game is pretty damn good my game did crash several times before i could save which sucked but looking past that postal 2 is very re playable and great to chill and shoot,True,2,0,0.5,0,True,False,False,Postal 2: Paradise Lost
360960,196178237,76561199266717654,very dark and gretty,True,2,2,0.5454545617103576,1,True,False,False,Postal 2: Paradise Lost
360960,196115375,76561198822611873,amazing dlc for the game completely skipped postal 3 and am very happy i did,True,1,0,0.5,0,True,False,False,Postal 2: Paradise Lost
360960,195828920,76561198161129176,i regret nothing i did in this dlc,True,4,2,0.5354523062705993,0,True,False,False,Postal 2: Paradise Lost
360960,195697341,76561199188962666,absolute peak of postal ,True,1,0,0.5,0,True,False,False,Postal 2: Paradise Lost
360960,195594454,76561198171265507,parrerdise lost is one of the best dlc expansions i can think of i enjoy the environments of base postal 2 but they do a lot with the map here and its very cool i like alternate dude and champ and there are some pretty fun and unique missions here like big mcwillis gem mine the beginning with the crazy robots and the ape escape fan level cat escape,True,1,0,0.5,0,True,False,False,Postal 2: Paradise Lost
360960,195110442,76561198995089905,h1 i b the true postal 3 b i h1,True,6,1,0.5849056243896484,0,False,False,False,Postal 2: Paradise Lost
360960,194951090,76561199782391471,amazing dlc,True,0,0,0.5,0,True,False,False,Postal 2: Paradise Lost
360960,194305209,76561198986057355,the dlc of all time,True,0,0,0.5,0,True,False,False,Postal 2: Paradise Lost
360960,194184732,76561199013266655,paradise lost is basically just more postal 2 albeit with slightly lower quality writing in my opinion the whole colemen thing felt rather off in my opinion but its alright and it goes on sale for super cheap so id say go for it when it is,True,5,0,0.534899353981018,0,True,False,False,Postal 2: Paradise Lost
360960,194132574,76561199759981118,i feel like its safe to say this is better than postal 2,True,1,1,0.5,0,True,False,False,Postal 2: Paradise Lost
360960,194043166,76561199215613296,i still think the dlc is better than the game,True,0,0,0.5,0,True,False,False,Postal 2: Paradise Lost
360960,193716292,76561199277922669,its a postal dlc what more can you ask for,True,1,0,0.52173912525177,0,True,False,False,Postal 2: Paradise Lost
360960,192573742,76561199637824021,stop reading this and play alredy,True,1,2,0.5238095521926879,0,True,False,False,Postal 2: Paradise Lost
360960,192097128,76561199820388638,i play pokeymone go every day i pla pokie amon go,True,3,1,0.4935521781444549,0,False,False,False,Postal 2: Paradise Lost
360960,191612480,76561198065545740,piss on people whenever you want 10 years later,True,1,2,0.5238095521926879,0,True,False,False,Postal 2: Paradise Lost
360960,191252383,76561199015490639,my friend who i play csgo with said if i post a review on this game and it gets 200 likes and 200 awards that he will buy me a rtx 3060 and 2 kilos of canned ham so im just gonna leave this here help a brotha,True,15,1,0.5320252776145935,0,True,False,False,Postal 2: Paradise Lost
360960,191250702,76561199055182704,yes,True,0,0,0.5,0,True,False,False,Postal 2: Paradise Lost
360960,191157774,76561198860216390,day 3 is deviantart approved,True,1,0,0.5,0,True,False,False,Postal 2: Paradise Lost
360960,190932169,76561199470349608,fallout at home but also fucking slaps,True,0,0,0.5,0,True,False,False,Postal 2: Paradise Lost
360960,190011300,76561199520136754,nghhhhhhhhhhh so close i shall arrive,True,6,0,0.6066205501556396,0,True,False,False,Postal 2: Paradise Lost
360960,189872444,76561198002409244,i love the part where he says didnt you just save,True,4,1,0.5785440802574157,0,False,False,False,Postal 2: Paradise Lost
360960,189304027,76561199279065588,elp,True,0,0,0.5,0,True,False,False,Postal 2: Paradise Lost
360960,189224807,76561199518322072,its good kind of like the base week postal 2 mondayfriday but combined with fallout,True,1,0,0.5258620381355285,0,True,False,False,Postal 2: Paradise Lost
360960,188340590,76561198179360473,nice,True,0,0,0.5,0,True,False,False,Postal 2: Paradise Lost
360960,188288497,76561199197123622,great dlc but pls tear down postal 3 ,True,5,0,0.5833333134651184,0,True,False,False,Postal 2: Paradise Lost
360960,188011764,76561199133806970,its not as good as the base game of course but it still has the early 2000s feel of postal 2 i enjoyed it,True,5,0,0.5738812088966369,0,False,False,False,Postal 2: Paradise Lost
360960,187795000,76561199486552175,fun  brutal,True,0,0,0.5,0,True,False,False,Postal 2: Paradise Lost
360960,187790421,76561199005370995,funny part 2,True,1,0,0.5,0,False,True,False,Postal 2: Paradise Lost
360960,187749136,76561199562480630,i recommend not doing the entire wiseman part,True,2,0,0.5207641124725341,0,True,False,False,Postal 2: Paradise Lost
360960,187742164,76561199745527212,peakstol,True,1,0,0.5030514597892761,0,True,False,False,Postal 2: Paradise Lost
360960,187714245,76561199660030480,not bad  pissing on ppl is the best,True,1,2,0.5,0,False,False,False,Postal 2: Paradise Lost
360960,187570873,76561199748331111,best dlc ever,True,1,0,0.5,0,True,True,False,Postal 2: Paradise Lost
360960,186980310,76561199033114130,this is how i imagine jet addicts in fallout see the world,True,5,0,0.5820139646530151,0,True,False,False,Postal 2: Paradise Lost
360960,186715580,76561199554022248,good expansion,True,2,0,0.5199999809265136,0,True,False,False,Postal 2: Paradise Lost
360960,185612875,76561198100798306,and remember whatever you do have no regrets,True,3,0,0.5519080758094786,0,True,False,False,Postal 2: Paradise Lost
360960,185040747,76561198018316126,i regret nothing,True,1,0,0.503546118736267,0,False,False,False,Postal 2: Paradise Lost
360960,184861603,76561198284156309,dinosaur enemies are extremely unfair and not fun,False,2,5,0.4958768486976623,0,True,False,False,Postal 2: Paradise Lost
360960,184398930,76561198985607050,the real postal 3,True,5,0,0.5731707215309143,0,False,True,False,Postal 2: Paradise Lost
360960,184306663,76561198024340430,can of habibs power station enjoyer over here caw caw  its the best weapon in the game and nobody can tell me otherwise caw caw,True,7,1,0.5166027545928955,0,True,False,False,Postal 2: Paradise Lost
360960,184076509,76561199062110593,i actually enjoyed this more than the base game it was more funny and had unique interesting sectors in the paradise which were definitely worth exploring and the parts with the venda cure xj2 mad cow mikej vince desi chores b 1 t c h bossfights gary coleman alternative dude would definitely adds upto the replay value of this dlc the addition of weapon included in the dlc were also nice and fun,True,5,0,0.5958359241485595,0,True,False,False,Postal 2: Paradise Lost
360960,184044499,76561199238890416,literally just postal 3 disguised as a dlc,True,1,0,0.5,0,True,False,False,Postal 2: Paradise Lost
360960,183640339,76561199196181666,postal 2 meets fallout pretty good dlc for the price and equally enjoyable though the hellhole gauntlet and escapekill faction leaders part is a bit tedious on repeat playthroughs,True,0,0,0.5,0,True,False,False,Postal 2: Paradise Lost
360960,183438867,76561198984333448,goat,True,0,0,0.5,0,True,False,False,Postal 2: Paradise Lost
360960,183301369,76561198073206581,the start was good with just a few random crashes however towards the end of the game spoilerwhere you have the option to continue to carry out 5 optional missions spoilerit kept crashing making it impossible to spoilercomplete the extra missionsspoiler  its a nice expansionaddition to postal 2 but maybe hold off until they fix these crashing issues,False,5,1,0.5333333611488342,0,True,False,False,Postal 2: Paradise Lost
360960,183025750,76561198864338401,amazing dlc to an amazing game but it doesnt have a polish dub so it cant be a 1010 910 would kill zack ward again,True,1,0,0.5238095521926879,0,False,False,False,Postal 2: Paradise Lost
360960,182879132,76561198966511211,love the sequel amazing work out there,True,0,0,0.5,0,False,False,False,Postal 2: Paradise Lost
360960,182262327,76561199351703592,good dlc if you dont have this already with your postal 2 youre missing out its postal 2 but more,True,3,0,0.544684886932373,0,True,False,False,Postal 2: Paradise Lost
360960,182093997,76561198274263534,the true sequel,True,0,0,0.5,0,True,False,False,Postal 2: Paradise Lost
360960,181705863,76561198951745473,damn good dlc,True,0,0,0.5,0,True,False,False,Postal 2: Paradise Lost
360960,181612349,76561198112196464,i regret nothing,True,5,0,0.591141402721405,0,False,False,False,Postal 2: Paradise Lost
360960,181587539,76561199150141442,good dlc,True,0,0,0.5,0,True,False,False,Postal 2: Paradise Lost
360960,181109097,76561199386599567,,True,0,0,0.5,0,True,False,False,Postal 2: Paradise Lost
360960,180695067,76561199395650871,looks fun im gonna play it today and im gonna change this so i will put my opinion out,True,3,1,0.5580110549926757,0,True,False,False,Postal 2: Paradise Lost
360960,180083572,76561199658894655,yes,True,0,0,0.5,0,True,False,False,Postal 2: Paradise Lost
360960,179895397,76561198111552340,bro i played 2 weeks in paradise  and dog  guys guys this game is so much fun wtf,True,5,0,0.5958359241485595,0,True,False,False,Postal 2: Paradise Lost
360960,179794315,76561199171579552,if you liked postal 2 this might be right up your alley  paradise lost is a total mess like going back to your hometown only to find its completely fallen apart  the postal dude is back searching for champ and running into some familiar faces along the way as always the game doesnt take itself seriously classic postal 2 style  give it a shot you might end up liking it as much as i did,True,0,0,0.4761904776096343,0,False,False,False,Postal 2: Paradise Lost
360960,179775911,76561199522466897,i need to draw postal dud,True,0,0,0.4761904776096343,0,True,False,False,Postal 2: Paradise Lost
360960,179586200,76561198917015284,it makes me hard,True,3,1,0.5384615063667297,0,True,False,False,Postal 2: Paradise Lost
360960,179318062,76561198363989966,masterpiecethe sequel,True,0,0,0.5,0,False,False,False,Postal 2: Paradise Lost
360960,179140686,76561198094803808,310 keeps crashing on me,False,4,1,0.543505311012268,0,False,False,False,Postal 2: Paradise Lost
360960,179019669,76561198094231333,first dissonance painful spoiler alqaeda unable to defend itself spoiler  second dissonance pleasant spoiler there is always a certain madness in love but there is also always some reason in madness fn spoiler        note no game registration in dlc,True,0,0,0.5,0,True,False,False,Postal 2: Paradise Lost
360960,178130240,76561198088624871,great dlc which sort of inserts itself as postal 3 considering it retcons postal 3 whether or not you take it as that it does very well either way absolutely loved this dlc and got my monies worth paying full price adds some weapons and some new tech if you liked the base game you will love this just as much if not more especially as it builds from the base game highly recommend,True,3,0,0.5535714626312255,0,True,False,False,Postal 2: Paradise Lost
360960,177835732,76561197990471720,postal 2 paradise lost  the true postal 3,True,2,0,0.5435684919357299,0,True,False,False,Postal 2: Paradise Lost
360960,177419333,76561198110780023,this is postal iii,True,0,0,0.5,0,True,False,False,Postal 2: Paradise Lost
360960,177012443,76561199200517363,looks like the causal twitter community animal activists crackheads police brutality etc must buy its such a good game expansion of the original postal 2 and it gives a good ending with some secrets and mysteries revealed,True,0,0,0.4418484568595886,0,True,False,False,Postal 2: Paradise Lost
360960,176727519,76561198068257774,welcome to the wipe house how may i wipe you today,True,2,0,0.541984736919403,0,True,False,False,Postal 2: Paradise Lost
360960,176234262,76561199054570935,awesome actually great story,True,0,0,0.4694835841655731,0,True,False,False,Postal 2: Paradise Lost
360960,176019021,76561199018203535,a great expansion to the main game adds new weapons new bosses and gives paradise city an apocalyptic aesthetic       and its a better sequel than postal iii,True,2,1,0.5037195682525634,2,True,False,False,Postal 2: Paradise Lost
360960,175982073,76561199388503039,the apocalypse never changes,True,0,0,0.5,0,True,False,False,Postal 2: Paradise Lost
360960,175825937,76561198415401159,underpriced,True,0,0,0.5,0,True,False,False,Postal 2: Paradise Lost
360960,175738673,76561199523670967,very good ahhahahhahahahhaha,True,0,0,0.5,0,True,False,False,Postal 2: Paradise Lost
360960,175436612,76561198997770434,fallout new vegas,True,3,0,0.5290102362632751,0,True,False,False,Postal 2: Paradise Lost
360960,174981670,76561198067412570,crashes a lot but if you love postal 2 youll love this dlc,True,1,0,0.5172414183616638,0,True,False,False,Postal 2: Paradise Lost
360960,174554662,76561199330573177,crashes my beloved,True,1,2,0.5172414183616638,0,True,False,False,Postal 2: Paradise Lost
360960,174415091,76561199733563102,more gun yes pls btw apocolyplse wekend suks balls,True,0,0,0.4761904776096343,0,True,False,False,Postal 2: Paradise Lost
360960,174169103,76561198973687996,i wish rws just keep droping new dlcs for postal 2 instead of new games,True,2,0,0.5454545617103576,0,True,False,False,Postal 2: Paradise Lost
360960,174158999,76561198327155670,honestly at parts it is more fun than the base game i cant recommend paradise lost enough although yeah the crashes and bullet sponge enemies are annoying,True,3,0,0.5483871102333068,0,True,False,False,Postal 2: Paradise Lost
360960,174095919,76561199380740657,its good dlc and its funny and long,True,0,0,0.5,0,True,False,False,Postal 2: Paradise Lost
360960,174000138,76561199648335268,fun dlc but it literally crashes really often so you have to save a lot,True,1,0,0.5238095521926879,0,True,False,False,Postal 2: Paradise Lost
360960,173898133,76561198109175044,its just more postal 2 with the only bad things being the map is worse and uglier than the original my taste ig and the crashes were far more often i only got 2 or so playing through the base game but this dlc i was getting sooo many more just gotta quick save more often ,True,6,0,0.5905868411064147,0,False,False,False,Postal 2: Paradise Lost
360960,173679801,76561198065469526,the deus ex of postal,True,1,0,0.512820541858673,0,True,False,False,Postal 2: Paradise Lost
360960,173068122,76561199567954355,its good to know that postal 3 wasnt cannon and it was all a nightmare,True,0,1,0.5,0,True,False,False,Postal 2: Paradise Lost
360960,172351692,76561198860154770,its exactly the same edgy irreverent trash filled with dark humor and absurd jokes i love it,True,1,0,0.5019280314445494,0,False,False,False,Postal 2: Paradise Lost
360960,171334037,76561199143905461,got to fight fat demonic ex wife,True,1,0,0.5019280314445494,0,True,False,False,Postal 2: Paradise Lost
360960,171275662,76561199583272241,the real postal 3,True,1,0,0.5019280314445494,0,True,False,False,Postal 2: Paradise Lost
360960,171262000,76561198331865065,super cool,True,0,0,0.5,0,True,False,False,Postal 2: Paradise Lost
360960,171258962,76561199163835378,alternate postal dude told me to steal money from a semifamous actor 1110,True,1,0,0.5019280314445494,0,True,False,False,Postal 2: Paradise Lost
360960,171049266,76561198084056239,pigeon mission was a little over the top,True,1,0,0.5019280314445494,0,True,False,False,Postal 2: Paradise Lost
360960,171025953,76561199121999261,this in my opinion is the true ending to the postal series and also in my opinion the true postal 3 theres so much content in this dlc it could be considerd a standalone game,True,2,0,0.5091714859008789,0,True,False,False,Postal 2: Paradise Lost
360960,171003660,76561199060605140,this dlc is good,True,0,1,0.4980719685554504,0,True,False,False,Postal 2: Paradise Lost
360960,170899307,76561199139951089,good,True,0,0,0.5,0,True,False,False,Postal 2: Paradise Lost
360960,170732898,76561198979362554,one of the best games gets one of the best expansions,True,1,0,0.5019280314445494,0,True,False,False,Postal 2: Paradise Lost
360960,170622036,76561199420587541,i liked the part where the dude goes postal,True,6,0,0.586062729358673,0,True,False,False,Postal 2: Paradise Lost
360960,170381754,76561199029822835,you should have made this postal 3,True,1,0,0.5132743716239929,0,True,False,False,Postal 2: Paradise Lost
360960,170288275,76561198367491335,keeps crashing for no reason and rws does sht to fix it,False,2,0,0.4984520077705383,0,True,False,False,Postal 2: Paradise Lost
360960,170162260,76561199171425872,best 057 ive ever spent in my life,True,2,0,0.5199999809265136,0,True,False,False,Postal 2: Paradise Lost
360960,169625593,76561198348496149,3,True,0,0,0.4867256879806518,0,False,False,False,Postal 2: Paradise Lost
360960,169560335,76561198400695123,i love this game so much its so cool and fun to play thanks steam for this game may it always be my favourite game forever,True,0,0,0.4867256879806518,0,True,False,False,Postal 2: Paradise Lost
360960,169507702,76561199572102037,great game theme song was amazing unfortunately for some dam reason it wont let me play it,True,0,0,0.5,0,True,False,False,Postal 2: Paradise Lost
360960,169498204,76561199104468442,the real postal 3,True,6,0,0.598540186882019,0,True,False,False,Postal 2: Paradise Lost
360960,169380315,76561199094626285,wheres my paradise i lost it,True,1,1,0.5132743716239929,0,True,False,False,Postal 2: Paradise Lost
360960,169374057,76561199091304841,the fallout franchise if it was good,True,0,1,0.5,0,True,False,False,Postal 2: Paradise Lost
360960,169258939,76561199203269122,awesome but steam didnt let me review this game somewhy,True,0,1,0.5,0,True,False,False,Postal 2: Paradise Lost
360960,168886629,76561198361308112,kool,True,0,1,0.5,0,True,True,False,Postal 2: Paradise Lost
360960,168842711,76561199069440193,this dlc kinda sucks ngl just get it when its on sale otherwise dont bother,True,0,1,0.4782608747482299,0,True,False,False,Postal 2: Paradise Lost
360960,168738720,76561198145701026,the best christmas song of all time is in this dlc,True,0,1,0.5,0,True,False,False,Postal 2: Paradise Lost
360960,168658083,76561198829216861,i saw myself die mid cutscene 1010,True,4,2,0.5563025474548339,0,True,False,False,Postal 2: Paradise Lost
360960,168405125,76561198094317798,an excellent expansion pack that completely retcons the disaster that was postal 3 if you love postal 2 and want more excess postage this is for you go postal,True,0,1,0.5,0,True,False,False,Postal 2: Paradise Lost
360960,168404944,76561198120352511,the original sequel postal 3 was so bad that the original dev team had to come back together  create this masterpiece i just think thats a great story,True,0,1,0.5,0,True,False,False,Postal 2: Paradise Lost
360960,168053692,76561199284340382,better than postal iii,True,0,1,0.5,0,True,False,False,Postal 2: Paradise Lost
360960,167785766,76561198426592679,was preparing for a bossfight and the boss blew himself up great dlc,True,7,4,0.5760106444358825,0,False,True,False,Postal 2: Paradise Lost
360960,167729637,76561199179342631,dog is back,True,0,0,0.5,0,True,False,False,Postal 2: Paradise Lost
360960,167685423,76561199163911003,postal man,True,0,1,0.5,0,True,False,False,Postal 2: Paradise Lost
360960,167542396,76561198800001490,so glad i got the game and dlc before the game got delisted in australia i could imagine seeing the dlc page and not being able to buy the game would feel like a slap in the face to some people,True,0,0,0.5,0,False,True,False,Postal 2: Paradise Lost
360960,167401505,76561199591323729,youre able to kill zack word 2 times 1010,True,0,0,0.5,0,True,False,False,Postal 2: Paradise Lost
360960,167301349,76561198919808371,not as good as the standard base postal 2 but paradise lost is definitely worth checking out but the game definitely crashes a lot near the end which gets pretty annoying but its fun definitely feels a lot like the base postal 2 then something like apocalypse weekend so thats a plus,True,0,0,0.5,0,True,False,False,Postal 2: Paradise Lost
360960,167218818,76561199035608257,just get it,True,0,0,0.5,0,False,False,False,Postal 2: Paradise Lost
360960,166978634,76561199136266517,es como si mi pap volviera con la leche ,True,0,0,0.5,0,True,False,False,Postal 2: Paradise Lost
360960,166850026,76561199120344841,fallout 5,True,9,1,0.5982149243354797,0,True,False,False,Postal 2: Paradise Lost
360960,166835048,76561199370223880,better than postal iii,True,0,0,0.5,0,True,False,False,Postal 2: Paradise Lost
360960,166425540,76561199092132778,errands sucked but everything else was peak,True,1,0,0.5054945349693298,0,True,False,False,Postal 2: Paradise Lost
360960,166288090,76561198855139618,1010,True,2,1,0.5454545617103576,0,True,False,False,Postal 2: Paradise Lost
360960,166000772,76561199166438166,upon completing this absolute masterpiece i can only summarize my opinion with only a phrase i regret nothing,True,2,0,0.5054945349693298,0,False,False,False,Postal 2: Paradise Lost
360960,165984494,76561199043519951,the real postal 3 postal 3 wasnt bad actually,True,1,1,0.4816754162311553,0,True,False,False,Postal 2: Paradise Lost
360960,164945419,76561198844567296,it has the guy from postal 3,True,1,3,0.5054945349693298,0,True,False,False,Postal 2: Paradise Lost
360960,163774388,76561198117405424,just postal 2 but more of it and kinda better i really liked different biomes and new weapons are pretty good story is meh but its not like it was good in the original its pretty cheap so if you like the original game buy this for the full price and have fun,True,1,0,0.5238095521926879,0,False,False,False,Postal 2: Paradise Lost
360960,163728332,76561198035759274,its fucking amazing 1010,True,0,0,0.5,0,True,False,False,Postal 2: Paradise Lost
360960,163649754,76561198249980554,the paradise lost dlc for the original postal 2 is simply an absolute masterpiece its a brilliant sequel and expansion of the original game adding hours of new content levels and plenty of other surprises besides the additional maps are a blast to play through and offer all the classic violence dark humor and mayhem that were present in the original its more of the same but in the best possible way its definitely a mustplay for any fan of the original,True,5,1,0.5563139915466307,0,True,False,False,Postal 2: Paradise Lost
360960,163466245,76561198032582626,more postal 2 whats not to like,True,1,0,0.5205479264259338,0,True,False,False,Postal 2: Paradise Lost
