appid,recommendationid,author_steamid,review,voted_up,votes_up,votes_funny,weighted_vote_score,comment_count,steam_purchase,received_for_free,written_during_early_access,game_title
235360,199746789,76561198033234086,good tower defence game,True,0,0,0.5,0,True,False,False,Prime World: Defenders
235360,192003296,76561197996456189,classic tower defense game with a decent economy you are not held to one path when trying to get your towers or spells upgraded it has a feel of a microtransaction game without having to actually spend cash on it well worth the time spent,True,0,0,0.5,0,False,False,False,Prime World: Defenders
235360,173395211,76561198044122544,just a great tower defense game very straight forward and cut and dry the way it should be,True,0,0,0.4619565308094024,0,True,False,False,Prime World: Defenders
235360,171224412,76561198991221000,,True,0,0,0.5,0,True,False,False,Prime World: Defenders
235360,170930540,76561197985061294,at times frustrating and needlessly esoteric this is nevertheless a solid tower defense game with a cardcollecting mechanic that tends to be a bit too random to be 100 useful depending on your luck with drops you may have to spend extra time grinding some levels to advance huge hint lightning is op  but is also one of the most expensive towers in the game,True,0,0,0.5,0,True,False,False,Prime World: Defenders
235360,166724768,76561198042317098,310,False,0,0,0.5,0,False,False,False,Prime World: Defenders
235360,166613978,76561198042216542,it is a cellphone game converted to pc it has that tedious grinding to get cards and in game currency its all free now but the grind the grind is boring  i woud recommend it just because it is a td and i like those games but it does not have nothing special on it all the lore is not interesting and cliche it has a poor interface and theres not enought explanation about the towers and how they work porperly,False,0,0,0.5,0,True,False,False,Prime World: Defenders
235360,160646631,76561198052810464,good game,True,0,0,0.5,0,True,False,False,Prime World: Defenders
235360,159786584,76561198027845991,by far my favourite tower defence game always come back to it for a dose of satisfying goodness hope they implement an offline mode as i am worried of a server only game,True,1,0,0.5224719047546386,0,True,False,False,Prime World: Defenders
235360,158072564,76561199446465369,very good,True,0,0,0.5,0,True,False,False,Prime World: Defenders
235360,153216260,76561198034337684,no i dont recommend the game,False,0,0,0.4724409580230712,0,True,False,False,Prime World: Defenders
235360,150171472,76561198001439149,trash game trash devs  do not buy   they ported a mobile game to try and get pay to win mechanics converted to a grindfest for players  uninspired towers badly modelled enemies  the game is essentially unplayable if you have played any other td game,False,0,1,0.5,0,True,False,False,Prime World: Defenders
235360,147593868,76561198304880726,not bad but i dont love it,True,0,0,0.5,0,False,False,False,Prime World: Defenders
235360,146976555,76561198074353908,good game fun for when travelling with a laptop that does not have the best graphics card  i use this on an old surface pro2 touchsreen and it works great,True,0,0,0.5,0,True,False,False,Prime World: Defenders
235360,142934903,76561198018246949,a mobile free to play title that was ported to pc not enough was done to rebalance the game around no longer being a free to play title so it rapidly turns into an utter chore,False,0,0,0.5,0,False,False,False,Prime World: Defenders
235360,140624244,76561198028558172,its an okay tower defense game but because its a mobile port its gonna have grinding endgame which originally was meant to be a paywall since they removed the premium shop it just looks like a game that has a paywall but no premium shop because its cheap and you can complete the main campaign without the grind i will give thumbs up but just so you know better alternatives exist like dungeon defenders 1 and kingdom rush,True,2,0,0.547697365283966,0,False,False,False,Prime World: Defenders
235360,136333443,76561198055947532,its a lazy mobile port poor ui average gameplay its ok but nothing to recommend,False,0,0,0.5,0,False,False,False,Prime World: Defenders
235360,133369913,76561198071534382,besides the game age and grindiness the achievements dont trigger properly like half of them,False,0,0,0.5,0,True,False,False,Prime World: Defenders
235360,131894485,76561197973920098,simple yet lofty tower defense game tons of unique ways to upgrade towers instead of the usual one path one click tier system,True,1,0,0.5238095521926879,0,True,False,False,Prime World: Defenders
235360,124258016,76561197970838491,i love tower defense games this one would be ok if it didnt have such a terrible upgrade system   originally it was a pay to win or obscene levels of grinding type of game before it became a steam game once it became a steam game the pay to win went away which just leaves you with mindnumbing grinding and depending on rng for decent upgrades   this game isnt worth it even if it was free,False,0,0,0.5,0,True,False,False,Prime World: Defenders
235360,123166761,76561198083306080,  ,False,1,0,0.4887016415596008,0,False,False,False,Prime World: Defenders
235360,119693668,76561199041486494,its a mobile game or if not it definitely feels like one its grindy as hell and really repetitive,False,1,0,0.4841206967830657,0,False,False,False,Prime World: Defenders
235360,116135480,76561198397610307,nice little tower defense game at first  it gets tougher as youd expect though  none of this  microtransaction bs to irritate you either  and it can be replayed at a higher difficulty as an easy option,True,0,0,0.5,0,False,False,False,Prime World: Defenders
235360,114563042,76561197979353861,best tower defence game that i know of and i have played most of them to death,True,1,0,0.4863021969795227,0,True,False,False,Prime World: Defenders
235360,113241164,76561198114294919,good,True,0,0,0.4654654562473297,0,False,False,False,Prime World: Defenders
235360,110343774,76561197998455758,the perfect tower defense game an exciting upgrade system definitely worth your money,True,0,0,0.5,0,True,False,False,Prime World: Defenders
235360,104809990,76561198016909788,funny tower based game with a lot good challenges,True,0,0,0.5,0,False,False,False,Prime World: Defenders
235360,99451158,76561198047000803,nice tower defense game  short,True,0,0,0.5,0,True,False,False,Prime World: Defenders
235360,99042726,76561198006380910,,False,0,0,0.4479355812072753,0,True,False,False,Prime World: Defenders
235360,98247778,76561198244106160,still cool,True,0,0,0.5,0,False,False,False,Prime World: Defenders
235360,96900953,76561197991599016,if you are in the mood for a colorful brightly animated tower defense game with some depth then this game will hit the spot  as you finish levels or check in for the day the game will reward you with cards that unlock towers or spells  the variety of towers spells and enemies allows for sustained novelty  the story is depicted in between levels as a well illustrated comic strip  if you are a tower defense player this should definitely be in your playlist,True,1,0,0.509556233882904,0,False,False,False,Prime World: Defenders
235360,94186992,76561198032147867,too much grinding required to beat the game,False,9,1,0.5714867711067199,0,False,False,False,Prime World: Defenders
235360,92228189,76561198050670397,great strategy game,True,0,0,0.5,0,True,False,False,Prime World: Defenders
235360,91124509,76561198165794622,very well balanced tower defense game for me it is one of the most interesting td game i have come across towers are well designed with several levels and types of damage the story is also not so bad for td game after completing main story there is harder difficulty which extends the play time and test your skill in this game  overall i happily recommend this for every tower defense games player this game may be old but it is pleasure to play even in the year of 2021,True,0,0,0.5,0,False,False,False,Prime World: Defenders
235360,89811493,76561198011768411,top notch tower defense game  great graphics and the balance is excellent because when you are a little stuck on a level you have a natural mechanic to grind a bit and gain strength so you can move beyond that tough level  one of the best examples of the genre ive ever seen,True,0,0,0.5,0,True,False,False,Prime World: Defenders
235360,86051122,76561198024502690,,True,0,0,0.5,0,False,False,False,Prime World: Defenders
235360,85281946,76561198042494007,its an amazing tower defense game with some rpg elements,True,0,0,0.5,0,True,False,False,Prime World: Defenders
235360,82852933,76561198008376598,good game bit slow getting materials but apart from that good fun,True,0,0,0.5,0,True,False,False,Prime World: Defenders
235360,79270346,76561197993622243,winning is 80 grind 20 tactics level 1 towers are useless lvl 25 lightning tower works for almost everything,False,1,0,0.5,0,True,False,False,Prime World: Defenders
235360,78017888,76561198066696911,good turret defense game but it is a little old though hard to start out but is better once you have invested some time into it,True,0,0,0.5,0,True,False,False,Prime World: Defenders
235360,73174434,76561198095267005,a decent tower defense game with some card features,True,0,0,0.4749999940395355,0,False,False,False,Prime World: Defenders
235360,72941011,76561197999437251,very good tower defence game difficulty builds nicely as you progress,True,0,0,0.4749999940395355,0,False,False,False,Prime World: Defenders
235360,69901610,76561198064393751,i was quite enjoying this game then i started it up and found all my progress had been completely erased it seems the game doesnt use a local save and doesnt allow for backup saves even worse i found that this problem has been happening for like 6 years theres no point in playing this game if something like this can happen  dont risk it just avoid,False,3,1,0.5436022877693176,0,False,False,False,Prime World: Defenders
235360,68980183,76561197971064939,way too much grinding required,False,6,1,0.5424786210060119,0,True,False,False,Prime World: Defenders
235360,68959946,76561198160696998,nice game to kill some time if you dont have that much time  the levels are fun sometimes frustrating but still a nice game to play d i will recommend it thats for sure,True,0,0,0.5,0,True,False,False,Prime World: Defenders
235360,68883683,76561198041580078,fun,True,0,0,0.5,0,False,False,False,Prime World: Defenders
235360,68129122,76561198149123745,very challenging you have to use the right combinations of towers and upgrade upgrade upgrade,True,0,0,0.5,0,True,False,False,Prime World: Defenders
235360,67268435,76561197970372090,bloody marvellous,True,0,0,0.5,0,True,False,False,Prime World: Defenders
235360,64841540,76561198010192890,after my initial complaint the developer was very quick to respond and they must have patched it straight away because the game runs smoothly now its a fun tower defense game that looks very good the card collecting and forging doesnt really add anything imo but it doesnt do any harm either so im content,True,2,0,0.5424693822860717,1,False,False,False,Prime World: Defenders
235360,64564008,76561197972020792,yup,True,0,0,0.5,0,True,False,False,Prime World: Defenders
235360,63513718,76561197995821223,fun meter  710,True,2,0,0.5303566455841064,0,False,False,False,Prime World: Defenders
235360,63508024,76561198008407276,this is what you can consider a bad tower defense not only are most maps extremely boring to play it also has the audacity to waste your time with its progression,False,5,2,0.5069553256034851,0,True,False,False,Prime World: Defenders
235360,62595887,76561197970708559,game is fun for 5 but i cannot give this a positive review the developers have decided to go full pay to win for the sequel and try to justify the 20 per month subscription by adding even more premium bonuses thus making it even more pay to win i do not support greedy developers so unless you can get this game for under 5 or elsewhere for free then avoid it and do not give them your money this was my first negative review actually but disgusting developers deserve it,False,5,1,0.4872515201568603,0,True,False,False,Prime World: Defenders
235360,61397704,76561198208625279,excellent tower defense game,True,0,0,0.4678362607955932,0,False,False,False,Prime World: Defenders
235360,60874286,76561198078568289,ewrrt bwtw,True,1,0,0.4857142865657806,0,True,False,False,Prime World: Defenders
235360,60860362,76561197987921141,cool and cheap game its a lot of fun for many hours no microtransactions so thats makes it even better,True,0,0,0.5,0,False,False,False,Prime World: Defenders
235360,57000762,76561198151863374,played this game for years before i started playing it on steam really great td game,True,0,0,0.5,0,True,False,False,Prime World: Defenders
235360,56946281,76561198039480319,a good tower defence,True,0,0,0.5,0,True,False,False,Prime World: Defenders
235360,55396050,76561197999257916,poorly managed bad grinding,False,0,0,0.4576042890548706,0,True,False,False,Prime World: Defenders
235360,55253351,76561198027195149,this game is fun but beware it is chocked full of microtransactions if you want to be on top you will have to fork out serious cash additionally when they run events be sure to spend your event currency before the event ends unlike other similar games on the market they do not give you a courtesy 24 hours to spend your earnings just lost 200k alien cash because i was not aware of this flaw,True,0,0,0.5,0,True,False,False,Prime World: Defenders
235360,54271104,76561197990453351,with a long campaign randomly generated side missions and many cards to collect prime world defenders offers fans of the tower defence genre a lasting and varied challenge,True,1,0,0.4934693872928619,0,True,False,False,Prime World: Defenders
235360,53749282,76561198343264546,great game but ruined by technical issue constantly freeze while playing i tried every solution i found like excluded game folder from windows sercutiry block the game from internet connection via windows firewall but nothing work it keep freezing and it pi me off strangely i used to pirated this game before but it run smoothly like a charm ,False,1,1,0.4761904776096343,0,True,False,False,Prime World: Defenders
235360,51656491,76561197973299883,decent balance between grinding for itemslevels and fun gameplay cutscenes are badly broken on my 4k display so im not really sure whats going on with the story but the tower defense part works well enough does not seem to have learned much from other games in the genre though you cant tell how many mobs are left in a wave and how long before the next one so its too easy to accidentally summon a wave right as a new one starts,True,0,0,0.5,0,True,False,False,Prime World: Defenders
235360,51538901,76561198027267313,tags tower defense additional tags delete local content  remove from library  tldr decent looking at first until you realize this uses randomized rewards for beating levels play the free to play defenders 2 instead if you are still interested in such a mechanic,False,0,0,0.5,0,True,False,False,Prime World: Defenders
235360,50816035,76561198019576097,h1pretty good unfortunately theres too much grindh1  solid td nice graphics a history if you care classic towers types spread into cards and an upgrade   forge system however like the title says youll need a lot of grind here by the first boss it will be necessary and i can bet it will get worse the good news are theres a mobile version so im going to invest my time there in a more casual way you know waiting for the doctor in the airplane long buses trips,True,0,0,0.5,0,True,False,False,Prime World: Defenders
235360,50459558,76561198194475978,one of the best td game  it have a scenario a story,True,1,0,0.5238095521926879,0,True,False,False,Prime World: Defenders
235360,49816360,76561198289778406,severely underrated,True,0,0,0.4601989984512329,0,False,False,False,Prime World: Defenders
235360,49412410,76561197960457558,this is a grind in the shape of a tower defense an rngfueled grind all the stink of a mobile game is upon it both its mechanics and its interface and its boring and easy the story is both meaningless and unintelligible  give it a hard pass,False,3,0,0.5266515016555786,0,True,False,False,Prime World: Defenders
235360,49405018,76561198034649970,this game is worth every cent if i can get 40 hours out of a 10 game wow the maps have good varieties as do the enemies and bosses i like the tower system and the progression between towers the only downside is how it feels a little like a mobile game but that is purely subjective i wish nival would have kept with this format for pwd2,True,0,0,0.5,0,True,False,False,Prime World: Defenders
235360,48873229,76561198095805487,ive played a lot of tower defense games in my time and i have to say this is my favorite by far  i can see myself spending a lot of hours in this one,True,0,0,0.5,0,True,False,False,Prime World: Defenders
235360,48835047,76561197970602587,httpsyoutubeczaqcfm9uga  many of the progression hooks are based heavily over a slow currency grind and randomized upgrades that slows the pacing enough to drag player engagement,False,2,0,0.5435684919357299,0,False,False,False,Prime World: Defenders
235360,48387778,76561198032649576,nicely made game nice story achievements give you something that is rare there is grinding but not much unless you count all achievements even for some achievements too much minus special upgrades are quickly upgraded and they are few and some towers are too rare there is also a cloud saver preferably with a discount too bad they didnt make a 2nd game like the first one,True,1,0,0.517766535282135,0,True,False,False,Prime World: Defenders
235360,47788218,76561198081371819,fun little tower defense game seems like a tablet or mobile port although it was fun for a while the need for grinding becomes apparant in the later game  the maps are also designated paths with build location set by the game  i much prefer tower defense games that allow you to construct your own maze rather than having enemies follow a predefined route it allows for more strategy to be employed by the player  however i enjoyed this game non the less and totally got my money from it,True,0,0,0.5,0,True,False,False,Prime World: Defenders
235360,47579641,76561197969595318,too grindy spend hours getting to a point and cant progress because you havent gotten the right cards then you need to grind for hours hoping you actually get the right cards to drop very annoying,False,1,0,0.5,0,True,False,False,Prime World: Defenders
235360,47248233,76561197990117989,i cant recommend this because as of their last patch years ago there were some bugs that i consider major if they werent there i wouldnt hesitate to recommend this game their last patch broke some of the mechanics of the game making it very difficult to finish,False,0,1,0.4857142865657806,0,False,False,False,Prime World: Defenders
235360,47174760,76561197989223323,love this tower defense game i find it very relaxing and the graphics are great for its style of game,True,0,0,0.5,0,True,False,False,Prime World: Defenders
235360,45432124,76561198028629117,brilliant tower defence game with challenging aspects and not an easy win everytime for sure worth the money and would reccommend highly to anyone who also is looking for tower defence games all the time ignore the metacritic score if thats what sways you as its a very decent game,True,0,0,0.5,0,True,False,False,Prime World: Defenders
235360,45410676,76561198028980966,amazing td game good price lots of play time realistic graphics its never the same due to the card distribution system hands down the best td game on steam if youre looking for a fun challenging td game this is it look at the hrs ive spent on it you know this is a serious review also no bs dlc stuff you get the whole game for a small price,True,2,0,0.4738165736198425,0,True,False,False,Prime World: Defenders
235360,45340469,76561198068415904,fun game,True,0,0,0.5,0,True,False,False,Prime World: Defenders
235360,45293754,76561197984297537,great game if u like tds you have to play this one,True,0,0,0.5,0,True,False,False,Prime World: Defenders
235360,43570952,76561198285995361,it doesnt matter that the game is good  bthe devs completely abandoned itb you will have problems with bsteam cloudb and achievments completion,False,3,0,0.5066041946411132,0,True,False,False,Prime World: Defenders
235360,43309183,76561198007763336,this is most likely one of the best tower defense games i ever played,True,3,0,0.5329309701919555,0,False,False,False,Prime World: Defenders
235360,43062308,76561198084385268,the only tower defense game that i played that had a storysure it was not that great but it had something to further increase the enjoyment and involvement of the player to keep me entertained  graphics and gameplay though being ports are still good enough for pc,True,1,0,0.5238095521926879,2,False,False,False,Prime World: Defenders
235360,42965562,76561197990994295,sleek tower defense nice enemies nice animations topnotch graphics somewhat grindy as this is a classical timewaster for portable devices but thoroughly enjoyable you collect cards the represent your towers you may improve each tower through fusion or evolution of several same or different cards a sufficient number or cards varies the game evolving cards allows to change your strategy when you repeat the same map to earn more cards highly recommended,True,0,0,0.5,0,True,False,False,Prime World: Defenders
235360,42800309,76561197960284717,this is a fantastic game and highly underrated i paid like 1 for this and i feel bad now because its easily worth the 10 at full price its a great tower defense game with a card gamespell crafting system to upgrade both towers and spells as well as a kind of skill tree to unlock more tower slots and other things it has some other unique elements ive never seen anywhere else like being able to get more tower currency for starting npc waves early overall its a great package,True,1,0,0.5258620381355285,0,False,False,False,Prime World: Defenders
235360,42775770,76561197967001294,i was having an okay time playing this game until i spent my hard earned stars on a unique pack of cards only to be forced to sell them due to no inventory space how about let the user have the choice to sell other cards in their collection first terrible user experience i doubt the devs read these reviews but thanks for wasting my time  i can only recommend this game if you really like tower defense games its very grindy be careful when buying packs of cards,False,4,0,0.543482482433319,0,False,False,False,Prime World: Defenders
235360,42061430,76561197994315540,an odd mix of card collection and tower defense that surprisingly works really well together this is a short review read another for a more indepth look i love td games and this one is really fun plain and simple,True,0,0,0.5,0,True,False,False,Prime World: Defenders
235360,41100305,76561198046838862,this is the 2nd most fun tdg i have played next to deathtrap worth ther buy if you like tdg,True,1,0,0.5238095521926879,0,True,False,False,Prime World: Defenders
235360,41026746,76561197993864557,grind grind grind while a lot of tds with rpgish elements can suffer from the problem of  are my strategytactics wrong or do i need to just level up this one suffers from that more than most  and the grind only makes that worse   i could recommend this if it werent for those two problems,False,6,0,0.5304436087608337,3,True,False,False,Prime World: Defenders
235360,39334691,76561198068927556,a nice tower defence game but with limit endless mode,True,1,0,0.4935747385025024,0,True,False,False,Prime World: Defenders
235360,38934576,76561197981624277,out of the general tds out there this is decent and does the basics very well a little grindy as it appears to be a mobile port but i found it enjoyable,True,0,0,0.5,0,True,False,False,Prime World: Defenders
235360,38533841,76561198275994484,its nice,True,0,0,0.449782520532608,0,False,False,False,Prime World: Defenders
235360,38403040,76561198360697457,great game if you dont have a lot of time to waste,True,0,0,0.4654255509376525,0,False,True,False,Prime World: Defenders
235360,36408076,76561198054561699,an excellent tower defense game focusing on bringing the right combination of towers and spells to any given engagement level variety is great it can get very grindy at times though as you have to get a lot of cards to have the raw numbers to beat some levels,True,0,0,0.4866117537021636,0,True,False,False,Prime World: Defenders
235360,36173492,76561197983496416,its a good enough td even a bit better than good enough since it has a not bad progression system hehe but the game right now is reeeally cheap so if youre going to get it on the discounted price i mostly sure recommend it,True,0,0,0.4866117537021636,0,False,False,False,Prime World: Defenders
235360,35755009,76561197996426001,total garbage its a tablet game they dont even bother to update for pc controls boring and unbalanced,False,5,1,0.4599396288394927,2,False,False,False,Prime World: Defenders
235360,35648322,76561197970808607,very grindy ,False,4,0,0.4556320309638977,0,True,False,False,Prime World: Defenders
235360,35036346,76561197999459739,fun immersive and an awful lot of choices in customizing your towers tcg and td combined well it is a bit of a grinding game but i have never minded that style of game,True,4,0,0.5717245936393737,0,False,False,False,Prime World: Defenders
235360,34789270,76561198009523558,massive grinding,False,4,1,0.515254557132721,0,False,False,False,Prime World: Defenders
