appid,recommendationid,author_steamid,review,voted_up,votes_up,votes_funny,weighted_vote_score,comment_count,steam_purchase,received_for_free,written_during_early_access,game_title
235360,34270601,76561197999462480,cannot recommend due to bug that prevents me from playing game launching game gives me an steam authorization error and the only option is to close the game tried restarting steam and verifing game integrity to no success no help online 010,False,3,0,0.5121065378189086,0,False,False,False,Prime World: Defenders
235360,32229003,76561198007220143,good graphics and sounds  inovative in tower defence genre tons of towers and upgrades challanging achievements  but  extremely grind  710,True,5,0,0.5827937126159667,0,False,False,False,Prime World: Defenders
235360,30999189,76561198028474745,dont waste your money on this not worth it,False,2,1,0.4575524032115936,0,True,False,False,Prime World: Defenders
235360,30695504,76561198067726640,they took their sweet time but they fixed the online problem  as long as the game keeps working then it is a fun game,True,5,0,0.5566765666007994,0,False,False,False,Prime World: Defenders
235360,30629942,76561197970733785,zero developer support over longstanding bugs and too many small issues that plague the game compared to other tower defense games on the market i wanted to like this so badly as its got great graphics and i really like the talents and cards mechanics but sadly the actual gameplay isnt as good as can be found in other games of this type,False,9,0,0.5829150080680847,0,True,False,False,Prime World: Defenders
235360,30381030,76561198118789045,as everybody else said i also lost my progress at first i though it was probably my fault as i had to reinstall windows had to start all over again thanks but no thanks avoid this game,False,8,0,0.5441089868545532,0,True,False,False,Prime World: Defenders
235360,30261593,76561198141418778,,False,1,0,0.4736029505729675,0,True,False,False,Prime World: Defenders
235360,29860894,76561197967846415,gameplay is ok not great  theres much better td games out there  this is obviously a mobile port as the interface has a few quirks that arent suited to pc play  also achievements dont seem to work anymore which is a bummer  if you want a fun td game buy something else,False,5,0,0.5100070238113403,0,True,False,False,Prime World: Defenders
235360,29724316,76561198080826406,edit the problem has been fixed its a great game again  buy the game only if you want to support developers who dont care at all about their customers theyve stopped supporting the game and the servers were shut down as a consequence the achievements wont work anymore and your progress will only be saved locally such a shame for a game that had some great content,True,0,0,0.5010054111480712,0,True,False,False,Prime World: Defenders
235360,29687961,76561198065966161,servers where my saves were are no longer on i would not recommend it since it appears the publisher is no longer supporting it,False,15,0,0.5872995257377625,0,True,False,False,Prime World: Defenders
235360,29622351,76561198137599629,friends score and achievements not working looks like the servers has taken down without further notice good game with shitty dev dont buy anymore  httpsteamcommunitycomapp235360discussions0350540973990718992,False,8,0,0.5391505360603333,0,False,False,False,Prime World: Defenders
235360,29601057,76561198024988395,servers where my saves were are no longer on i would not reccomend it since it appears the publisher is no longer supporting it,False,8,0,0.511949598789215,0,True,False,False,Prime World: Defenders
235360,29095396,76561198208604827,sorry but if the developers dont give support to this according to what ive read i just have to delete this from my account and dont look back not recommended,False,15,0,0.5343158245086669,0,False,False,False,Prime World: Defenders
235360,29027595,76561198018503338,servers for the game are offline so you cant save your progress or get achievements anymore what a shame i would normally recommend this game,False,10,1,0.5593997240066528,0,True,False,False,Prime World: Defenders
235360,28956444,76561197966463795,no support no achievements lagspikes,False,14,1,0.5342118144035339,0,True,False,False,Prime World: Defenders
235360,28952871,76561197967685936,nothing special here there is a lot of games in this genre that just do it better,False,8,1,0.4930225014686584,0,True,False,False,Prime World: Defenders
235360,28857137,76561198043787860,4152017 edit servers have been restored and as such this reviews rating will change  product no longer has sync to ingame server which ties to achievements avoid review will change when problem has been fixed though that seems highly unlikely,True,1,0,0.5021459460258483,0,False,False,False,Prime World: Defenders
235360,28797127,76561197998835108,game for smartphone not for pc it does not seem right to drag and drop all the time plus the game is super slow on my computer on which i can play any of the latest fps a poor port to pc,False,5,0,0.5486466884613037,0,True,False,False,Prime World: Defenders
235360,28671974,76561197990343645,on first glance this is a pretty td game but it is heavily aimed towards mobile platforms the levels require an unhealthy amount of grinding to make any progress achievements and rankings are not available because the game servers to which the achievements are tied are shut down the game lags and stutters even with a decent gaming rig while pretty at first look it gets repetitive very fast the few random sound effects sound like a joke after the first hours go buy defense grid instead,False,1,0,0.5,0,True,False,False,Prime World: Defenders
235360,28597390,76561198052275786,if you seriously love td games then get this while its on sale but even then i wouldnt recommend it extremely unresponsive mouse controls and lags or freezes every few seconds when there is a lot going on for a td it had some innovative ideas but the controls and bugs make it unplayable completely,False,15,0,0.5843430757522583,0,True,False,False,Prime World: Defenders
235360,28511117,76561198065690198,prime world defenders was my first experience of a tower defense game on pc the game will have you grind and grind to improve your towers yet this game has alot of charm i spent alot of time playing and kept coming back for more love the art style and tower cards defenders got me hooked on tower defense games the holiday sale is almost upon us buy it on sale if your new to tower defense games give it a try,True,0,0,0.4761904776096343,0,True,False,False,Prime World: Defenders
235360,27716601,76561198033389298,its too bad the devs just let this game rot i dont really understand how they can still sell something that only half works its a decent tower defense game but since they apparently dont support it anymore i wont be recommending this,False,10,0,0.503283143043518,0,False,True,False,Prime World: Defenders
235360,26966115,76561197965821908,got it for free quite funny for a short time tower defense never gets old,True,0,0,0.4502866864204406,0,True,False,False,Prime World: Defenders
235360,26715486,76561198087236531,the servers for the game are currently down and the developers are not responding to any concerns the community is showing because of this  it looks like the servers are down for good  stats and achievements will not be recorded  i highly recommend you save your money and time and not buy this game  if the servers get put back up ill be changing my review  until then avoid this game,False,12,1,0.4934558570384979,0,False,False,False,Prime World: Defenders
235360,26616701,76561198056902027,tower defense 910   graphics  tech tree,True,0,0,0.5,0,True,False,False,Prime World: Defenders
235360,26551936,76561197998322836,this should not be on steam,False,6,1,0.4480499625205993,0,False,False,False,Prime World: Defenders
235360,25968815,76561198045264326,this game is dead in the water dont bother getting it it has been abandoned by the dev teams completely,False,9,0,0.5608108043670654,0,True,False,False,Prime World: Defenders
235360,25882802,76561198009377107,a really good tower defense game its also on mobile for free,True,3,0,0.5135863423347473,0,False,False,False,Prime World: Defenders
235360,25635890,76561198070885506,cool,True,0,0,0.4619565308094024,0,False,False,False,Prime World: Defenders
