appid,recommendationid,author_steamid,review,voted_up,votes_up,votes_funny,weighted_vote_score,comment_count,steam_purchase,received_for_free,written_during_early_access,game_title
12500,113248406,76561198172265399,i used to have the phone version of this game on my motorola tundra i loved playing it i have had trouble finding this version of puzzle quest for the pc as most of the more recent renditions are free to playpay to advance style downloads i was thrilled to find this on steam this warlords version is very similar to the old phone game i am enjoying it greatly fun match 3 and 4 battle game play with a story between battles well worth ten bucks,True,1,0,0.5104438662528991,0,True,False,False,Puzzle Quest: Challenge of the Warlords
12500,111831842,76561198435141764,the only complaint i have about this game is it doesnt recognize the t shape match as a 5 of a kind besides that the game play is fantastic for a match 3 game,True,0,0,0.5,2,True,False,False,Puzzle Quest: Challenge of the Warlords
12500,110746173,76561198028164055,classic puzzle game mixed with a campaign story to keep it interesting,True,0,0,0.5,0,True,False,False,Puzzle Quest: Challenge of the Warlords
12500,110096970,76561198080034760,one of the good ole games  easy to jump in and out of and just an all around good game   i do wish for a workshop tho,True,0,0,0.5,2,True,False,False,Puzzle Quest: Challenge of the Warlords
12500,109224497,76561199233234914,fantastic game  ive been coming back to playing this game over and over and every time i play again i have so much fun,True,0,0,0.5,0,True,False,False,Puzzle Quest: Challenge of the Warlords
12500,109220543,76561198003068947,i find it addictive but not actually enjoyable to play  you spend a lot of your time connecting gems and not very much time thinking about what spell to cast or what to equip  i do give the game kudos for having different modes for capturing enemies learning spells and forging items though,False,6,2,0.5314856767654418,0,True,False,False,Puzzle Quest: Challenge of the Warlords
12500,108400652,76561197987048381,use to play this on mobile phone was very addictive randomly i thought of this game years later and found it on steam absolute classic with many hours of play to keep you hooked too highly recommend,True,0,0,0.5,1,True,False,False,Puzzle Quest: Challenge of the Warlords
12500,107956667,76561198848755570,its a perfect port of the original if you played this on the ds or psp originally and liked it youll love this,True,0,0,0.5,2,True,False,False,Puzzle Quest: Challenge of the Warlords
12500,106158896,76561198022126858,best puzzle quest game there is the writing is brilliant a masterful rpg there was a free dlc for ps3 and mobile but it wasnt released for pc you can add it to your game from games discussions somebody ported it to pc,True,3,0,0.5519226789474487,0,True,False,False,Puzzle Quest: Challenge of the Warlords
12500,105181548,76561198054038647,a game ive played for at least 10 years now not a very long game but extremely fun and has different options for characterparty creation,True,0,0,0.5,0,True,False,False,Puzzle Quest: Challenge of the Warlords
12500,105042671,76561198054441260,i like it,True,0,0,0.5,0,True,False,False,Puzzle Quest: Challenge of the Warlords
12500,104099612,76561198028453179,puzzlequest challenge of the warlords is a great game a gem among many repetitive titles on steam the story is interesting and the game offers many additional features from collecting spellsweaponscompanions to conquering your new empire side quests which make the game feel complete i wish more match3 titles on steam had similar depth   i have played this game mainly before it was released to steam so hours on record are not accurate,True,0,0,0.5,2,True,False,False,Puzzle Quest: Challenge of the Warlords
12500,103844375,76561198036564020,typical gameplay of puzzlequest  might be abit annyoing later on to figth some enemies that buff themself maybe becauese you need to play a spell to survive till they oneshot you,True,0,0,0.5,0,True,False,False,Puzzle Quest: Challenge of the Warlords
12500,102161896,76561198037522624,played for hundreds of hours on pcgameboy,True,0,0,0.5,0,True,False,False,Puzzle Quest: Challenge of the Warlords
12500,101140104,76561198112530446,og game completely underrated deserves much more love,True,0,0,0.5,0,True,False,False,Puzzle Quest: Challenge of the Warlords
12500,98378863,76561198082671105,great game,True,0,0,0.5,0,True,False,False,Puzzle Quest: Challenge of the Warlords
12500,97305938,76561198019026984,i have spent hours and hours playing this fairly simple game matching items and pattern recognition seem to keep me entertained i am a simple man,True,0,0,0.5,0,True,False,False,Puzzle Quest: Challenge of the Warlords
12500,96903263,76561197992222385,pretty good game that mix rpg elements with a puzzle game ala candycrush   i recommend it because the replayability is quite there and the game is enjoyable for what it is,True,2,0,0.5332918763160704,2,True,False,False,Puzzle Quest: Challenge of the Warlords
12500,96174486,76561198150108504,amazing story captivating game play just a good game,True,0,0,0.5,0,True,False,False,Puzzle Quest: Challenge of the Warlords
12500,95572359,76561198065765379,great game classic puzzle fun,True,0,0,0.5,0,True,False,False,Puzzle Quest: Challenge of the Warlords
12500,92855598,76561197961702409,i didnt finis the game but definitely recommended fights and other things pacing is great game gradually gets tougher and moving around picking missions is simple and intuitive just a nice take on 3match games,True,0,0,0.4969418942928314,0,True,False,False,Puzzle Quest: Challenge of the Warlords
12500,92683143,76561197989026175,legendary game,True,2,0,0.5341901183128356,0,True,False,False,Puzzle Quest: Challenge of the Warlords
12500,90285380,76561198069659489,great classic match three gameplay with great rpg elements thrown in too  wish there were more like this,True,2,0,0.533774197101593,0,True,False,False,Puzzle Quest: Challenge of the Warlords
12500,89760160,76561198067475771,awesome game  the only match 3 game ive ever played more for the story than anything else played it on mobile years ago and never finished it finally found it on steam and decided to complete it once and for all awesome game that yes does get a bit tedious at times  but holy crap is it addictive i couldnt focus on anything till i finally put lord bane to rest,True,0,0,0.5,0,True,False,False,Puzzle Quest: Challenge of the Warlords
12500,89439344,76561198073536519,the game is too hard for my liking also having to think about the enemies turn is taking away a lot of fun i could have with trying to make big combos but currently i mostly have to avoid the enemy getting big combos otherwise they just kill you,False,0,0,0.5,0,True,False,False,Puzzle Quest: Challenge of the Warlords
12500,89205446,76561198355070128,i previously owned a hard copy of this game and spent many hours playing its old school graphics and such but entertaining none the less if you are a match 3 lover this is a great way to idle the hours away,True,0,0,0.4969418942928314,0,True,False,False,Puzzle Quest: Challenge of the Warlords
12500,88515896,76561198309770687,absolutely amazing story great gameplay extremely replayable a perfect game imo,True,0,0,0.4713871479034423,0,True,False,False,Puzzle Quest: Challenge of the Warlords
12500,88342929,76561197966788390,decent match 3 game but i would be just fine if i never played another one again  do me a favor do it do it,True,0,0,0.4741379022598266,0,True,False,False,Puzzle Quest: Challenge of the Warlords
12500,88294115,76561198038997539,a fun puzzle game and an absolute classic i played this back in high school and then played it again on steam  hilariously enough between the original i played on handheld and this one on steam a few things have been rebalanced most notably eriks bow has been drastically nerfed in the steam version this isnt a bad thing as the weapon was legitimately overpowered more interesting and silly that a nerf actually took place,True,1,0,0.5186859965324401,0,True,False,False,Puzzle Quest: Challenge of the Warlords
12500,87865829,76561198046952055,grew up with this on the ps2 so stoked to finally be able to play it again,True,0,0,0.5,1,True,False,False,Puzzle Quest: Challenge of the Warlords
12500,87840539,76561198013063315,good game,True,0,0,0.5,0,True,False,False,Puzzle Quest: Challenge of the Warlords
12500,87145497,76561197980391181,display problem all over the place black screen with tiny rez desktops on every game launch,False,1,0,0.495495468378067,0,True,False,False,Puzzle Quest: Challenge of the Warlords
12500,86952110,76561198176682299,classic,True,1,0,0.5138530135154724,0,True,False,False,Puzzle Quest: Challenge of the Warlords
12500,85174208,76561198291971770,one of the best tilematching rpgs to ever release,True,0,0,0.5,1,False,False,False,Puzzle Quest: Challenge of the Warlords
12500,83799090,76561198003124468,910 for good memories and ultimate troll ring,True,2,1,0.511017620563507,2,True,False,False,Puzzle Quest: Challenge of the Warlords
