appid,recommendationid,author_steamid,review,voted_up,votes_up,votes_funny,weighted_vote_score,comment_count,steam_purchase,received_for_free,written_during_early_access,game_title
12500,201298347,76561198219924196,this game just has no right being as fun and addicting as it is,True,1,0,0.5238095521926879,0,True,False,False,Puzzle Quest: Challenge of the Warlords
12500,199993616,76561197997790299,wish it had achievements,True,0,0,0.5,0,True,False,False,Puzzle Quest: Challenge of the Warlords
12500,199701057,76561198072390811,it is very fun even the story,True,0,0,0.5,0,True,False,False,Puzzle Quest: Challenge of the Warlords
12500,199657266,76561198353454195,fun,True,0,0,0.5,0,True,False,False,Puzzle Quest: Challenge of the Warlords
12500,198125501,76561198097617110,puzzle quest baby,True,0,0,0.5,0,True,False,False,Puzzle Quest: Challenge of the Warlords
12500,196556385,76561198053089197,"actually a peak game on the surface its just a gem matching game but its actually more like an rpg with a levelling system classes skills stat points and so much more really hard if im being honest but a brilliant game all around",True,2,0,0.5454545617103576,0,True,False,False,Puzzle Quest: Challenge of the Warlords
12500,195841573,76561199386279963,i bought this game when it first came out in cd  when i saw it here i couldnt believe it  it was like a dream  i started playing it and  i just love the match three with the little battle aids included but you have to match the mana with the battle strategies  play it yourself to experience what it means to do battle with monsters  its almost like playing lotr characters,True,0,0,0.5,0,True,False,False,Puzzle Quest: Challenge of the Warlords
12500,195706677,76561198128646757,your enjoyment of this game is relative to your tolerance towards rng often you lose half your health when starting a battle sometimes you lose outright the only thing more infuriating is that game design has never gotten better since the release of this game,False,0,0,0.4761904776096343,0,True,False,False,Puzzle Quest: Challenge of the Warlords
12500,194592908,76561198080915676,good memories with this game the hardest game mode is really difficult and challenging good game to pass time,True,2,0,0.5454545617103576,0,True,False,False,Puzzle Quest: Challenge of the Warlords
12500,193379329,76561198044832071,its a very interesting mix of rpg and puzzle gameplay,True,1,0,0.4761904776096343,0,True,False,False,Puzzle Quest: Challenge of the Warlords
12500,192675539,76561198090685320,addictive especially on  android tablets,True,0,0,0.5,0,True,False,False,Puzzle Quest: Challenge of the Warlords
12500,190584632,76561198066999431,match 3 and an rpg match made in heaven been a fan since the xbox 360 great on steam deck,True,1,0,0.5,0,True,False,False,Puzzle Quest: Challenge of the Warlords
12500,189945636,76561199003642964,this game takes me way back really fun tbh,True,0,0,0.5,0,False,True,False,Puzzle Quest: Challenge of the Warlords
12500,188255944,76561198070518645,a classic match3 rpg adventure game i spent hundreds of hours playing it from a cd offsteam and regularly return to play a couple boards every now and again simple and fun with good old animeish artstyle a big recommend to everyone,True,2,0,0.5238095521926879,0,True,False,False,Puzzle Quest: Challenge of the Warlords
12500,186405068,76561198171904745,the match3 rpg give it a shot,True,1,0,0.5161290764808654,0,True,False,False,Puzzle Quest: Challenge of the Warlords
12500,184504328,76561198140669224,the best puzzle game ive ever played i enjoy it than most puzzle games since it has rpg elements in it,True,2,0,0.5495495200157166,0,True,False,False,Puzzle Quest: Challenge of the Warlords
12500,183936351,76561198354338098,this game is awesome  but then when you get to pq2 youre like ehthen go to pq3 and that is a shit gameso yeah this is the best one out of the 3  play this one and only this one,True,1,0,0.5238095521926879,0,True,False,False,Puzzle Quest: Challenge of the Warlords
12500,183268074,76561199104422974,good,True,0,0,0.5,0,True,False,False,Puzzle Quest: Challenge of the Warlords
12500,182817288,76561198038183131,fun game when youre looking to kill a few minutes here and there would be awesome if the expansions were available,True,1,0,0.5,0,True,False,False,Puzzle Quest: Challenge of the Warlords
12500,182728127,76561198069258696,i got into puzzle quest through a small mobile version of it that they had for my flip phone well over 10 years ago i have since spent many hours and multiple playthroughs of this game and the expansion that they added years later only made it better although the story is fairly simple the gameplay is definitely one of if not the best amongst the match3 games i absolutely cannot recommend this game enough,True,2,0,0.5454545617103576,0,True,False,False,Puzzle Quest: Challenge of the Warlords
12500,178919413,76561198374223151,so between steam xbox and 3ds i have around 300 hrs logged on this game its a great fantasy based match 3 with actually a lot of strategy involved its fun figuring out how you can minmax certain builds with spells and items once you hit higher levels and get the right combination of spells with the right gear you can do massive amounts of damage at a time i really enjoy the art and music too one of my favorite soundtracks,True,2,0,0.5167708396911621,0,True,False,False,Puzzle Quest: Challenge of the Warlords
12500,177191928,76561199036638292,ver gud,True,0,0,0.5,0,True,False,False,Puzzle Quest: Challenge of the Warlords
12500,173583941,76561198032684267,match 3 rpg pretty sweet,True,1,0,0.5251396894454956,0,True,False,False,Puzzle Quest: Challenge of the Warlords
12500,172267576,76561199475149512,for a senior i find this fun,True,0,0,0.5,0,True,False,False,Puzzle Quest: Challenge of the Warlords
12500,171845401,76561198052990992,best game,True,0,0,0.5,2,True,False,False,Puzzle Quest: Challenge of the Warlords
12500,171488384,76561198035889000,fun match3 without any micro transactions holds up well but doesnt run on steam deck,True,1,0,0.5253164172172546,0,True,False,False,Puzzle Quest: Challenge of the Warlords
12500,170583431,76561198024988244,"nice classic match3 it has some minor issues matching 4 and 5 gems only counts for straight line quite high difficulty spike near the end but it was a good experience nonetheless the art is good the story is ok i had no technical issues with it  minor hint if you get stuck in one of the quests near the end of the game make sure to remove a certain team member temporarly",True,2,0,0.5440729856491088,0,False,False,False,Puzzle Quest: Challenge of the Warlords
12500,168254766,76561198137739675,its a real fun game that is absolutely perfect for the steam deck albeit with a few graphical glitches regarding the skull tokens very distortive but not terrible,True,1,0,0.5258620381355285,2,True,False,False,Puzzle Quest: Challenge of the Warlords
12500,165707606,76561198048900046,puzzle quest is an elegant system that still holds up in the modern day i find myself going back to it often the mechanics are unique and enjoyable with a lot of different subsystems to explore plus the soundtrack rules all in all i judge this game a true heroic effort on the part of the developers,True,2,0,0.5137763023376464,0,True,False,False,Puzzle Quest: Challenge of the Warlords
12500,165070522,76561197963382404,this is well made and fun for me even though it is not my usual type of game   love the rpg mechanics tied to the puzzle battle,True,0,0,0.5,0,True,False,False,Puzzle Quest: Challenge of the Warlords
12500,164772941,76561198019819077,the og match 3 rpg,True,3,0,0.5454545617103576,0,True,False,False,Puzzle Quest: Challenge of the Warlords
12500,162907343,76561197989883843,of course its a classic  fun match3 gameplay with suprisingly deep rpg elements,True,0,0,0.4794578850269317,0,True,False,False,Puzzle Quest: Challenge of the Warlords
12500,162252765,76561197967357795,just a really well done match3 without all the bullshit of micro transactions and 1000 hero levels,True,0,0,0.5,0,True,False,False,Puzzle Quest: Challenge of the Warlords
12500,161607142,76561197991825366,i was introduce to this game at a lan party a loooong time ago i have bought it multiple times on different systems its a really great idea and executed perfectly it was a fun experience to level up and play through the story and on top of that you can duel your mates sick game,True,0,0,0.5,0,True,False,False,Puzzle Quest: Challenge of the Warlords
12500,160388785,76561197993485664,my purchased coin would somehow disappear and  i noticed this happened multiple times to edge me into buying more,False,0,1,0.4697986543178558,0,True,False,False,Puzzle Quest: Challenge of the Warlords
12500,159488837,76561198038729462,this is the best match game ive ever played and the mix with role playing makes it as good as this kind of game can possibly be looking forward to completing it a few more times get it,True,2,0,0.52173912525177,0,True,False,False,Puzzle Quest: Challenge of the Warlords
12500,159036121,76561198067574390,sweet nostalgia  i was obsessed with this game on the ds in my 20s i was beyond excited when i found out it is available on steam  to anyone who likes columnscollapse style puzzle games get this  you will not be disappointed especially if youve ever hoped for a bit more depth to the gameplay,True,0,0,0.4701551496982574,0,True,False,False,Puzzle Quest: Challenge of the Warlords
12500,158572695,76561198840471752,i have been playing this game on and off for over 10 years i keep coming back because i like the premise of the game gems of war is based off of this game and i honestly wish it was more like this one the game is turn based and you collect mana in order to perform spells against enemies even if it is super old by now it is still worth a play through,True,0,0,0.5,0,True,False,False,Puzzle Quest: Challenge of the Warlords
12500,155337370,76561198363883339,a great game and a lot of nice memories id like more games rpg match 3 like this one,True,1,0,0.5115171074867249,2,True,False,False,Puzzle Quest: Challenge of the Warlords
12500,155077310,76561198023529867,over 15 years later i still havent come across a game of its kind as good as the original puzzle quest was despite the many clones and sequels,True,0,0,0.5,0,True,False,False,Puzzle Quest: Challenge of the Warlords
12500,154701954,76561198063274413,it is very repetitive after a while and becomes boring,False,1,1,0.4857142865657806,0,True,False,False,Puzzle Quest: Challenge of the Warlords
12500,154430261,76561199527489267,i always loved this game when i was a kid,True,1,0,0.5205479264259338,0,True,False,False,Puzzle Quest: Challenge of the Warlords
12500,149907901,76561199551981740,fun game fun system,True,0,0,0.5,0,False,False,False,Puzzle Quest: Challenge of the Warlords
12500,149836386,76561197972341970,does not autosave on windows 11,False,1,1,0.4772602617740631,0,True,False,False,Puzzle Quest: Challenge of the Warlords
12500,149765854,76561198030042641,you will be hooked in a good way,True,0,0,0.5,0,False,False,False,Puzzle Quest: Challenge of the Warlords
12500,149538157,76561199123109441,awesome game i suck less at it than i did when i was 8,True,0,0,0.5,0,True,False,False,Puzzle Quest: Challenge of the Warlords
12500,149176397,76561197998693223,i would recommend if you like gem matching games however if the resistance s are actually accurate i am the most unlucky person the fucking planet 120 has resisted almost all my spells over the last 10 hours of play   i am going to go back to fire emblem where s actually mean anything,True,0,0,0.5,0,True,False,False,Puzzle Quest: Challenge of the Warlords
12500,149077040,76561198033261035,good merga match 3 and rpg,True,0,0,0.5,0,True,False,False,Puzzle Quest: Challenge of the Warlords
12500,148708403,76561198002402040,simple but very addictive hits the feeling accomplished neurons perfectly ,True,0,0,0.5,2,True,False,False,Puzzle Quest: Challenge of the Warlords
12500,148658618,76561198030866503,a simple but great game you can play it casually to relax but some of the later battles are also pretty tricky the spells and skills expand the gameplay beyond a mere match 3 puzzle i dont play a lot of match 3 games but this one is definitely the best ive ever come across i put a lot more hours into this game on a nonsteam version 15 years ago,True,0,0,0.5,0,True,False,False,Puzzle Quest: Challenge of the Warlords
12500,145823313,76561198021432590,910 loads of fun and challenging gem matching game with monsters to fight and different heroes to fight with   back when you didnt need to microtransact your way into playing,True,0,0,0.5,0,True,False,False,Puzzle Quest: Challenge of the Warlords
12500,145695960,76561198849311418,better than 3 nuff said what happpened to one ,True,0,0,0.5,1,True,False,False,Puzzle Quest: Challenge of the Warlords
12500,145652955,76561198005438998,both relaxing and challenging get it when it is on discount,True,0,0,0.5,0,True,False,False,Puzzle Quest: Challenge of the Warlords
12500,144533386,76561197961357409,pog,True,0,0,0.5,2,True,False,False,Puzzle Quest: Challenge of the Warlords
12500,143807947,76561197992936523,is good,True,0,0,0.5,0,True,False,False,Puzzle Quest: Challenge of the Warlords
12500,143486815,76561198018246949,the original is the best  forget the sequels and stick to this,True,0,0,0.5,0,True,False,False,Puzzle Quest: Challenge of the Warlords
12500,143434156,76561198064325693,i played this long ago in 2007 still fun but very grindy great for those who love the strategy puzzle games with a leveling up system,True,0,0,0.5,0,True,False,False,Puzzle Quest: Challenge of the Warlords
12500,142332686,76561197994000299,a combination of  a  simple rpg match 3 and chess like chess you have to figure out what you opponent will do next on the match 3 board so you do not leave him a great move still figuring it out but i am enchanted by the developers strategy not the griffin i defeated him,True,0,0,0.5,0,True,False,False,Puzzle Quest: Challenge of the Warlords
12500,141918843,76561198310035948,legendary masterpiece  one of the best if not the best match 3 rpg game,True,0,0,0.5,0,True,False,False,Puzzle Quest: Challenge of the Warlords
12500,141742564,76561198328902021,i love this game when i played it on the xbox decided to download it to my pc and it doesnt want to work looked at all the options game loads up perfectly but wont allow you to change the name or the profession when you get in to the game you cant select the citadel and actually start it,False,1,0,0.5,0,True,False,False,Puzzle Quest: Challenge of the Warlords
12500,141208276,76561197971083634,the original and the best puzzle match fantasy game got some age on it now but never fails to entertain even more fun with mods,True,3,0,0.5528455376625061,1,True,False,False,Puzzle Quest: Challenge of the Warlords
12500,139233983,76561198272358655,ggggggggg,True,0,1,0.5,0,False,False,False,Puzzle Quest: Challenge of the Warlords
12500,138647307,76561198025423612,great game combines a lot of different elements to make a fun puzzle game,True,0,0,0.5,0,True,False,False,Puzzle Quest: Challenge of the Warlords
12500,137934926,76561197989778381,tragically underrated inherently fun match3 gameplay combined with rpg power gain spells can attack enemies directly or alter the board in a way that benefits you the forge mechanic can practically break the game if you can clear the required puzzles and the story is better than you might expect,True,0,0,0.5,0,True,False,False,Puzzle Quest: Challenge of the Warlords
12500,137416765,76561199146682955,fun and simple stays interesting with some moderate challenges,True,0,0,0.5,0,True,False,False,Puzzle Quest: Challenge of the Warlords
12500,137253887,76561197972650789,fun casual game to kill time while youre doing something else better than the sequel,True,2,0,0.5440729856491088,0,True,False,False,Puzzle Quest: Challenge of the Warlords
12500,136765765,76561198008637907,addictive,True,0,0,0.5,2,True,False,False,Puzzle Quest: Challenge of the Warlords
12500,136135850,76561197982332500,great game,True,0,0,0.5,0,True,False,False,Puzzle Quest: Challenge of the Warlords
12500,135322414,76561198021899370,this is a nice simple match3 game with a story it is what it pretends to be its soothing,True,0,0,0.5,0,True,False,False,Puzzle Quest: Challenge of the Warlords
12500,133088320,76561198071461334,i love this game its seemingly simple but extra spells and items make every fight interesting i used to play it on psp too  i must note that the final boss is pretty hard ultimate ring of trolls recommended and also crafting high level gear and learning high level spells can seem utterly impossible,True,1,0,0.5238095521926879,1,False,False,False,Puzzle Quest: Challenge of the Warlords
12500,132051478,76561197979730563,its an oldie but a goodie play it already d,True,0,0,0.5,0,True,False,False,Puzzle Quest: Challenge of the Warlords
12500,131986905,76561198085680133,it wont work ive uninstalled and reinstalled not working since last os update rolling back does no good,False,0,1,0.5,0,True,False,False,Puzzle Quest: Challenge of the Warlords
12500,131331228,76561197987447200,its real good insta but if you like match3,True,0,0,0.5,0,True,False,False,Puzzle Quest: Challenge of the Warlords
12500,131114078,76561198817464690,this is an addicting match 3 title with rpg elements to give the puzzle based gameplay loop more depth you will have to do a little tinkering to get this to run on modern hardware and there are no steam achievements but this is still the definitive puzzle quest title to get  the new ones ex puzzle quest 3 marvel puzzle quest are horrible pay to win mobile ports littered with microtransactions,True,0,0,0.5,0,True,False,False,Puzzle Quest: Challenge of the Warlords
12500,129708805,76561198050406780,this is one of the most entertaining games of this genre i have played the art is beautiful and there are many different ways to play depending if you are battling researching a new spell capturing an enemy or forging a new item capturing enemies and researching spells is one of my favorite things since you can make your own spell combinations wich is very fun,True,0,0,0.5,0,True,False,False,Puzzle Quest: Challenge of the Warlords
12500,129573114,76561198429494571,very good,True,0,0,0.5,0,True,False,False,Puzzle Quest: Challenge of the Warlords
12500,128765059,76561198241984176,ees fun,True,0,0,0.5,0,True,False,False,Puzzle Quest: Challenge of the Warlords
12500,128746561,76561198064937655,fun engaging and has creative mechanics as someone who enjoys matchthree games this game has exceeded my expectations of good potential,True,0,0,0.5,0,True,False,False,Puzzle Quest: Challenge of the Warlords
12500,128613138,76561198067755755,candy crush with guns 1010,True,1,0,0.5093066096305847,1,True,False,False,Puzzle Quest: Challenge of the Warlords
12500,128575351,76561197971113231,silly drop mechanics for the ai,False,2,0,0.4831542372703552,0,True,False,False,Puzzle Quest: Challenge of the Warlords
12500,128236912,76561198015122180,provides a fun rpg twist to the classic match 3 genre,True,0,0,0.5,0,True,False,False,Puzzle Quest: Challenge of the Warlords
12500,128067913,76561198031101512,great game loads of fun,True,0,0,0.5,0,True,False,False,Puzzle Quest: Challenge of the Warlords
12500,128035992,76561198855356096,this game is one of if not the best puzzle games ever made for me its addicting fun and nostalgic because i played it for ages on the psp the entire game feels well thought out and the system used for learning spells training mounts forging items or leveling up is really good i would recommend this game to anyone who likes puzzle games,True,0,0,0.5,1,True,False,False,Puzzle Quest: Challenge of the Warlords
12500,125635243,76561198010592138,best time killer,True,0,0,0.5,0,False,False,False,Puzzle Quest: Challenge of the Warlords
12500,125148941,76561198051325251,have spent an inordinate amount of time on this but it is a great casual game for shorter or longer bouts shame the sequel is no longer available,True,0,0,0.5,0,True,False,False,Puzzle Quest: Challenge of the Warlords
12500,124990244,76561199151203724,i played this game on my ds when i was a kid and it is so fun it was my favorite game then and i still love it now,True,0,0,0.5,0,True,False,False,Puzzle Quest: Challenge of the Warlords
12500,124347238,76561198074925547,i remember this game from way back in the 00s and thought id give it a try but i had forgotten how egregiously the ai cheats or rather gets exceptionally lucky with truly incredible frequency that would get me kicked out or worse if it happened at poker night they said that pq2 would not cheat a little better so ill give that one a try,False,1,1,0.4939844012260437,0,True,False,False,Puzzle Quest: Challenge of the Warlords
12500,124056547,76561198038421342,too underrated,True,0,0,0.5,0,True,False,False,Puzzle Quest: Challenge of the Warlords
12500,123793756,76561198119764307,my favorite idle game from childhood simple charming and fun highly recommend for casual gamers or those looking for relaxing gameplay with a fun themeing,True,0,0,0.4821958243846893,0,True,False,False,Puzzle Quest: Challenge of the Warlords
12500,123041318,76561197981759884,its a fun little game if you like matching type games it has a small rpg element too,True,2,0,0.5495495200157166,0,True,False,False,Puzzle Quest: Challenge of the Warlords
12500,122948523,76561198024313045,much fun,True,0,0,0.5,1,True,False,False,Puzzle Quest: Challenge of the Warlords
12500,122469236,76561198418819289,my fav match 3 game,True,0,0,0.5,0,True,False,False,Puzzle Quest: Challenge of the Warlords
12500,122243312,76561197987418093,this is one of the first match 3 games that feels like a complete game experience make sure to grab the expansion that is not sold on steam but can be found free online with a quick google search youre welcome,True,0,0,0.5,1,True,False,False,Puzzle Quest: Challenge of the Warlords
12500,122115527,76561198143008451,a classic gemmatching game that still holds up in the 2020s i have been playing this game on and off on various systems for well over a decade now and i highly recommend anyone interested in the genre give this a look  the rpg elements and script add to the game in a way that breaks the monotony such games often fall victim to and the graphics are as good as they need to be enjoy,True,0,0,0.5,0,False,False,False,Puzzle Quest: Challenge of the Warlords
12500,121739218,76561198387080771,fun rather mindless matching game  enjoyable wihtout stress,True,0,0,0.5,0,True,False,False,Puzzle Quest: Challenge of the Warlords
12500,121727308,76561197993500303,could have been the best in genre to this day but for one fatal flaw the ai cheats like crazy more often than not the ai will get 34 turns to your one,False,0,0,0.4761904776096343,0,True,False,False,Puzzle Quest: Challenge of the Warlords
12500,120700030,76561198080115923,i get lost in matching so,True,1,0,0.52173912525177,0,True,False,False,Puzzle Quest: Challenge of the Warlords
12500,120149485,76561197973727742,fun game is fun,True,0,0,0.5,0,True,False,False,Puzzle Quest: Challenge of the Warlords
12500,119455540,76561198804492636,i played this game over 10 year ago in my memory it was great game i bougt it yesterday and after playing couple hours im done gameplay is very repetitive and boring i dont feel like i have much of control even if i would like to change something its hard because what can i change choose 1 or 2 different spells change item there are no many options and in most of the battles i do not really care who i fight against it is the same,False,1,3,0.4767441749572753,0,True,False,False,Puzzle Quest: Challenge of the Warlords
12500,118936943,76561198045810995,best match3 rpg ive played,True,1,0,0.52173912525177,1,True,False,False,Puzzle Quest: Challenge of the Warlords
12500,116960547,76561198117955869,absolutely great game  love the strategy involved  also love the way you can customize the characters spells and weapons,True,0,0,0.5,0,True,False,False,Puzzle Quest: Challenge of the Warlords
12500,116755655,76561198374413028,i think the sheer number of hours i have played this game speaks for itself i absolutely adore it the story is great  written with an amazing sense of humour  and is created by an australian company gameplay is fun its like if dd had a baby with bejewelled would highly recommend if you need something to play that will help you wind down after a long day,True,0,0,0.5,0,True,False,False,Puzzle Quest: Challenge of the Warlords
12500,116472164,76561198030795610,15 years later still solid and addictive straight grinding without loot boxes paytowin etc fantastic time waster,True,0,0,0.5,0,True,False,False,Puzzle Quest: Challenge of the Warlords
12500,116106728,76561199082501785,best match 3 game i have ever played,True,0,0,0.5,1,True,False,False,Puzzle Quest: Challenge of the Warlords
12500,116041524,76561197962757921,this game is great harkens back to the days of real games,True,0,0,0.5,0,True,False,False,Puzzle Quest: Challenge of the Warlords
12500,114282475,76561198029521975,one of my favorite games of all time the original puzzle combat game is a must play,True,2,0,0.5288944244384765,0,True,False,False,Puzzle Quest: Challenge of the Warlords
12500,113455804,76561198028614589,great game,True,0,0,0.5,0,True,False,False,Puzzle Quest: Challenge of the Warlords
