appid,recommendationid,author_steamid,review,voted_up,votes_up,votes_funny,weighted_vote_score,comment_count,steam_purchase,received_for_free,written_during_early_access,game_title
294100,201552392,76561198165770433,good,True,0,0,0.5,0,True,False,False,RimWorld
294100,201551333,76561198134169624,this game confusing,True,0,0,0.5,0,True,False,False,RimWorld
294100,201551002,76561198147906577,gud,True,0,0,0.5,0,True,False,False,RimWorld
294100,201550711,76561198006928140,i love this game its just so easy to sink hours of my time into creating my perfect little colony of super soldiers,True,0,1,0.5,0,True,False,False,RimWorld
294100,201550511,76561198044198731,"many yayo much drugs no minor break very good stop randy why raid no raid make colony go yay   i harvest organs from every prisoner i capture and sell them to neighboring colonies while forcing my colonists to cannibalize the rotting body  1010 would play again",True,0,0,0.5,0,False,False,False,RimWorld
294100,201549366,76561198143241765,welcome to the rim where everything will go wrong at the wrong time and if you are smart and prepare you can over come all obstacles its a great story  generator that can get you quite attached to the pawns in your colony like skyrim there are plenty of mods out there for your preferred style of play or difficulty so don be afraid to mod the hell out of this game honestly a great 910 game i have a lot of fun watching others play just as much as i enjoy playing it,True,0,0,0.5,0,True,False,False,RimWorld
294100,201548822,76561198180497627,best game ever,True,0,0,0.5,0,False,False,False,RimWorld
294100,201548445,76561198084256073,man this game hasnt missed ive had the game since well before full release and i dont even have any of the dlc yet because there is so much you can do in this colony builder style game highly recommend,True,0,0,0.5,0,True,False,False,RimWorld
294100,201547954,76561199237382490,dont play rimworld if you want to be productive in the real world with your day i have lost many many days to the rim and will gladly do so again its the perfect host to any war crimes youd like to commit and at the same time you can raise a little family to take over the world best of both worlds,True,0,0,0.5,0,True,False,False,RimWorld
294100,201547243,76561198004477688,one of the best games ive played its frustrating but so fun i cant stop recommending it,True,0,0,0.5,0,True,False,False,RimWorld
294100,201546842,76561199097271509,this addiction is a problem,True,0,0,0.5,0,True,False,False,RimWorld
294100,201546760,76561197977411272,"do you like your free time dont buy this game its one of those ones that you think well i can just do this one last thing before bed and its suddenly 5am and the suns coming up and you feel guilty about every decision you ever made  and then you keep playing because your caravan has almost arrived at the pirate village you wanted to raid",True,0,0,0.5,0,True,False,False,RimWorld
294100,201545053,76561199050115402,i love the organ harvesting in this game,True,0,0,0.5,0,True,False,False,RimWorld
294100,201544537,76561198035763945,best colony sim game there is,True,0,0,0.5,0,True,False,False,RimWorld
294100,201544313,76561199471243611,yes good,True,0,0,0.5,0,True,False,False,RimWorld
294100,201543824,76561198022901412,love war crimes love an unforgiving world want sims but they dont do what you tell them to do ive got the game for you,True,0,0,0.5,0,True,False,False,RimWorld
294100,201542577,76561199513087768,god,True,0,0,0.5,0,True,False,False,RimWorld
294100,201542243,76561198042416435,commitment mode is the best way to play  we should subject or politicians to playing this game to see how well they can govern ,True,0,0,0.5,0,True,False,False,RimWorld
294100,201542094,76561199393343033,only purchase this game once you have completed whatever games you are currently playing as it will absorb you for a couple weeks,True,0,0,0.5,0,True,False,False,RimWorld
294100,201542088,76561199042211327,its phenomenal the stories ive seen play out before my eyes have been funny tragic heartwarming and terrifying ive laughed my ass off at some of the events that have played out and ive sat on the edge of my seat in suspense trying to keep myself calm as a raid destroyed the colony id spent weeks building 1010 cannot recommend enough,True,0,0,0.5,0,True,False,False,RimWorld
294100,201541454,76561198330238472,fun,True,0,0,0.5,0,True,False,False,RimWorld
294100,201541255,76561197967913278,one of the best games i have played over the years good developers who make new content every year great modding community,True,0,0,0.5,0,True,False,False,RimWorld
294100,201541228,76561198397538940,one of the best games ive ever played,True,0,0,0.5,0,True,False,False,RimWorld
294100,201536593,76561198141651551,the game is fun base and when you add the dlcs it just gets better i constantly find my self coming back to the game to play more and more and just getting absorbed into the game for hours,True,1,0,0.5,0,True,False,False,RimWorld
294100,201535215,76561198047583324,my biggest regret was how long i waited to get this game,True,1,0,0.5,0,True,False,False,RimWorld
294100,201534112,76561198007092997,one of a kind extremely expansible with mods easily hundreds of hours of content,True,1,0,0.5,0,True,False,False,RimWorld
294100,201531373,76561199338011231,"if you enjoy your life enjoy your free time and overall quite happy  do not play",True,0,0,0.5,0,True,False,False,RimWorld
294100,201530870,76561198144041702,fun,True,0,0,0.5,0,True,False,False,RimWorld
294100,201530612,76561198052572446,best colony sim there is one of the largest modding communities around and the dlcs range from decent to great only reviewing cause my play time hit a funny number,True,1,0,0.5,0,True,False,False,RimWorld
294100,201526837,76561199169463240,oh,True,0,0,0.5,0,True,False,False,RimWorld
294100,201526667,76561198136232438,steamhappy,True,0,0,0.5,0,False,False,False,RimWorld
294100,201524998,76561198221755472,didnt know about rimworld now i know   1010,True,0,0,0.5,0,True,False,False,RimWorld
294100,201517794,76561198304158643,good game good dlcs,True,0,0,0.5,0,False,False,False,RimWorld
294100,201515895,76561199225600843,never thought id be okay with the graphics but wow is the most amazing open world civ game ever or what i highly recommend ideology and biotech along with  the base game burt odyssey for beginners is very fun to learn as well the replay ability is infinite,True,0,0,0.5,0,True,False,False,RimWorld
294100,201513199,76561198990427841,fucking fun,True,0,0,0.5,0,True,False,False,RimWorld
294100,201508795,76561199101133787,its good,True,0,0,0.5,0,True,False,False,RimWorld
294100,201506503,76561198144197225,i have never played this vanillawithout mods i have not finished the end game any of them,True,0,0,0.5,0,True,False,False,RimWorld
294100,201504686,76561198336730404,one of the game you can play for 1h and finaly is day time already,True,0,0,0.5,0,True,False,False,RimWorld
294100,201504053,76561198261707029,probably the closest thing to a perfect game,True,0,0,0.5,0,True,False,False,RimWorld
294100,201503014,76561197994239971,just play it,True,0,0,0.5,0,True,False,False,RimWorld
294100,201501294,76561198162813946,2nd job type game,True,0,0,0.5,0,True,False,False,RimWorld
294100,201498900,76561197993002234,this game is pretty good,True,0,0,0.5,0,True,False,False,RimWorld
294100,201492824,76561198152663695,what a surprise i am late to the game but man it is so much fun havent even added the odyssey update and cant wait until i am ready for it highly entertaining and interesting game,True,0,0,0.5,0,True,False,False,RimWorld
294100,201487136,76561199523394264,  ,True,0,0,0.5,0,False,False,False,RimWorld
294100,201485331,76561198158992615,can i please stop having visitors gift me human leather furnishings and clothing,True,0,0,0.5,0,True,False,False,RimWorld
294100,201482729,76561198255782352,i hope randy random burns in hell,True,0,0,0.5,0,True,False,False,RimWorld
294100,201480547,76561198006097327,"where else can you do basically whatever you want in a wild west style space colony sim human leather chairs check vat grown child soldiers check taking slavers as prisoner removing all their limbs and taking their blood for vampires check sticking horrible lovecraftian anomalies full of porcupines to power a spaceship check  hell its so good that australia banned it for being too much fun",True,0,0,0.5,0,False,False,False,RimWorld
294100,201480075,76561198966401155,panthers mauled two of my pawns because i forced them to gather rice at night,True,0,0,0.5,0,True,False,False,RimWorld
294100,201480056,76561198857051896,really love the game great mods and dlc would recommend giving this game a shot,True,0,0,0.5,0,True,False,False,RimWorld
294100,201478850,76561199156333847,"all my colonies died up to now  two of my of my people got addicted to drugs thanks to my stupidity i tried having one go cold turkey and died  the other is high enough to be alivesame colonist wife hates him 1010",True,0,0,0.5,0,True,False,False,RimWorld
294100,201478763,76561198240885786,thumbs up emoji,True,0,0,0.5,0,True,False,False,RimWorld
294100,201477831,76561199295088038,it really was at the rim of this world,True,0,0,0.5,0,True,False,False,RimWorld
294100,201477321,76561198413699155,"have a small colony thats well off but not equiped with guns yet a raid starts and one of the has a shotgun downs all 3 of my people base in shambles blood every buildings on fire and destroyed man in black comes takes one good look around and immediatly goes into a mental break tries to shoot a boar but misses and hits the caravan behind it gets gunned down in less than 3 seconds god i love this game",True,1,0,0.5,0,True,False,False,RimWorld
294100,201474729,76561199192904428,its really good,True,0,0,0.5,0,True,False,False,RimWorld
294100,201473745,76561198287844151,"one of those games where thinking about it doesnt see fun nearly as fun as playing it the learning curb is steep but quick once you know a few things you can figure it out and ive been told the wiki is extensive also dont be scared for randy random its not that bad ",True,1,0,0.5,0,False,False,False,RimWorld
294100,201473657,76561199012302322,this is too good,True,0,0,0.5,0,True,False,False,RimWorld
294100,201473593,76561198062532559,where did all my money go,True,1,0,0.5,0,True,False,False,RimWorld
294100,201473562,76561198880353220,dude this game kicks ass it makes me want to merge without looking,True,0,1,0.5,0,True,False,False,RimWorld
294100,201472980,76561198124158575,"pros  fun  optional difficulty  build your own lore  a bright modding community  a flow of expansions that each have their own things to add to the game  cons  some things can feel a bit empty without mods  not greatly optimized  dlcs add up",True,0,0,0.5,0,True,False,False,RimWorld
294100,201470759,76561198073666886,im closing in on the 500 hour mark i dont consider myself to be a hardcore gamer but this game is definitely for hardcore gamers get past the famous learning curve and the best modding community ever awaits on the other side this is my favorite game of all time ive forked over my money to tynan and ludeon the second that every new dlc drops buy buy buy,True,0,0,0.5,0,True,False,False,RimWorld
294100,201469518,76561198047328975,"binged thru bout 8 colonies  after some careful reconsideration and thicker walls i got it now 1010",True,0,0,0.5,0,True,False,False,RimWorld
294100,201467956,76561198119685818,5 stars,True,0,0,0.5,0,True,False,False,RimWorld
294100,201466788,76561198007248557,meet chris hes a 200yearold chronomancer cyborg chris enjoys kidnapping people to steal their time for himself while simultaneously draining their blood to feed his daughter zee  a vampire  once his victims have served as a source of both time and blood they are harvested for their organs after that theyre tossed into the freezer ready to be deployed in the undead army when needed chris is also a necromancer  oh and one more thing we recycle our toxic waste into missiles,True,0,0,0.5,0,True,False,False,RimWorld
294100,201466415,76561198870105604,if only i could marry a videogame,True,0,0,0.5,0,True,False,False,RimWorld
294100,201464658,76561199812081291,it is hard to git use to but over all it is fun,True,0,0,0.5,0,True,False,False,RimWorld
294100,201463965,76561198383516963,hadnt played anything good in a long long long time this game is amazing to say the least modding community is great this game has too much to offer all the dlcs are worth every penny you cant say that about most games these days 1010,True,0,0,0.5,0,True,False,False,RimWorld
294100,201463652,76561198030941623,i cant recall the last time i had this much fun getting wiped out and then you can mod up to totally redo the genre and do it all over again,True,0,0,0.5,0,True,False,False,RimWorld
294100,201462115,76561198062639516,good,True,0,0,0.5,0,False,False,False,RimWorld
294100,201458584,76561199583469104,gun,True,0,0,0.5,0,True,False,False,RimWorld
294100,201452463,76561198042321033,super fun and a lot of things to create,True,0,0,0.5,0,True,False,False,RimWorld
294100,201450367,76561198354158006,a true masterclass in colony survival games i started rimming again in 16 and after taking a break for a year i have found myself playing well into the early hours of the morning its just absolute cinema,True,0,0,0.5,0,True,False,False,RimWorld
294100,201450116,76561198089149107,best game ever,True,0,0,0.5,0,True,False,False,RimWorld
294100,201448185,76561199847067545,very fun,True,0,0,0.5,0,True,False,False,RimWorld
294100,201446442,76561198376878544,good game,True,0,0,0.5,0,True,False,False,RimWorld
294100,201445100,76561198060152078,absolute cinema,True,0,0,0.5,0,True,False,False,RimWorld
294100,201442358,76561198202226607,ill be honest i may be 20 hours in but i have no clue what im doing  and i goddamn love it something about this game keeps dragging me back in and maybe its because i wonder what my pawns will do next or what events will unravel or exploring the generate world as best as i can regardless every time i play its like i could get stuck here for another 20 hours and still have no clue what im doing,True,0,0,0.5,0,True,False,False,RimWorld
294100,201440593,76561199812286383,vary goog,True,0,0,0.5,0,True,False,False,RimWorld
294100,201438456,76561198968452735,holy rim,True,0,0,0.5,0,False,False,False,RimWorld
294100,201433065,76561197983102689,ive played this game for years and it remains fun over and over again  one of my favorite games of all time  the expansions are all great too  the latest one as of aug 2025 is one of my favorites,True,0,0,0.5,0,True,False,False,RimWorld
294100,201431232,76561197993160737,great game worth the money,True,0,0,0.5,0,True,False,False,RimWorld
294100,201430974,76561198108623359,i played 50 hours in the first 6 days of owning this game addicting 1010,True,0,0,0.5,1,True,False,False,RimWorld
294100,201430254,76561198186063711,cool,True,0,0,0.5,0,True,False,False,RimWorld
294100,201428655,76561199042399462,yes,True,0,0,0.5,0,True,False,False,RimWorld
294100,201422766,76561198139199658,"pretty fun colony simulator like an ant farm but with moral dilemmas  violating the geneva convention10",True,0,0,0.5,0,True,False,False,RimWorld
294100,201422462,76561198054362982,yep,True,0,0,0.5,0,True,False,False,RimWorld
294100,201418324,76561198023001771,honestly one of the few games i keep coming back to year on year this new expansion adds significantly more gameplay while minimising one of the most annoying aspects of the game previously,True,0,0,0.5,0,True,False,False,RimWorld
294100,201418239,76561199163426343,i live in this game now i have no regrets,True,0,0,0.5,0,True,False,False,RimWorld
294100,201418081,76561198910727973,game is alright add more xenotypes  please,True,0,0,0.5,0,True,False,False,RimWorld
294100,201416334,76561199038497250,its pretty fun,True,0,0,0.5,0,True,False,False,RimWorld
294100,201416156,76561198041263106,i bought this game when you could only purchase it off of a small humble website that gave you a game key when it was finally available on steam this game is a masterpiece,True,0,0,0.5,0,False,False,False,RimWorld
294100,201414213,76561199487977636,fun,True,0,0,0.5,0,True,False,False,RimWorld
294100,201412863,76561198311627800,scratch so many itch i have in gaming,True,0,0,0.5,0,False,False,False,RimWorld
294100,201412168,76561198319547199,good,True,0,0,0.5,0,True,False,False,RimWorld
294100,201411329,76561198101033649,top notch game wish your colonies were not restricted to the grid map boundary would like to build and expand into other multiplayer territories maybe adding colonist offspring to continue future legacy,True,0,0,0.5,0,True,False,False,RimWorld
294100,201410688,76561199093050437,game has almost infinite replayability which only increases with the dlcs and the shit ton of mods worth  the price,True,0,0,0.5,0,True,False,False,RimWorld
294100,201410062,76561198042982046,"what can one say its an insanely fun game",True,0,0,0.5,0,True,False,False,RimWorld
294100,201409964,76561199364146200,i love it when 7 naked 53 year olds with broken spears attack my strike prison camp strike happy home and i can defend it with an army of heavily armed cyborgs with flamethrowers dd no but seriously the combat in this game is awesome,True,0,0,0.5,0,False,False,False,RimWorld
294100,201409179,76561198030816313,its mostly tranquil like raking a zen sand garden and occasionally heartbreakingly sad,True,0,0,0.5,0,True,False,False,RimWorld
294100,201408551,76561199385819951,who else up rimming they world rn,True,0,0,0.5,0,True,False,False,RimWorld
294100,201407039,76561198029259754,crack,True,0,0,0.5,0,False,False,False,RimWorld
294100,201405141,76561198083013035,the game is my greatest addiction sometimes i put it down for a bit but its the one game i always come back to plus what game lets me harvest an 8 year olds lung liver and heart to save a 69 year old man whose organs are decaying and has the power to raise the dead lol,True,0,0,0.5,0,True,False,False,RimWorld
294100,201404302,76561198404489058,ive played 20 hours in 5 days im not stopping,True,0,0,0.5,0,False,False,False,RimWorld
294100,201403802,76561198997787389,its like a whole new world,True,0,0,0.5,0,True,False,False,RimWorld
294100,201403702,76561199038041168,1010 i can feed people to chickens,True,0,0,0.5,0,True,False,False,RimWorld
294100,201403215,76561198035608657,never thought eating without a table would be considered a warcrime,True,0,0,0.5,0,True,False,False,RimWorld
294100,201402065,76561198135493943,worth every penny dead pawn and sleepless night ludeon does dlc right its always worth and the soundtrack is unbelievably immersive and hands down incredible,True,0,0,0.5,0,True,False,False,RimWorld
294100,201401458,76561198120453892,great storytelling and versatlity,True,0,0,0.5,0,True,False,False,RimWorld
294100,201398084,76561198028133854,i made 70000 by hopping from settlement to settlement in my shuttle and selling over 200 organs harvested from people who tried to kill me  1110 game,True,0,0,0.5,0,True,False,False,RimWorld
294100,201393642,76561198167465355,this game makes you a psycho in less 10h a of gameplay baby burgers and leather cowboy hat all the way,True,0,0,0.5,0,True,False,False,RimWorld
294100,201392335,76561198984514801,gzel baya,True,0,0,0.5,0,True,False,False,RimWorld
294100,201391029,76561199092934394,you might think that pawns are comically stupid but this game is an accurate representation of building a society using the median voter,True,0,0,0.5,1,True,False,False,RimWorld
294100,201387916,76561198271694613,good,True,0,0,0.5,0,True,False,False,RimWorld
294100,201386720,76561198048607217,amazing game with even better mods,True,0,0,0.5,0,True,False,False,RimWorld
294100,201386570,76561198008781968,best colony manager sim there is atm,True,0,0,0.5,0,False,False,False,RimWorld
294100,201385946,76561198956658507,a magnum opus of narrative sophistication wherein interwoven mechanics and emergent dramaturgy coalesce into a symphony of existential calculus moral ambiguity and systemic elegance total masterpiece,True,0,0,0.5,0,True,False,False,RimWorld
294100,201384813,76561199465544176,so that is where that month went,True,0,0,0.5,0,True,False,False,RimWorld
294100,201384682,76561197978737379,game gud,True,0,0,0.5,0,True,False,False,RimWorld
294100,201384428,76561198073837462,its a pretty good game never really did any of the main missions i just enjoy managing my colony   maybe after 2k hours,True,0,0,0.5,0,True,False,False,RimWorld
294100,201384175,76561198053134861,stranded on an island with a solar panel a battery and a pc  this is the last game youll need  ill still be settling the rim in my 80s im sure,True,0,0,0.5,0,True,False,False,RimWorld
294100,201383806,76561198193768146,mmmmme love cannabalism,True,0,0,0.5,0,False,False,False,RimWorld
294100,201381848,76561198410027905,1010 game,True,0,0,0.5,0,True,False,False,RimWorld
294100,201381721,76561198067101673,i have lost so much sleep to this game one more try,True,0,0,0.5,0,True,False,False,RimWorld
294100,201381192,76561199005746186,good game has decent graphics,True,0,0,0.5,0,False,False,False,RimWorld
294100,201381008,76561198028670330,i liked endzone better i thought but still cant stop playing ,True,0,0,0.5,0,True,False,False,RimWorld
294100,201380712,76561198034072049,great,True,0,0,0.5,0,True,False,False,RimWorld
294100,201379201,76561198119699730,i love harvesting chinchilla flesh,True,0,0,0.5,0,True,False,False,RimWorld
294100,201372415,76561199879831543,survival at its finest,True,0,0,0.5,0,True,False,False,RimWorld
294100,201371224,76561198042740909,amazing,True,0,0,0.5,0,True,False,False,RimWorld
294100,201371097,76561199472342242,man too much time to load with too much mod  i wish for new pc right now,True,0,0,0.5,0,True,False,False,RimWorld
294100,201370104,76561198047367672,good,True,0,0,0.5,0,True,False,False,RimWorld
294100,201368218,76561199649932813,a real god tier game,True,0,0,0.5,0,False,False,False,RimWorld
294100,201367736,76561197999564475,"its digital dollhouse for ocd control freaks except your pawns dont always listen to you i love it",True,0,0,0.5,0,True,False,False,RimWorld
294100,201367564,76561198404888049,great game w mods,True,0,0,0.5,0,True,False,False,RimWorld
294100,201364585,76561198017278356,ive played 200 hours of this game and bought all the dlcs and i dont think i have even begun to understand what it is other than great,True,0,0,0.5,0,True,False,False,RimWorld
294100,201363960,76561198180208670,this game is peak  it does what its trying to and it does it perfectly you could spend hours playing the base game  but the dlc content is insane,True,0,0,0.5,0,False,False,False,RimWorld
294100,201359201,76561199706667813,peak warcrime simulator,True,0,1,0.5,0,True,False,False,RimWorld
294100,201357502,76561199185252052,awesome but takes like 267434232 hours to do a simple thing because 10 billion other things occur every second that steals my attention or breaks something ,True,0,1,0.5,0,True,False,False,RimWorld
294100,201357282,76561198132103254,if you enjoy colony management endless reflavoring of play throughs via mods chaotic storytelling and so much more then this is your game i would recommend to play it through without mods get an idea of base game and then mod as you feel like you need to see something changedtweaked to fit your playstyle,True,0,0,0.5,0,False,False,False,RimWorld
294100,201356437,76561198021381794,i have first play it coming out civilization style games i admit the interface was bit odd for me at first but it took only 20 hours to overcome it by great game mechanics so really recommend it even if you have not played this kind of games in past,True,0,0,0.5,0,True,False,False,RimWorld
294100,201356031,76561198393726757,you will probably get addicted ive had a gambling addiction and this was worse,True,0,0,0.5,0,True,False,False,RimWorld
294100,201353191,76561199056685869,this game allows you to harvest all parts of the bodey for profit the children are my priority target,True,0,1,0.5,0,True,False,False,RimWorld
294100,201350955,76561198850638779,3,True,0,0,0.5,0,True,False,False,RimWorld
294100,201346988,76561198212734251,i like the part where i start a new colony and get distracted by decorating and then get reamed by a raid,True,0,0,0.5,0,True,False,False,RimWorld
294100,201344715,76561199405306249,i have always loved this,True,0,0,0.5,0,True,False,False,RimWorld
294100,201343564,76561198300697397,hobby ,True,0,0,0.5,0,True,False,False,RimWorld
294100,201343001,76561198209177815,"pros  tons of entertainment  cons  my life especially i lost my weekends",True,0,0,0.5,0,True,False,False,RimWorld
294100,201339532,76561198260523150,organ harvesting,True,0,0,0.5,0,True,False,False,RimWorld
294100,201338454,76561198100709246,good game,True,0,0,0.5,0,True,False,False,RimWorld
294100,201338374,76561199124438056,game  good,True,0,0,0.5,0,True,False,False,RimWorld
294100,201338363,76561198326550878,it took 200 hours but now i have recruited my first prisoner,True,0,0,0.5,0,True,False,False,RimWorld
294100,201337999,76561199798562869,"mamamammamamamamammama  this game slaps",True,0,0,0.5,0,False,False,False,RimWorld
294100,201336540,76561198448715286,its too easy to sink so much time in this game itoo easyi,True,0,0,0.5,0,True,False,False,RimWorld
294100,201336242,76561199216645704,i love turning raiders into nuggets by taking off their legs and arms then installing them with a joywire bliss lobotomy and physic harmonizer makes for the perfect colony mood booster i nicknamed them bnob,True,0,0,0.5,0,True,False,False,RimWorld
294100,201334397,76561199582415556,had a pigskin body my entire colony of 10 colonists 1010 would savescum again,True,0,0,0.5,0,True,False,False,RimWorld
