appid,recommendationid,author_steamid,review,voted_up,votes_up,votes_funny,weighted_vote_score,comment_count,steam_purchase,received_for_free,written_during_early_access,game_title
1244090,202046784,76561197995128549,great game loved it free dlc addition was the cherry on top,True,0,0,0.5,0,True,False,False,Sea of Stars
1244090,202002971,76561198011413767,game gud,True,0,0,0.5,0,True,False,False,Sea of Stars
1244090,201964939,76561199100010136,710,True,0,0,0.5,0,True,False,False,Sea of Stars
1244090,201947792,76561198060446259,this game is insanely good sabotage studio has yet to put out a bad game if you are on the fence about playing this just do it you wont regret it,True,0,0,0.5,0,True,False,False,Sea of Stars
1244090,201932279,76561198043630414,good tale so far enjoying the new battle system and the ability to play the game with my husband from across the room cuz thank you remote play,True,0,0,0.5,0,True,False,False,Sea of Stars
1244090,201889399,76561198010374498,its really good the beginning was a little slow and the story hasnt totally hooked me but the mole music is so amazing,True,0,0,0.5,0,True,False,False,Sea of Stars
1244090,201887010,76561198199560975,solid rpg fun puzzlesolving the combat mechanics are great the biggest issue is that there isnt more,True,0,0,0.5,0,True,False,False,Sea of Stars
1244090,201864628,76561198003578173,its great fun game art and sound track are fire  story is decent  gameplay is fun the mario rpg hit correctly for more damagebonus is engaging  difficulty is not overly hard you will only really lose when you cant figure out the locks on the attacks but once you do it stays revealed forever so its pretty simple next time around  puzzles are trivial  overall great game the free dlc was fun and playing with a friend was also cool,True,0,0,0.5,0,True,False,False,Sea of Stars
1244090,201852984,76561199813568673,one of the best rpgs i have played in a long time from the story to the engaging combat great from start to finish,True,0,0,0.5,0,True,False,False,Sea of Stars
1244090,201769454,76561198031586004,review,True,0,0,0.5,0,True,False,False,Sea of Stars
1244090,201668647,76561198324890085,amazing,True,0,0,0.5,0,False,False,False,Sea of Stars
1244090,201641041,76561198040683933,"play for garl best character ever created in the most beautiful story ever written  plus ninja pirate",True,0,0,0.5,0,False,False,False,Sea of Stars
1244090,201593522,76561199021727933,simplemente una joya del genero,True,0,0,0.5,0,True,False,False,Sea of Stars
1244090,201568632,76561198083289755,after finish game with true ending  and finish dlc 100  i like dlc it has so many reference ff6 suplex train ahh my good old day and seem like this game will have more story i guess after all this is a good game thank you for sabotage studio for making good game,True,0,0,0.5,0,True,False,False,Sea of Stars
1244090,201554861,76561198051135301,i bought this game during the summer sale and have been playing it a lot ever since its the pinnacle of classic jrpg gaming from the story art music and battles everything is topnotch,True,0,0,0.5,0,True,False,False,Sea of Stars
1244090,201539375,76561198023971157,a love letter to the classics with some pretty good easter eggs if you like vintage turnbase jrpgs this will be right up your alley,True,0,0,0.5,0,True,False,False,Sea of Stars
1244090,201533752,76561199123027825,this game ripped my heart out poured it into a blender set it to the ice function then fed that to the ocean to be washed away but like in a good way 1010 would recommend i also love the graphics sound design and combat mechanic because they make the game cozy and exciting,True,0,0,0.5,0,True,False,False,Sea of Stars
1244090,201532195,76561198231764136,decent game not worth the full price however  plot and lore is good but character writing is a bit bland graphics and music are lovely mechanics of the game will turn a bit repetitive after a while ending of the game felt abrupt for me which feels like a huge dissapointment for me after all the beautiful lore and story telling ive had the rest of the game,True,0,0,0.5,0,True,False,False,Sea of Stars
1244090,201531383,76561198047503789,woulda given the game a positive updoot but split screen coop doesnt cut it in this day and age imo since having other players alongside is heavily warranted in its base concept online multiplayer not being a thing is just disappointing,False,0,0,0.5,0,True,False,False,Sea of Stars
1244090,201513839,76561198119643413,gameplay visual and sound are nice,True,0,0,0.5,0,True,False,False,Sea of Stars
1244090,201495339,76561198215072157,one of the best retro 8bit look  games with turnbased combat,True,0,0,0.5,0,True,False,False,Sea of Stars
1244090,201403568,76561198025442015,i really enjoy how this game is both a tribute to some of the best of this genre of game as well as making its own way to a unique identity  i really like how it expands the lore for the setting and has a good enough story on its own to have kept me playing through to a great ending  cant wait to dig into the throes of the watchmaker,True,0,0,0.5,0,True,False,False,Sea of Stars
1244090,201375331,76561197968588385,if you are a fan of chrono trigger you owe it to yourself to play this game  it captures much of the same charm  the puzzles are interesting and challenging  the combat is fun and interactive  it is a gem of a game,True,1,0,0.5,0,True,False,False,Sea of Stars
1244090,201256932,76561198348991238,good,True,0,0,0.5,0,True,False,False,Sea of Stars
1244090,201245282,76561198862533997,best indie game of all time great mix of modern x jrpg highly recommend,True,0,0,0.5,0,True,False,False,Sea of Stars
1244090,201190459,76561198042218708,started to play because of the art finished the game so i could beat every wheels champion,True,0,0,0.5,0,True,False,False,Sea of Stars
1244090,201189241,76561198050006527,i really enjoyed this game it takes you on such a unexpected journey that just flabbergasted me while on this journey you get to visit so many varying locations meet wonderful characters solve fun puzzle and participate in some amazing combat this game had everything i love about rpgs and then some,True,0,0,0.5,0,True,False,False,Sea of Stars
1244090,201176968,76561197982281184,this is about as good as it gets for an snes style rpg,True,0,0,0.5,0,True,False,False,Sea of Stars
1244090,201117871,76561198042852330,this game is absolutely a gem and so worth your time if your a fan of the older jrpgs also the story while simple is fun and kept me hooked the whole time,True,1,0,0.5,0,True,False,False,Sea of Stars
1244090,201108634,76561198985548337,great game with great mechanics and great music chrono trigger is a favorite of mine and this game embodies so much of what i love about that game,True,0,0,0.5,0,True,False,False,Sea of Stars
1244090,201017029,76561197996477175,very nice and innovative approach to a classic looking rpg anything that gives me game boy vibes has my love,True,0,0,0.5,0,False,False,False,Sea of Stars
1244090,200963792,76561199805500223,"ignore the haters this game is absolutely flawless one of the greatest games i have ever played   100100",True,0,0,0.5,0,True,False,False,Sea of Stars
1244090,200959255,76561197981517774,great nostalgia hit and just fun,True,0,0,0.5,0,False,False,False,Sea of Stars
1244090,200902694,76561198438047390,great game great gameplay amazing story would play it again if my memory got erased,True,0,0,0.5,0,False,False,False,Sea of Stars
1244090,200854484,76561198005895110,love letter to my childhood of gaming i swear i heard some melodies from chrono triggercross in here,True,0,0,0.5,0,True,False,False,Sea of Stars
1244090,200818601,76561199178788640,really fun game overall though in order to get the true ending you need to put yourself through tedious crap of basically getting every achievement,True,0,0,0.5,0,True,False,False,Sea of Stars
1244090,200808052,76561199023532159,in my top 5 favorite games 100 just buy it,True,1,0,0.5,0,True,False,False,Sea of Stars
1244090,200720863,76561198003807246,i loved this game its a very accessible jrpg with a story that really hit me hard it was a good balance of being easy to jump in to while having some semicomplex mechanics that allow for fun combos and require conscious moves for party management im hoping for a sequel already,True,1,0,0.5,0,True,False,False,Sea of Stars
1244090,200649666,76561198154832594,amazing and beautiful turn based pixel art game definitely give it a try everyone the team did a great job and overall really a good designed game,True,0,0,0.5,0,True,False,False,Sea of Stars
1244090,200644335,76561198397041073,amazing,True,0,0,0.5,0,True,False,False,Sea of Stars
1244090,200498991,76561198056775057,amazing  910,True,0,0,0.5,0,True,False,False,Sea of Stars
1244090,200379323,76561198030851560,quite the experience,True,0,0,0.5,0,True,False,False,Sea of Stars
1244090,200354367,76561199006192105,serai best character,True,0,0,0.5,0,True,False,False,Sea of Stars
1244090,200260547,76561198044343206,simple honest looks amazing fun and engaging story with alot of niche secrets to be found which serve both as story background and often give you some benefit in the form of an item or a skill,True,0,0,0.5,0,True,False,False,Sea of Stars
1244090,200250741,76561198069567878,incredible game with an incredible story and combat mechanics,True,0,0,0.5,0,True,False,False,Sea of Stars
1244090,200203075,76561198225560392,this is a great game my wife and i have been playing this game and we have fallen in love with it it has the charm of a jrpg with some fun combat mechanics i am surprised that the story for this game has gotten some flack especially since it is a good story not every good story needs to be edgy the story of this game has lots of heart making laugh and cry with the characters  overall a great game if you are a rpg fan then this is a must play,True,0,0,0.5,0,True,False,False,Sea of Stars
1244090,200135429,76561198352537682,played main game and dlc and its def worth its money and overall an really cool turnbased rpg,True,1,0,0.5,0,False,False,False,Sea of Stars
1244090,200118676,76561198079725964,very cute and very well put together rpg the art is amazing throughout the whole game and the music is outstanding it can be grindy at parts and the combat can get a little repetitive but the story is worth sticking it out for in my opinion,True,0,0,0.5,0,True,False,False,Sea of Stars
1244090,200101931,76561198874196005,the story is so worth it loved it been glued to it,True,0,0,0.5,0,True,False,False,Sea of Stars
1244090,199984074,76561198382680060,fantastic story line amazing art style and such a fun combat style i truly rave about this game to my friends i have bought it on steam and switch i play it mostly on my switch as you can tell by my hours currently but it truly is such an amazing game   recently got a steam deck and cannot wait to start cracking in some more hours,True,1,0,0.5,0,True,False,False,Sea of Stars
1244090,199963052,76561198054541352,a really good game and a lot of fun i recomand strongly,True,0,0,0.5,0,True,False,False,Sea of Stars
1244090,199943223,76561198027290084,i would highly recommend this game to anyone who enjoys the retro jrpgs sea of stars has done a fantastic job of capturing the magic of older final fantasy games while still bringing a deep story and fresh mechanics,True,0,0,0.5,0,True,False,False,Sea of Stars
1244090,199886017,76561199107964152,sea of star is an outstanding indie rpg my second favorite game of all time,True,0,0,0.5,0,True,False,False,Sea of Stars
1244090,199875240,76561198136637668,the pixel art is gorgeous story is pretty good and it adds more fun to a typical turn based combat by making it all interactive personally love the puzzles as it makes me think of puzzles you might find in a zelda game,True,1,0,0.5,0,True,False,False,Sea of Stars
1244090,199762223,76561197994953983,very enjoyable lil jrpg light on strategy and the story isnt profound or anything but very satisfying timed hits and a fun sort of avatary story absolutely gorgeous art and animations the whole time through music kinda boring most of the time i think twice i felt the music was cool i would recommend it on sale itsa lot better than most of these homages to 90s rpgs,True,0,0,0.5,0,False,False,False,Sea of Stars
1244090,199754267,76561198131611689,quality game smooth game play wholesome and steady pacing offers flexibility for playstyledifficulty would recommend for those who enjoy rpgs or looking to get into jrpgs,True,0,0,0.5,0,True,False,False,Sea of Stars
1244090,199739761,76561198119187923,love this game art style  music are amazing and the combat gives me nostalgia to the mario  luigi games,True,0,0,0.5,0,True,False,False,Sea of Stars
1244090,199652486,76561198028976115,simply love this game go in blind if you would like a surprise if anyone picks this up recommend using a controller,True,0,0,0.5,0,True,False,False,Sea of Stars
1244090,199515962,76561198105106824,tons of fun,True,0,0,0.5,0,True,False,False,Sea of Stars
1244090,199514725,76561198019017896,classic rpg experience,True,0,0,0.5,0,True,False,False,Sea of Stars
1244090,199506326,76561198037879980,le jeu est meilleur en qubecois 3,True,0,0,0.5,0,True,False,False,Sea of Stars
1244090,199401863,76561198121857508,turnbased rpgs are not my thing and i 100d this lil guy,True,0,0,0.5,0,True,False,False,Sea of Stars
1244090,199281670,76561198038550598,another great game from sabotage the graphics are awesome the controls are great everything is great ,True,0,0,0.5,0,True,False,False,Sea of Stars
1244090,199273283,76561199811323881,this game is an excellent rpg  the music is great 3,True,0,0,0.5,0,True,False,False,Sea of Stars
1244090,199256815,76561199263832905,absolutely it is a masterpiece of a game,True,0,0,0.5,0,True,False,False,Sea of Stars
1244090,199174984,76561198013204609,fantastic jrpg the story starts off weak but later on becomes deep and interesting gameplay is strong the whole team,True,0,0,0.5,0,True,False,False,Sea of Stars
1244090,199164398,76561198123902673,this is genuinely my favourite game out of everything ive played over 30 years this is my 1,True,1,1,0.5,0,True,False,False,Sea of Stars
1244090,199160521,76561199525808955,1010 pibes,True,0,0,0.5,0,True,False,False,Sea of Stars
1244090,199062573,76561199079071092,a love letter to classic 16bit rpgs with gorgeous pixel art tight turnbased combat and a soundtrack that hits all the right nostalgic beatsfeels like chrono trigger and secretly cares about your heart the whole time,True,0,0,0.5,0,True,False,False,Sea of Stars
1244090,199051014,76561198355841744,awesome game,True,0,0,0.5,0,False,False,False,Sea of Stars
1244090,198983464,76561198075242423,the story is phenomenal while the game can get grindy it more than makes up for it with its artwork,True,0,0,0.5,0,True,False,False,Sea of Stars
1244090,198960049,76561197998343406,i love just about everything about this game  beautiful art exploration puzzles strategic combat mechanics  collectibles engaging story lovable characters tons of achievements multiple endings  its just perfect,True,0,0,0.5,0,True,False,False,Sea of Stars
1244090,198863351,76561199592297911,yeah the plot is a bit predictable and the two main characters are more shallow than they should be but overall this is still a very good game,True,0,0,0.5,0,True,False,False,Sea of Stars
1244090,198621258,76561198084446225,1,True,0,0,0.5,0,True,False,False,Sea of Stars
1244090,198511611,76561198021706283,just an absolute delight if you like turnbased rpgs a la oldschool style the story is simple but endearing the dialogue witty but nothing flashy the art style and music toptier set for a good time if you just want something close to what we once had,True,0,0,0.5,0,True,False,False,Sea of Stars
1244090,198504184,76561198344776283,this game is just absolute peak rpg the flow of the story feels normal the pixel art is just stunning and the gameplay is so much fun i beat it on gamepass and im replaying it on steam once you pick it up you refuse to put it down until you beat the game even then theres still a lot of do after beating it if you love rpgs play this immediately,True,0,0,0.5,0,True,False,False,Sea of Stars
1244090,198469947,76561198072414425,diversify,True,0,0,0.5,0,False,False,False,Sea of Stars
1244090,198434182,76561198309257876,cant miss it,True,0,0,0.5,0,True,False,False,Sea of Stars
1244090,198422659,76561198115773815,very chill and fun rpg not too complicated but also rather complex in terms of story and strategy,True,0,0,0.5,0,True,False,False,Sea of Stars
1244090,198394049,76561197963846012,superb game heavily influenced by chono trigger and ff,True,0,0,0.5,0,True,False,False,Sea of Stars
1244090,198273140,76561198054322897,good game,True,0,0,0.5,0,True,False,False,Sea of Stars
1244090,198228325,76561199850235044,its fun and love the music,True,0,0,0.5,0,True,False,False,Sea of Stars
1244090,198227136,76561198929862925,very good game the pixel art is beautiful i love the locks mechanic that allows you to stop an attack before it happens really fun when you see the amount of locks and immediately think it is impossible only to figure out a really cool way to barely break them all,True,0,0,0.5,0,True,False,False,Sea of Stars
1244090,198207375,76561198009383997,great visuals great gameplay and tons of charm fantastic game,True,0,0,0.5,0,True,False,False,Sea of Stars
1244090,198205028,76561198073420665,story gameplay music is great  a true ode to chrono trigger,True,0,0,0.5,0,True,False,False,Sea of Stars
1244090,198162785,76561198970193928,"base game is beyond worth it beautifully nostalgic has some crazy difficulty spikes but nothing that cant be overcome achieving the true ending unlocks arguably my favorite easter egg ever  throes of the watchmaker is insanely difficult absolutely wild how much harder the dlc is at times turn the easy mode relics on and still possibly fail hard",True,0,0,0.5,0,True,False,False,Sea of Stars
1244090,198042197,76561198004601367,deserves more recognition,True,0,0,0.5,0,True,False,False,Sea of Stars
1244090,197936304,76561199117821973,sea of stars has been an incredible experience the story is thoughtfully crafted and deeply immersive the visuals are stunning and the gameplay feels smooth and satisfying i honestly dont have a single complaint about it still need to dive into the dlc and hunt down all the achievements highly recommended for anyone who loves indie games and rich storydriven character development,True,0,0,0.5,0,True,False,False,Sea of Stars
1244090,197862363,76561199031926025,nice indie game  the battle system the story definitely the developer can do more with the story or maybe start a sequel about it and i like to play it simply recommended for you who want to play turn base rpg,True,0,0,0.5,0,True,False,False,Sea of Stars
1244090,197831167,76561198022513527,i never played or watched much of the games that people say this game is inspired by even without that nostalgia in my bones i feel this game stands on its own with its own identity i didnt feel like i needed context for things besides common tropes the game pokes fun at the gameplay is really solid and engaging with amazing art to boot i cant wait to play the free expansion that came out after i get through some of my backlog,True,0,0,0.5,0,False,False,False,Sea of Stars
1244090,197824310,76561198204205115,me encanta este juego es algo que claramente recomendara personalmente ha sido una agradable experiencia a diferencia de otros ttulos rpg por turnos que he jugado,True,0,0,0.5,0,True,False,False,Sea of Stars
1244090,197765771,76561197970423610,"played this game when it came out on switch  you can see and appreciate the level of detail care and thought that went into crafting this ode to classic rpgs like chrono trigger its a hell of a game that just falls a bit short imo in the story department intead of a 9 its an 8 dont let that dissuade you of trying and enjoying this badass game i just wish some of the writing of the messenger was here",True,0,0,0.5,0,True,False,False,Sea of Stars
1244090,197589018,76561199149700084,its increible i had i long time without playing a game that you need to actually think but dont get me wrong the game adjust to any type of play style that like or you choose it can be very challenging  as a like or very story driven it has the same mechanics as expedition 33 but is just a really good game,True,0,0,0.5,0,False,False,False,Sea of Stars
1244090,197584259,76561198446072998,this was definitely a top tier game well worth the price plus the dlc was free and to do everything took me about 10 hours so it was money well spent,True,0,0,0.5,0,True,False,False,Sea of Stars
1244090,197519508,76561199467755989,i have really enjoyed this game  the mechanics are fun and the story is good  i just played the dlc and i enjoyed it  only issue i have had is that my save files got corrupted  i was able to find a work around on reddit and got my save files back,True,0,0,0.5,0,True,False,False,Sea of Stars
1244090,197507786,76561198013108609,so good its the first game ive 100 in a long time,True,0,0,0.5,0,True,False,False,Sea of Stars
1244090,197434851,76561199208981619,completed the true ending and im chasing down the last few achievements about to play the dlc this is the best game ive played maybe ever certainly worth giving it a shot,True,0,0,0.5,0,True,False,False,Sea of Stars
1244090,197373350,76561198111956533,great game the story is amusing,True,0,0,0.5,0,True,False,False,Sea of Stars
1244090,197326934,76561199141657805,a,True,0,0,0.5,0,True,False,False,Sea of Stars
1244090,197308224,76561199574286050,just like chrono trigger  secret of mana but still almost better in every which way you will love it,True,0,0,0.5,0,True,False,False,Sea of Stars
1244090,197289973,76561198128872672,words cannot explain how peak this game is getting 100 achievements  playing the dlc made me hit the its cinema pose so many times my elbows hurt i wish i had the men in black memory removal thingie to replay the messenger and this game every year,True,0,0,0.5,0,True,False,False,Sea of Stars
1244090,197193093,76561198027870841,the developers passion shines through in every beautifully crafted cut scene and art style the difficulty scales nicely as you progress letting you finetune the challenge to match your comfort level instead of drowning you in complex stat systems the gear and attribute design stays refreshingly straightforward the real standout is the combat system which puts a clever spin on traditional turnbased rpg mechanics,True,0,0,0.5,0,False,False,False,Sea of Stars
