appid,recommendationid,author_steamid,review,voted_up,votes_up,votes_funny,weighted_vote_score,comment_count,steam_purchase,received_for_free,written_during_early_access,game_title
380150,162443425,76561198014748037,isometric scifi horror point and click adventure whats not to love,True,1,0,0.5275590419769287,0,True,False,False,Stasis
380150,161056493,76561198058500949,doesnt even start,False,0,0,0.5,0,False,False,False,Stasis
380150,160424163,76561198118226673,this is probably the most horrific horror game ive gotten my hands on and its a point and click adventure that said it does at times run into the point and click issue where you can think of multiple completely valid ways to use your items but the game is only programmed to do one solution which might not make any sense id recommend tabbing over to a walkthrough if you get stuck on something for 10m,True,3,0,0.55078125,0,True,False,False,Stasis
380150,160294683,76561197970339482,janky oldschool point  click horror adventure with great sound design music and overall atmosphere recommended  my only nitpick is that the sound mixing is sometimes not great,True,0,0,0.5,0,True,False,False,Stasis
380150,160173874,76561198071569162,its not perfect theres a few odd looking animations and the environment can be a bit confusing sometimes but overall pretty fun i loved the surgery section never before it takes a lot to make me squeamish but that surgery scene got me i wish we got chased or had to avoid the monster at some point the amount of times you see the monster could be counted on 1 hand and it never poses an active threat to you overall if you wanted a point and click dead space here you go,True,0,0,0.5,0,True,False,False,Stasis
380150,159178061,76561199471725896,i very much liked the focus on storytelling the puzzles are fair the inventory never becomes overwhelming overall a good scifi story and a very good point and click the only negative is unskippable dialogue which can get annoying if you didnt get things right the first time but it is still an easy recommend,True,0,0,0.5,0,True,False,False,Stasis
380150,158617040,76561197995129622,sometimes you dont really need enemies to create a great experience atmosphere will do and this game symbolizes that  i found the puzzles sometimes farfetched and illogical but generally ok good experience,True,0,0,0.5,0,False,False,False,Stasis
380150,158037076,76561197981615354,defnitely scratches the adventure game itch you can definitely tell this was developed by genre veterans,True,1,0,0.5034482479095458,0,True,False,False,Stasis
380150,157890242,76561198018825753,was expecting an alien got horrors beyond humand imagination instead,True,0,0,0.5,0,False,False,False,Stasis
380150,157758238,76561199500424871,difficult game but incredible story,True,2,0,0.4982094764709472,0,False,False,False,Stasis
380150,157527071,76561198816602012,pretty good game cool story and environments sometimes i was faced to trouble to find the things i need and its annoying but in the end i am glad that played this game,True,0,0,0.5,0,True,False,False,Stasis
380150,156928522,76561198059531009,the game is janky but good there are a significant number of technical problems and voice acting outside of the player character is just ok at best but if youre willing to look past that its an engaging experience thats clearly had a lot of heart put into it,True,0,0,0.5,0,True,False,False,Stasis
380150,156392568,76561198003991573,the story is not fun  its smothered with pure dread like a crossover between event horizon and anything written by clive barker  if it wasnt for the incredible attention to detail that one person put into each biome and background logs it would be hard to recommend,True,0,0,0.5,0,True,False,False,Stasis
380150,156196230,76561198059521178,absolutely amazing game it is very hard to talk about it without spoilering stuff just delve into it blind and never read anything about it just like how i did it,True,0,0,0.5,0,True,False,False,Stasis
380150,156009357,76561198179962105,first and fore most i suck at point and clicks that being said i still really enjoyed my time with this its grim gory and well written the gameplay is as classic as it gets and some super obscurely placed items aside this is not a bad game just be sure to read all of the ingame lore to really get the most out of the ending,True,0,0,0.5,0,True,False,False,Stasis
380150,155978457,76561197970553595,such an underrated gem delivers a michelin star space horror experience,True,0,0,0.5,0,False,False,False,Stasis
380150,155917359,76561197983944909,ran into the occasional now what do i do inherent to all point and click adventures and the ui is a little bit dated  minor complaints for an otherwise great game  finished in about 7 hours   on to bone totem,True,0,0,0.5,0,True,False,False,Stasis
380150,155770564,76561197995107796,i have only played like two hours but i like this game it got visuals builds up tension and pretty medium difficult puzzles i am stupid but i really like this   the atmosphear is great so if you are into stuff like dead space system shock survival horror sci fi in general and like a click and point horror game  this one is recommended    so i just finished the game and i really recommend this one for anyone who are into scifi horror  this was a good game,True,0,0,0.5,0,True,False,False,Stasis
380150,155427053,76561197964643848,despite the irritating puzzles one of the games with the best writing ive ever played,True,0,0,0.5,0,True,False,False,Stasis
380150,155350693,76561198016471699,yes good,True,0,0,0.5,0,True,False,False,Stasis
380150,155326399,76561198007827147,an atmospheric unnerving oldschool scifi point and click adventure great writing and excellent isometric art ,True,0,0,0.5,0,False,False,False,Stasis
