appid,recommendationid,author_steamid,review,voted_up,votes_up,votes_funny,weighted_vote_score,comment_count,steam_purchase,received_for_free,written_during_early_access,game_title
40930,3581638,76561198024988677,delightfully stylish game never has one man used time travel just to eat pie,True,0,0,0.5,0,True,False,False,The Misadventures of P.B. Winterbottom
40930,429566,76561197970561377,he really likes piesi mean a lot nuff said,True,0,0,0.4914004802703857,0,True,False,False,The Misadventures of P.B. Winterbottom
40930,1624245,76561197995528519,really fun puzzle game my brain just doesnt work right to solve some of the levels so i didnt come close to beating it but i enjoyed the time i put into it and the oldtimey silent movie inspired soundtrack is great,True,0,0,0.5,0,True,False,False,The Misadventures of P.B. Winterbottom
40930,2004208,76561198000829761,while it is short and simple pb winterbottom presents clever humor and a fantastic soundtrack that will echo in your head for weeks after you completed the game,True,0,0,0.5,0,True,False,False,The Misadventures of P.B. Winterbottom
40930,4347906,76561198035813756,like puzzle games like awesome soundtracks like a good price well this game is 33   my score 810,True,0,0,0.4492905735969543,0,False,False,False,The Misadventures of P.B. Winterbottom
