appid,recommendationid,author_steamid,review,voted_up,votes_up,votes_funny,weighted_vote_score,comment_count,steam_purchase,received_for_free,written_during_early_access,game_title
764790,195175151,76561198234044716,quick review 3   metric  1 garbage  2 did not fulfill the purpose 3  ok fulfilled the purpose 4  a good game 5  just play and be happy ,True,0,0,0.5,0,True,False,False,The Messenger
764790,195138533,76561198401688949,amazing metroidvania game funny dialogues solid controls enjoyable difficulty together with cuphead and balatro some of the best purchases i have ever made on steam,True,0,0,0.5,0,True,False,False,The Messenger
764790,195094770,76561197978081939,"worth the buy  it goes from ninja gaiden mega man to castlevania sotn great platforming and fun",True,0,0,0.5,0,True,False,False,The Messenger
764790,194958068,76561198139577485,cool game with nice mechanics and funny jokes,True,0,0,0.5,0,True,False,False,The Messenger
764790,194919906,76561198035604553,810 very good but spoiler halfway through the game it becomes a really shitty metroidvania that i just couldnt bear to get through spoiler  good game besides that and instakill pits though,True,0,0,0.5,0,True,False,False,The Messenger
764790,194904663,76561198203906904,enjoyable platformer with a bunch of fun movement mechanics and a good story the run speed is a little slow,True,0,0,0.5,0,True,False,False,The Messenger
764790,194861500,76561198374122160,i remember playing this on my playstation back in the day just might be my favorite game of all time,True,0,0,0.5,0,True,False,False,The Messenger
764790,194671761,76561199497027536,great classic throwback platformer,True,0,0,0.5,0,True,False,False,The Messenger
764790,194636830,76561198080762078,this is another of those games that ive spent a lot of time with on another platform namely my ps5 where i platinumed it this is a super nice platformer and metroidvania if thats your jam try this out for sure the writing music and game mechanics are all super well crafted excellent game,True,0,0,0.5,0,True,False,False,The Messenger
764790,194557227,76561198836497835,one of the best games ive played  surprisingly what stood out most was how simple it was how easy it felt and the charming conversations with the shopkeepers,True,0,0,0.5,0,True,False,False,The Messenger
764790,194506380,76561198042074993,an amazing little game that is challenging and rewarding with good wit in the writing loved all the back and forth between pixel styles,True,0,0,0.5,0,True,False,False,The Messenger
764790,194504988,76561199802549338,"90100  nearly perfect 2d side scroller not to difficult the perfect amount of annoying  that free dlc was alright i cant complain too much since its free but i do feel like it soured the experience and i will probably never play that again base game is perfect as is",True,0,0,0.5,0,True,False,False,The Messenger
764790,194478629,76561198262296073,this is like my favorite ninja gaiden game ever seriously every moment in this game hits and the soundtrack is absolutely great highly recommend it was such a fun ride through and through,True,0,0,0.5,0,True,False,False,The Messenger
764790,194327575,76561199534768589,i think the writing is a lot of fun i fully laughed at the end of act one the reveal was so hilarious i do wish that there were more gateways in act 2 though it doesnt matter much in normal gameplay but it can be a bit of a pain if youre trying to get all the collectibles,True,0,0,0.5,0,True,False,False,The Messenger
764790,194253952,76561199137468844,nes ninja gaiden that doesnt make me throw my controller across the room,True,0,0,0.5,0,True,False,False,The Messenger
764790,194231388,76561198063881157,fun game,True,0,0,0.5,0,True,False,False,The Messenger
764790,194231264,76561197995750521,easily the best 2d action platformer i have ever played  amazingly well written and with the tightest feeling move set i have come across within the medium  an inspiration to myself and the games i hope to one day create and with one of the most kick ass soundtracks i have come across,True,0,0,0.5,0,True,False,False,The Messenger
764790,194195755,76561198128362209,really fun platformer with a neat pastfuture concept not much replayability but with the content given i feel like ive gotten my moneys worth,True,0,0,0.5,0,True,False,False,The Messenger
764790,193845283,76561199592994048,i love a good twists,True,0,0,0.5,0,True,False,False,The Messenger
764790,193843981,76561198865036027,this game exceeded my expectations the music is s tier the story is hilarious and the gameplay is satisfying its hard but fair i love this game so much,True,0,0,0.5,0,True,False,False,The Messenger
764790,193667154,76561198027227005,one of the few retrostyled games thats not ruined by insane difficulty until quite late in the game its really fun until this happens and if you can get it on sale its definitely worthwhile,True,0,0,0.5,0,False,False,False,The Messenger
764790,193666683,76561198016573541,very cool platformer this of course has its moments of super precision platforming that can get frustrating but overall the game is very enjoyable and i deeply recommend to platformer fans,True,0,0,0.5,0,True,False,False,The Messenger
764790,193564734,76561198168652332,pleasant platformer simple but versatile mechanics,True,0,0,0.5,0,False,False,False,The Messenger
764790,193545178,76561198310064671,1010 game with great gameplay design soundtrack and some of the best clever writing would recommend,True,0,0,0.5,0,True,False,False,The Messenger
764790,193341902,76561198136217981,,True,0,0,0.5,0,True,False,False,The Messenger
764790,193329036,76561198012429926,710  great gfx style cool music liked the story and the funny interactions bosses are fun  control scheme could be improved  grapple while gliding  gliding seperate from jump  to much backtracking shop portal should be usable to teleport to instead of the 6 portals,True,0,0,0.5,0,True,False,False,The Messenger
764790,193159269,76561198224752976,retro ninja gaiden with a skill tree and a sense of humor  excellent,True,0,0,0.5,0,True,False,False,The Messenger
