appid,recommendationid,author_steamid,review,voted_up,votes_up,votes_funny,weighted_vote_score,comment_count,steam_purchase,received_for_free,written_during_early_access,game_title
250320,201548601,76561198158320980,1010  already love will update later,True,0,0,0.5,0,True,False,False,The Wolf Among Us
250320,201545274,76561199563457613,"another great telltale game  cant wait for the wolf among us 2",True,0,0,0.5,0,True,False,False,The Wolf Among Us
250320,201526344,76561199000231323,the game still holds up compelling and fun the character design is beautiful and you will find yourself fully immersed in the story,True,0,0,0.5,0,True,False,False,The Wolf Among Us
250320,201525773,76561198021724136,the whole point of this game is just figuring out what fairy tale characters prefer money and which ones need cigarettes,True,0,0,0.5,0,True,False,False,The Wolf Among Us
250320,201466906,76561199133972764,the wolf among us is the best telltale game ever this is the second time ive played it i really hope the second game will come out soon 3,True,0,0,0.5,0,False,False,False,The Wolf Among Us
250320,201338951,76561198000005306,its a very interesting game it makes you think,True,0,0,0.5,0,True,False,False,The Wolf Among Us
250320,201311355,76561198352328055,telltale games never disappoints enjoyed every minute of this game would highly recommend,True,0,0,0.5,0,False,False,False,The Wolf Among Us
250320,201284200,76561198949174748,jgkugu,True,0,0,0.5,0,True,False,False,The Wolf Among Us
250320,201270958,76561198025950438,yes,True,0,0,0.5,0,True,False,False,The Wolf Among Us
250320,201244871,76561199004764247,good story,True,0,0,0.5,0,True,False,False,The Wolf Among Us
250320,201207677,76561199581182267,the wolf among is a well fleshed out creative game with complex and deep characters its vibrant world murder mystery is a very well made adaptation to the comics that definitely live up to the hype i recommend this in my opinion a telltale masterpiece,True,0,0,0.5,0,True,False,False,The Wolf Among Us
250320,201202683,76561199524859290,very fun game that takes up time such a great artstyle we love bigsby wolf in this household he is based awesome game if you like choice based story games,True,0,0,0.5,0,True,False,False,The Wolf Among Us
250320,201199276,76561198172923445,incredible story unforgettable characters and the best opening soundtrack ive ever heard in a game gave me chills every time  totally nailed the mood   if youre into dark stories and detective vibes this ones a gem  i wish i could experience it all again for the first time telltale please dont leave us hanging with season 2,True,0,0,0.5,0,True,False,False,The Wolf Among Us
250320,201194154,76561199181947482,honestly i thought this would be an alright telltale game but was shocked by that is as good as twd season 1 cant wait for the sequel to release,True,0,0,0.5,0,False,False,False,The Wolf Among Us
250320,201186636,76561198033529380,great game maybe even better than telltales the walking dead choices feel impactful charachters are well written and the story keeps you on your toes absolutely worth playing through,True,0,0,0.5,0,True,False,False,The Wolf Among Us
250320,201155348,76561198834945834,wonderful amazing breathtaking straight up doinkuwoinking while playing this game amazing give me 500 more sequels of this game,True,0,0,0.5,0,True,False,False,The Wolf Among Us
250320,201135182,76561198085267025,incredible world writing and characters out of the many telltale games ive played the wolf among us is the greatest with the walking dead as a close second 1010,True,0,0,0.5,0,True,False,False,The Wolf Among Us
250320,201123281,76561199005371654,wolf,True,0,0,0.5,0,True,False,False,The Wolf Among Us
250320,201122715,76561198859619918,amazing game love playing as detective bigby and the whole story in this game absolutely would recommend,True,0,0,0.5,0,True,False,False,The Wolf Among Us
250320,201032168,76561198351649079,1010,True,0,0,0.5,0,False,False,False,The Wolf Among Us
250320,200993679,76561198194618867,masterpiece,True,0,0,0.5,0,True,False,False,The Wolf Among Us
250320,200911806,76561199859041829,"the broken promises is an experience that breaks your heart why well the only bad review i can give is that when you sell someone a good drug and promise to bring the next insteallment you fing deliver going into the 5th year since number 2 was promised and we still having no number 2s",True,0,0,0.5,0,True,False,False,The Wolf Among Us
250320,200907426,76561199176377419,good story with hot muscles man but a temper that flares at the slightest spark,True,0,0,0.5,0,True,False,False,The Wolf Among Us
250320,200898594,76561198861009733,best telltale game,True,0,0,0.5,0,True,False,False,The Wolf Among Us
250320,200831982,76561199634774006,i wanna eat this game,True,0,0,0.5,0,True,False,False,The Wolf Among Us
250320,200761120,76561199059328592,the wolf among us is a great game for someone who loves fantasy and noir much shorter chapters and story that i was hoping for but a good game to sit down for an hour or so and finish a chapter at a time always a fan of telltale games its a shame they had to close up shop,True,0,0,0.5,0,True,False,False,The Wolf Among Us
250320,200739487,76561198271788498,great game,True,0,0,0.5,0,True,False,False,The Wolf Among Us
250320,200684233,76561198044936917,this game was lit ,True,0,0,0.5,0,False,False,False,The Wolf Among Us
250320,200654368,76561198119188707,insanely good,True,0,0,0.5,0,True,False,False,The Wolf Among Us
250320,200640048,76561198945628850,a very fun prequel to the dc comics series fables the gameplay of course is standard for a telltale game especially after twds1 but the story of bigby and fabletown is one hell of an enjoyable one wish i could say the same for the original comic hopefully season 2 gets made would love to see how the story of bigby continues without having to read some conservative political mouth piece nonsense of a comic,True,0,0,0.5,0,True,False,False,The Wolf Among Us
250320,200627040,76561199042209098,very fun ,True,0,0,0.5,0,True,False,False,The Wolf Among Us
250320,200621060,76561198963872262,has one of the most interesting concepts out of any game ive played pair that with an intriguing story and a pleasing art style and it shapes up to be a great narrative based game,True,0,0,0.5,0,False,False,False,The Wolf Among Us
250320,200497521,76561198005414303,great story,True,0,0,0.5,0,False,False,False,The Wolf Among Us
250320,200478896,76561199043529936,criminally underrated game,True,0,0,0.5,0,True,False,False,The Wolf Among Us
250320,200469941,76561199219519411,the wolf among us  rating  9210  the wolf among us is a fantastic telltale game with a gripping narrative that reimagines classic fairy tale characters in a gritty modern day setting the story pulls you in with its noir style mystery and moral complexity choices matter and often leave you thinking long after the scene ends the atmosphere voice acting and visual style all work together perfectly if youre into story driven games this ones a must play,True,0,0,0.5,0,True,False,False,The Wolf Among Us
250320,200468997,76561199030712080,we still talk about you twau 2,True,0,0,0.5,0,True,False,False,The Wolf Among Us
250320,200427549,76561199379825437,dzaddyy bigby grrr,True,0,0,0.5,0,True,False,False,The Wolf Among Us
250320,200367490,76561198356830619,meore nawili odesme gamovaaa,True,0,0,0.5,0,True,False,False,The Wolf Among Us
250320,200353790,76561199877043235,love these tell telltale games they all have a good story to them,True,0,0,0.5,0,True,False,False,The Wolf Among Us
250320,200335758,76561199855156027,this game is really fun and it makes you question if your a good person or a bad person,True,0,0,0.5,0,True,False,False,The Wolf Among Us
250320,200335133,76561198038383548,10  something years later this game still looks great 10 years after it still will its just so stylish and beautiful and its still fun to play but there was so much more to do some characters are severely underutilized and wouldve make a really nice addition to the story and character development it shouldve been longer much longer which is i think a really good compliment to a game  when you dont want it to end,True,0,0,0.5,0,True,False,False,The Wolf Among Us
250320,200284692,76561198838467766,after years of replaying this masterpiece id must say this is the best og telltale games ever made from pace to story everyhing is perfect and yes there is gimmick and some plot holes whatnot  telltale i beg you to release twau 2 already i would love to see continuation of bigby and snow love story until they fall for each other and bring colin too would be shame if his head got beheaded,True,0,0,0.5,0,False,False,False,The Wolf Among Us
250320,200284392,76561198150930164,jont very schweet,True,0,0,0.5,0,False,False,False,The Wolf Among Us
250320,200280752,76561198255721619,decent game i think its ight 657 outta 10,True,0,0,0.5,0,False,False,False,The Wolf Among Us
250320,200263802,76561198916963219,bigby wolf is so hot,True,0,0,0.5,0,True,False,False,The Wolf Among Us
250320,200229321,76561199229515678,,True,0,0,0.5,0,False,False,False,The Wolf Among Us
250320,200211260,76561199086620671,top 3 telltale game for sure but it can be frustrating if youre not familiar with the comics,True,0,0,0.5,0,True,False,False,The Wolf Among Us
250320,200202103,76561198054258703,most of the intrigue is at the beginning which is when i was thinking this is one of the better telltale games its still really good but it quickly begins to lose momentum when the mystery starts to unravel its such a shame that the state of the sequel is still up in the air this is one of few telltale games that deserves a sequel that improves on the original,True,0,0,0.5,0,False,False,False,The Wolf Among Us
250320,200194687,76561198221288332,goated,True,0,0,0.5,0,True,False,False,The Wolf Among Us
250320,200179924,76561199127633894,yes,True,0,0,0.5,0,False,False,False,The Wolf Among Us
250320,200176671,76561199108153942,one of the few story games i had the desire to replay before finishing,True,0,0,0.5,0,True,False,False,The Wolf Among Us
250320,200168396,76561198133635953,make the damn sequel,True,0,0,0.5,0,True,False,False,The Wolf Among Us
250320,200161767,76561198248626302,greatest game oat,True,0,0,0.5,0,True,False,False,The Wolf Among Us
250320,200152962,76561198989776979,masterpiece 10101010,True,0,0,0.5,0,True,False,False,The Wolf Among Us
250320,200141436,76561199083147570,this best of story game  we want part 2 now ,True,0,0,0.5,0,True,False,False,The Wolf Among Us
250320,200122972,76561198993150230,this game is amazing and i cant believe that fatalis helped create black market glamours,True,0,0,0.5,0,True,False,False,The Wolf Among Us
250320,200111279,76561198143573491,a very wellwritten story game where choices actually do matter  even in 2025,True,0,0,0.5,0,False,False,False,The Wolf Among Us
250320,200034197,76561199865801740,the story is really well written and the game holds up today since it first released in 2013 the characters a super cool and the art style as amazing i cant wait  for the seconded on to come out,True,0,0,0.5,0,True,False,False,The Wolf Among Us
250320,200016394,76561199802084178,very beautiful art style would recommend but get it on sale instead of full price,True,0,0,0.5,0,True,False,False,The Wolf Among Us
250320,200002634,76561199244079074,fairytale characters experience the pov of the average human,True,0,0,0.5,0,True,False,False,The Wolf Among Us
250320,199991142,76561198085849524,1010 after playing multiple times cant wait for the second game,True,0,0,0.5,0,True,False,False,The Wolf Among Us
250320,199990632,76561199511454641,absolute cinema,True,0,0,0.5,0,True,False,False,The Wolf Among Us
250320,199983087,76561199401723634,just peak i feel bad for thoese still waiting for the season 2 for 10 years since i just started playing it,True,0,0,0.5,0,True,True,False,The Wolf Among Us
250320,199979792,76561198993594270,"i have played twau originally on my ps3 when i was around 10 years old so i didnt quite remembered everything well this game as an exceptional story i never read the fables comics tho theyre most likely definitely badass and cool its a must play game if like telltale im looking forward to play twau 2 and hoping it is a continuation i do you do we all love this telltale classic and dont you fucking lie to me because ill know it",True,0,0,0.5,0,True,False,False,The Wolf Among Us
250320,199973283,76561198132228951,im a sheriff whose now addicted to fairy tale violence 100010 video game experience,True,0,0,0.5,0,False,False,False,The Wolf Among Us
250320,199969483,76561198109672422,yes,True,0,0,0.5,0,True,False,False,The Wolf Among Us
250320,199964417,76561199541847302,i love telltale and that game is really great  i am so excited for the wolf among us 2 thanks telltale for create masterpiece,True,0,0,0.5,0,True,False,False,The Wolf Among Us
250320,199960200,76561198242904974,love the story,True,0,0,0.5,0,False,False,False,The Wolf Among Us
250320,199955248,76561199768224462,one of the best telltale games ive played,True,0,0,0.5,0,True,False,False,The Wolf Among Us
250320,199952212,76561199075467023,at first i pirated this game and then saw this games on sale mid way through ep2 and i enjoyed it so much so making this review 4 years to late,True,0,0,0.5,0,True,False,False,The Wolf Among Us
250320,199932966,76561199056173166,this convinced me to read the comics,True,0,0,0.5,0,True,False,False,The Wolf Among Us
250320,199909403,76561199114797258,peak game almost broke me  cant wait for the wolf among us 2,True,0,0,0.5,0,True,False,False,The Wolf Among Us
250320,199860824,76561198846663726,best choose choices and detective game ever i ever play,True,0,0,0.5,0,True,True,False,The Wolf Among Us
250320,199840501,76561198129248528,becoming a fairy detective and figuring out who killed tinkerbell beat the hell out of any of the fairy tale creatures or just kill them your a wolf for god sake just eat all the stupid characters that give you a hard time,True,0,0,0.5,0,True,False,False,The Wolf Among Us
250320,199835269,76561199375161782,an absolute masterpiece i immediately got so attached to the characters and couldnt possibly put the game down and finished it within days,True,0,0,0.5,0,True,False,False,The Wolf Among Us
250320,199830697,76561198427557276,good game,True,0,0,0.5,0,True,False,False,The Wolf Among Us
250320,199830473,76561198084190699,compelling and shocking,True,0,0,0.5,0,True,False,False,The Wolf Among Us
250320,199822167,76561198841114790,its really fun and i really enjoy the story,True,0,0,0.5,0,True,False,False,The Wolf Among Us
250320,199816080,76561199478340827,1010,True,0,0,0.5,0,True,False,False,The Wolf Among Us
250320,199748369,76561198080141856,played this about 10 years ago but i remember having a lot of fun with it not just with the mystery and the choices but also the style and atmosphere the supernatural hardboiled dectective vibe is awesome even if youre not familiar with the source material which i wasnt  i could honestly see myself playing this again  or watching someone play it  to remember how the plot goes and check how it aged,True,0,0,0.5,0,True,False,False,The Wolf Among Us
250320,199744218,76561199069681045,waiting for season 2,True,0,0,0.5,0,False,False,False,The Wolf Among Us
250320,199736395,76561199473908951,"release the sequeellllllll aaaaaaaahhh amazing game thats all",True,0,0,0.5,0,True,False,False,The Wolf Among Us
250320,199729974,76561199175379394,"played this not knowing what to expect and ended up getting fully hooked the story the world the characters it all feels like stepping into a dark fairy tale with a detective twist  even if youre new to these choicebased games this ones easy to get into every decision feels intense the voice acting is toptier and the art style just beautiful  if youre into gritty stories mystery or just want something different from the usual action games this is 100 worth it",True,1,0,0.5,0,True,False,False,The Wolf Among Us
250320,199724465,76561198870928196,i have loved both the big telltale games  first the walking dead and now the wolf among us   the storytelling the art style the sense of atmosphere the choices that change the story  theres a lot to love  i hope there is a season 2 for the wolf among us till then i am going to finish all the fable graphic novels,True,0,0,0.5,0,True,False,False,The Wolf Among Us
250320,199689465,76561199184815181,wolf,True,0,0,0.5,0,True,False,False,The Wolf Among Us
250320,199684540,76561198260284147,came back to replay this gem and can say this is some of the best peak fiction known to man,True,0,0,0.5,0,True,False,False,The Wolf Among Us
250320,199653191,76561199041443405,love telltale,True,0,0,0.5,0,True,False,False,The Wolf Among Us
250320,199645780,76561198996260227,i love the storyline and i hope to find similar gamer in the future,True,0,0,0.5,0,True,False,False,The Wolf Among Us
250320,199609880,76561199212453064,wow,True,0,0,0.5,0,True,False,False,The Wolf Among Us
250320,199605971,76561198330248625,lovely story,True,0,0,0.5,0,True,False,False,The Wolf Among Us
250320,199601612,76561198044046393,wow story  characters highly recommend,True,0,0,0.5,0,True,False,False,The Wolf Among Us
250320,199591090,76561199875012222,butchfemme bigby white,True,0,0,0.5,0,True,False,False,The Wolf Among Us
250320,199534995,76561199385432328,peak,True,0,0,0.5,0,True,False,False,The Wolf Among Us
250320,199530555,76561199366118101,wow what a game,True,0,0,0.5,0,True,False,False,The Wolf Among Us
250320,199510876,76561198296859942,good,True,0,0,0.5,0,True,False,False,The Wolf Among Us
250320,199476573,76561199053678662,absolutely amazing,True,0,0,0.5,0,True,False,False,The Wolf Among Us
250320,199472695,76561199818951313,this game made me wishlist a collection of fables comics on amazon,True,0,0,0.5,0,True,False,False,The Wolf Among Us
250320,199457808,76561198338961192,yes my queen,True,0,0,0.5,0,True,False,False,The Wolf Among Us
250320,199388808,76561199483463981,after playing this game i can only pray for the sequel to come soon,True,0,0,0.5,0,True,False,False,The Wolf Among Us
250320,199370751,76561198331038697,man what a good game,True,0,0,0.5,0,True,False,False,The Wolf Among Us
250320,199362328,76561197994238435,absolute crime that this interesting world with a incredible premise is after a whole decade and change that the sequel is still stuck in development hell,True,0,0,0.5,0,True,False,False,The Wolf Among Us
250320,199351386,76561199396982546,one of the best games ive ever played gripping important exciting heartbreaking in my opinion the best telltale game,True,0,0,0.5,0,True,False,False,The Wolf Among Us
250320,199344655,76561199440179012,its a very good game with a spectacular story bigby es asombroso,True,0,0,0.5,0,True,False,False,The Wolf Among Us
250320,199341416,76561199042593850,good gam,True,0,0,0.5,0,True,False,False,The Wolf Among Us
250320,199291514,76561198071176937,you can notice that bigby smokes cigarettes this is a reference to how he is the big bad wolf and he huffs and puffs until he blows your hous,True,0,0,0.5,0,True,False,False,The Wolf Among Us
250320,199271995,76561198153863369,better than walking dead imo,True,0,0,0.5,0,True,False,False,The Wolf Among Us
250320,199269939,76561199383780905,the wolf among us has a good detective story and has a gameplay similar to that of detroit become human i enjoyed it except for the ending which i think was a bit of a letdown,True,0,0,0.5,0,True,False,False,The Wolf Among Us
250320,199261816,76561199466446869,peak cant wait for wolf among us 2,True,0,0,0.5,0,True,False,False,The Wolf Among Us
250320,199259485,76561199861536980,i see why furries love wolves now,True,0,0,0.5,0,True,False,False,The Wolf Among Us
250320,199229304,76561199229450056,take my soul give me a season 2,True,0,0,0.5,0,True,False,False,The Wolf Among Us
250320,199174032,76561198012016102,an interesting but very dark take on how fairy tale characters survive in the real world,True,0,0,0.5,0,True,False,False,The Wolf Among Us
250320,199169537,76561199028692276,just a fantastic all around game like literally play it like please,True,0,0,0.5,0,True,False,False,The Wolf Among Us
250320,199168474,76561199133970443,waiting for the wolf among us 2,True,0,0,0.5,0,True,False,False,The Wolf Among Us
250320,199163901,76561199075483456,fun good storyline,True,0,0,0.5,0,True,False,False,The Wolf Among Us
250320,199157531,76561198253185618,bgameplay 1010 story 1010 my inability to rip someones arms off in every dialogue 010b,True,0,0,0.5,0,False,False,False,The Wolf Among Us
250320,199142896,76561199219864216,i need that wolf,True,0,0,0.5,0,True,False,False,The Wolf Among Us
250320,199118254,76561198419197462,interesting storylines dope graphics plot twists i liked this game,True,0,0,0.5,0,True,False,False,The Wolf Among Us
250320,199096793,76561199177601088,love it,True,0,0,0.5,0,True,False,False,The Wolf Among Us
250320,199069515,76561198387113863,one of the greatest interactive stories ive ever had the pleasure of experiencing thank you telltale as of 2025 i cant believe well be getting gta vi before wolf among us 2 hopefully we dont have to wait as long,True,0,0,0.5,0,True,False,False,The Wolf Among Us
250320,199060653,76561199012104294,uhh good game uhh rape scene was immaculate snow white hot would slime bloody mary,True,0,0,0.5,0,True,False,False,The Wolf Among Us
250320,199060140,76561198928826913,bigby is hot he takes his shirt off multiple times,True,0,0,0.5,0,True,False,False,The Wolf Among Us
250320,199058452,76561199429985197,best telltale game looking forward to part 2,True,0,0,0.5,0,True,False,False,The Wolf Among Us
250320,199053195,76561199754507247,your choices actually do matter in this telltale game,True,0,0,0.5,0,True,False,False,The Wolf Among Us
250320,199025802,76561199870450725,played it twice still suspicious of toad smoked more in this game than in my entire life 1010 would interrogate a talking pig again,True,0,1,0.5,0,True,False,False,The Wolf Among Us
250320,199025501,76561198300418300,if youre into games with a cool detective vibe strong story and a dark stylish world the wolf among us is seriously worth checking out i love the idea of fairy tale characters trying to survive in the real world the mystery pulls you in right from the start and the soundtrack is honestly so good its moody atmospheric and sets the perfect tone i really recommend this one once you start its hard to stop until you hit that wild final twist,True,0,0,0.5,0,True,False,False,The Wolf Among Us
250320,198973624,76561199105407880,one of the best games i play 1010,True,0,0,0.5,0,True,False,False,The Wolf Among Us
250320,198931569,76561199359958896,"such a great game honestly telltales best game in my opinion  i could understand the argument with twd season 1 though the writing is so amazing the voice acting is perfection i really loved the artstyle and everyones designs",True,0,0,0.5,0,True,False,False,The Wolf Among Us
250320,198854113,76561199275970349,had me more engaged than a game has for a long time i had to force myself to take breaks because i really wanted to keep going,True,0,0,0.5,0,True,False,False,The Wolf Among Us
250320,198837896,76561198355468579,a timeless masterpiece of interactive storytelling an extraordinary game 1010  fabletown wouldnt be the same without you,True,0,0,0.5,0,True,False,False,The Wolf Among Us
250320,198789067,76561198799445015,my glorious king bigby is a cool character,True,0,0,0.5,0,True,False,False,The Wolf Among Us
250320,198781697,76561199091634655,bigby,True,0,0,0.5,0,True,False,False,The Wolf Among Us
250320,198780110,76561198127533732,its perfect,True,0,0,0.5,0,True,False,False,The Wolf Among Us
250320,198777245,76561199084897456,the noir character of bigby and archetypes of the other fables in this game makes for a very exciting and immersive playthrough,True,0,0,0.5,0,True,False,False,The Wolf Among Us
250320,198771504,76561198126769984,,True,0,0,0.5,0,True,False,False,The Wolf Among Us
250320,198771345,76561199133249700,top tier telltale game,True,0,0,0.5,0,True,False,False,The Wolf Among Us
250320,198760250,76561198165450985,i played this game for 5 hours one day hooked the story is really good bigby fine shyt,True,0,0,0.5,0,True,False,False,The Wolf Among Us
250320,198712646,76561199173834339,another incredible game by telltale the game has an awesome story and good writting the voice acting is great and you gotta love the comic book art style and to me at least i think its a bit better then the walking dead game 1010 also snow is an absolute baddie,True,0,0,0.5,0,True,False,False,The Wolf Among Us
250320,198709639,76561198328282658,wolf  1010,True,0,0,0.5,0,True,False,False,The Wolf Among Us
250320,198698104,76561198988774979,"one of the greatest experiences ive ever had in gaming celeste hit me so hard  the message all wrapped in this a pixel art that hides how deep and real it is its up there with the wolf among us for me different vibe same emotional damage you have to play it trust me 3",True,0,0,0.5,0,True,False,False,The Wolf Among Us
250320,198696661,76561199859715419,game so good and epic,True,0,1,0.5,0,True,False,False,The Wolf Among Us
