appid,recommendationid,author_steamid,review,voted_up,votes_up,votes_funny,weighted_vote_score,comment_count,steam_purchase,received_for_free,written_during_early_access,game_title
40930,188792555,76561198346195504,it was one of the greatest games ive ever played most of the puzzle games lack a rich storytelling but this game did it the best way possible i also found out it was a thesis at the university of southern california it had marvelous soundtracks with amazing unique art style and puzzle it really needs you to think out of the box,True,0,0,0.5,0,True,False,False,The Misadventures of P.B. Winterbottom
40930,167245945,76561198200907303,honestly its a little underrated i would like to thank speed run 4 for bringing me here as the ost the ticking tarts was in speed run 4 at one point before it was changed also like to thank team fabulous 2 aswell,True,0,0,0.5,0,True,False,False,The Misadventures of P.B. Winterbottom
40930,155695822,76561198035759274,fun gameplay but what truly carries the game is the soundtrack,True,0,0,0.5,0,True,False,False,The Misadventures of P.B. Winterbottom
40930,155184160,76561198380399183,i expected a company of myself but its alright,True,0,0,0.5,0,True,False,False,The Misadventures of P.B. Winterbottom
40930,148743079,76561197990924817,its a fun little game thats worth full price takes about 5  7 hours to get 100,True,0,0,0.5,0,True,False,False,The Misadventures of P.B. Winterbottom
40930,139872818,76561198015099242,this game is good but maybe i hate it,True,0,0,0.5,0,True,False,False,The Misadventures of P.B. Winterbottom
40930,136589213,76561197969001561,i enjoyed it,True,0,0,0.5,0,True,False,False,The Misadventures of P.B. Winterbottom
40930,135568535,76561198001601852,similar to braid but on a smaller scalecirca 4 hours for main story with a more digestible story,True,0,0,0.5,0,True,False,False,The Misadventures of P.B. Winterbottom
40930,133880916,76561198096982392,brilliant game quirky not too difficult but enough challenge to make you focus the style is chefs kiss worth every penny 1010,True,0,0,0.5,0,True,False,False,The Misadventures of P.B. Winterbottom
40930,110131138,76561198113032212,one of the best puzzle platformers ever made,True,0,1,0.5,0,True,False,False,The Misadventures of P.B. Winterbottom
40930,101757339,76561197986527965,good and fairly short puzzle game,True,1,0,0.5199999809265136,0,True,False,False,The Misadventures of P.B. Winterbottom
40930,89832163,76561198435867870,this game is very good and im surprised i even found out about it,True,0,0,0.5,0,True,False,False,The Misadventures of P.B. Winterbottom
40930,74034613,76561198982351724,if you are into platformerpuzzle games then this is for you it isnt really my kind of thing but i got a full hours worth of fun out of it anyways it is probably only worth it if you can get a deal while its on sale though the unique mechanics make for some truly difficult puzzles so just keep that in mind,True,0,0,0.5,0,True,False,False,The Misadventures of P.B. Winterbottom
40930,73666717,76561198035100973,disclaimer my scoresreviews are almost always based on having bought the game at close to the lowest historical price on steam at time of purchase  quick score 45,True,2,0,0.463255226612091,0,True,False,False,The Misadventures of P.B. Winterbottom
40930,71111354,76561198030205950,i love pie  mustaches and top hats,True,0,0,0.4679802954196929,0,True,False,False,The Misadventures of P.B. Winterbottom
40930,70544065,76561197978347215,a fun little platformer puzzle game with great music and fantastic writing flavor text between levels no real dialogue aside from that you can finish the main game in 4 hours easily and there is a lot of bonus content after that,True,0,0,0.5,0,True,False,False,The Misadventures of P.B. Winterbottom
40930,70052343,76561198003565373,great game,True,0,0,0.5,0,False,False,False,The Misadventures of P.B. Winterbottom
40930,67650232,76561197983660276,i havent played this game in 9 years but if i were to try it again it would still be garbage,False,0,0,0.4445385336875915,0,False,False,False,The Misadventures of P.B. Winterbottom
40930,67538341,76561197992707079,fun little puzzle game with time puzzles  reminds me of braid wasnt in the mood to stretch my brain in the way but ill likely come back or let my kids go crazy   the art and mood of the game is quite good,True,1,0,0.5238095521926879,0,False,False,False,The Misadventures of P.B. Winterbottom
40930,65561824,76561198198521885,text is so large it overlaps and goes off screen i tried many different resolutions and i cannot find a fix,False,0,0,0.5,0,True,False,False,The Misadventures of P.B. Winterbottom
40930,63167669,76561197994818082,good platformer with a slight narcomania aftertaste,True,0,0,0.5,0,True,False,False,The Misadventures of P.B. Winterbottom
40930,56071982,76561198005649979,fantastic little game with such an entertaining story and great puzzle mechanics some of the clone challenge counts are a bit hard but the main story is utterly brilliant,True,0,0,0.5,0,True,False,False,The Misadventures of P.B. Winterbottom
40930,54294828,76561198032593738,good puzzle game with an amazing soundtrack,True,0,0,0.473549485206604,0,True,False,False,The Misadventures of P.B. Winterbottom
40930,54054138,76561198448156580,im the worst when it comes to puzzle games but i like them too  some puzzles are extremely difficult for me and exhausting to the point that i simply cant be motivated to continue playing  lack of story implementation here makes it hard for me to keep going also i know its a fun puzzle game and story is not the main focus here  play it if you wanna torture yourself   710,True,0,0,0.5,0,True,False,False,The Misadventures of P.B. Winterbottom
40930,53275493,76561198869256338,fun little game about stealing the elusive pie gotta catch them all,True,0,0,0.473549485206604,0,True,False,False,The Misadventures of P.B. Winterbottom
40930,49539751,76561198004352242,loved this game when i first played it years ago now ive suddenly got a craving to play it again  so its definitely fun and memorable,True,1,0,0.4703476428985595,0,True,False,False,The Misadventures of P.B. Winterbottom
40930,46085339,76561197962615895,good game my lil brother watched me beat it and thats all i have to say about that,True,0,0,0.4478774666786193,0,True,False,False,The Misadventures of P.B. Winterbottom
40930,45149429,76561198041344984,umm yeah look i finished it but i thought it was more tight than memorable maybe investigate other better puzzlers unless this is specifically your jam,True,0,0,0.44921875,0,True,False,False,The Misadventures of P.B. Winterbottom
40930,43677440,76561197979953970,reviewing games ive played a long time ago part 2  a cute and charming puzzle platformer that uses time manipulation but never quite managed to step up to another level like braid does its obvious inspiration,True,1,0,0.51199471950531,0,True,False,False,The Misadventures of P.B. Winterbottom
40930,40851799,76561197984786660,as many people i got it because of the similarities to braid i liked it the friends i showed it to didnt oh well,True,0,0,0.5,0,True,False,False,The Misadventures of P.B. Winterbottom
40930,39401927,76561198321125477,i cant get to scale properly on my high dpi display  graphics look fine but font is way too large and outside the screen dimensions  i tried turning off dpi scaling in control panel and in compatability settings for game but neither had any effect  wish i knew how to get a refund,False,0,0,0.46875,0,True,False,False,The Misadventures of P.B. Winterbottom
40930,36120885,76561197973968344,excellent platformerpuzzle game in the style of braid but with a different goofier personality i highly recommend the game if you like this genre of games  really well made short but sweet game,True,0,0,0.5,0,True,False,False,The Misadventures of P.B. Winterbottom
40930,35870922,76561198010932829,really good puzzle game that plays with different mechanics related to recording yourself to create clones,True,0,0,0.5,0,True,False,False,The Misadventures of P.B. Winterbottom
40930,30780494,76561198144343897,1010 would smack switches again,True,1,0,0.4746835231781005,0,True,False,False,The Misadventures of P.B. Winterbottom
40930,30233377,76561197993489270,pretty entertaining right up until you hit the brick wall which takes about 20 minutes and then you go what the fuck and you ask your stream audience what the fuck and nobody knows what the fuck so on the whole shrug10,True,2,0,0.4898332953453063,0,True,False,False,The Misadventures of P.B. Winterbottom
40930,29453169,76561198157201361,this was a good puzzle game it had a few puzzels that i had to look up the solution for because they were quite hard to figure out it has a nice art style,True,1,0,0.5,0,True,False,False,The Misadventures of P.B. Winterbottom
40930,27759874,76561198038638652,kinda so so as far a puzzle games go i picked it up in a humble bundle and its just not much fun,False,1,1,0.4726947247982025,0,False,False,False,The Misadventures of P.B. Winterbottom
40930,26162854,76561197997430271, mind boggling puzzles and yet not frustrating  very memorable protagonist  superb soundtrack,True,0,0,0.5,0,True,False,False,The Misadventures of P.B. Winterbottom
40930,25099177,76561198162737311,cake cake cake this game only show  tell about time  cake              so fucking cake,True,0,0,0.4573170840740203,0,True,False,False,The Misadventures of P.B. Winterbottom
40930,24678152,76561198202741049,the misadventures of mr pb winterbottom tis a tale of pies for he sought em  a magical journey told in rhyme about a thief that traveled through time  youll feel dumb but wise as well as a humorous pie neerdowell  enjoy delicious pies in spades in a game that doesnt copy braid  perform actions with speed and skills and enjoy challenges in the hills  but in this quest for wonderful dough the difficultly curve is terrible though,True,2,2,0.5049505233764648,0,True,False,False,The Misadventures of P.B. Winterbottom
40930,24234360,76561198025016718,yo i got this game for 50 cents its pretty good  1010 left with a craving for pies,True,0,0,0.4573170840740203,0,True,False,False,The Misadventures of P.B. Winterbottom
40930,23073174,76561198091433569,proof that video games can be art,True,0,0,0.5,0,True,False,False,The Misadventures of P.B. Winterbottom
40930,22859634,76561197993992608,it tries i guess thats all i can really say for it the elements are all there  it tries to have a personality good puzzle gameplay replayability but it just falls flat for some reason i really cant define who knows maybe youll get a better time out of it than i did but as it is this just feels bland and uninspired,False,2,0,0.4802206158638,0,False,False,False,The Misadventures of P.B. Winterbottom
40930,22311922,76561198024196431,i just love pie  but i cant quite make the moves winterbottom has to make in real life so i play the game instead,True,1,0,0.4856046140193939,0,True,False,False,The Misadventures of P.B. Winterbottom
40930,21201710,76561198053455047,a nice platformer with an interesting mechanic perhaps not incredibly unique or aweinspiring but worth it for those who like solving puzzles,True,0,0,0.5,0,True,False,False,The Misadventures of P.B. Winterbottom
40930,20270611,76561198022032398,a great brain teaser and quite humourous to boot the only flaw is the main story is too short but theres plenty of challenges to make up for it,True,0,0,0.5,0,True,False,False,The Misadventures of P.B. Winterbottom
40930,20167696,76561197993177389,i beat this game awhile back but i wanted to come back to play the bonus challenges its very similar to braid and i love the puzzles that it poses im not very into speedrunning so i wont be getting all the time medals on the bonus levels i did get the recording medals on them which was very challenging,True,0,0,0.5,0,True,False,False,The Misadventures of P.B. Winterbottom
40930,18775130,76561197996121824,a solid 2d puzzle platformer feels a lot like a spy vs spy comic strip come to life will give your brain some mental floss on the short side so you can definitely knock it off your backlog sorry portal fans no meme jokes for you in this game,True,0,0,0.5,0,False,False,False,The Misadventures of P.B. Winterbottom
40930,17718338,76561198009485644,charming puzzle platformer with a nice soundtrack  httpswwwyoutubecomwatchvckqslgnsw8e,True,0,0,0.5,0,True,False,False,The Misadventures of P.B. Winterbottom
40930,17568823,76561198034172959,here is an amazing little indie gem  the misadventures of pb winterbottom is about imaginative puzzles with good mechanics story is told in funny poetic verses unique visual style and soundtrack perfectly fit the mood of the game however the game is short and controls with the stick are a pain,True,0,0,0.5,0,True,False,False,The Misadventures of P.B. Winterbottom
40930,15974705,76561197996859750,moved to tears great music aesthetics and gameplay also pies,True,0,0,0.5,0,True,False,False,The Misadventures of P.B. Winterbottom
40930,15830309,76561198009671381,its a good gamei recommend you buy and play it,True,0,0,0.5,0,True,False,False,The Misadventures of P.B. Winterbottom
40930,15365809,76561197992544152,i was looking for a braidlike game and i found this one ok i havent finished it yet but this is a masterpiece if you like puzzle games and it definitely worths the money creepy mood great if you like tim burtons films hard challenge with a clever level design beautiful soundtrack and it doesnt even need a mouse to play it very important if you like to play games laid on the couch with your laptop d  love it ,True,0,0,0.5,0,True,False,False,The Misadventures of P.B. Winterbottom
40930,14382594,76561198024947580,norbert winklebottom loves pb winterbottom,True,0,0,0.5,0,True,False,False,The Misadventures of P.B. Winterbottom
40930,14296865,76561198024271917,no i dont like this game please take it off my list of games you can have it back,False,3,0,0.4703021347522735,0,True,False,False,The Misadventures of P.B. Winterbottom
40930,13913522,76561198041991925,fun puzzle game with challenge levels a different mechanic is introduced in each area make it a change of pace and a refreshing playthrough well put together and worth a look into,True,2,0,0.5068892240524291,1,False,False,False,The Misadventures of P.B. Winterbottom
40930,13780171,76561197998092003,very fun puzzleplatformer a little bit short but constantly keeps throwing in new gameplay mechanics to keep the game fresh and fun,True,0,0,0.5,0,True,False,False,The Misadventures of P.B. Winterbottom
40930,13525372,76561198008620069,its a good puzzler not more but not less than that so if your done with the excellent puzzlers like eg portal braid spacechem qube vessel and you want more of that this game is definitively worth a look,True,0,0,0.5,0,True,False,False,The Misadventures of P.B. Winterbottom
40930,13291017,76561197984391621,455,True,0,0,0.5,0,False,False,False,The Misadventures of P.B. Winterbottom
40930,12573054,76561197970842709,a puzle game that plays with time and working with multiple versions of yourself  an excelent game i got about 3 hours of game play,True,4,0,0.5053007006645202,0,True,False,False,The Misadventures of P.B. Winterbottom
40930,11937238,76561197996239507,create clones steal pies be an overall dick to society pretty good,True,0,0,0.4895615875720977,0,True,False,False,The Misadventures of P.B. Winterbottom
40930,11812651,76561198067888927,the art style was the primary attractant for me while tmpbw did not dissapoint in this category the price doesnt seem quite right i would only reccommend purchasing this on sale if you are interesting in a fun short indie puzzler its not braid but its still pretty solid,True,0,0,0.4895615875720977,0,True,False,False,The Misadventures of P.B. Winterbottom
40930,11289325,76561197976565082,id like to say its too short but since the game is pretty bland i probably wouldnt want to play another minute of it anyway,False,0,0,0.5,0,True,False,False,The Misadventures of P.B. Winterbottom
40930,10728517,76561198008499124,was actually quite impressed with this reminds me of braid but more lighthearted,True,2,0,0.5106160640716552,0,True,False,False,The Misadventures of P.B. Winterbottom
40930,10714440,76561198073095877,highly enjoyable with a great humor,True,1,0,0.4732055962085723,0,True,False,False,The Misadventures of P.B. Winterbottom
40930,10638583,76561198033354971,this game was a nice surprise i only paid around 050 for it but it proved to be one of my best purchases the art style characters and story are a delight the theme music will be stuck in your head for weeks the game plays well with a keyboard but a controller is your best bet to avoid frustration with later levels buy it right now,True,2,0,0.5194015502929688,0,True,False,False,The Misadventures of P.B. Winterbottom
40930,10194291,76561197979479197,eat pies,True,0,0,0.5,0,True,False,False,The Misadventures of P.B. Winterbottom
40930,8352402,76561197972279102,sick game,True,0,0,0.5,0,True,False,False,The Misadventures of P.B. Winterbottom
40930,8254306,76561198018015465,one of my favorite puzzle games,True,0,0,0.5,0,True,False,False,The Misadventures of P.B. Winterbottom
40930,8196114,76561197996613749,just great,True,0,0,0.5,0,True,False,False,The Misadventures of P.B. Winterbottom
40930,8111099,76561197972734293,craziest and most charming puzzle platformer of all time slightly moreso than the lost vikings but only slightly httpthebestgameneverplayedwordpresscom20110716themisadventuresofpbwinterbottom,True,1,0,0.5334928035736083,0,True,False,False,The Misadventures of P.B. Winterbottom
40930,8072019,76561198009437516,good puzzle,True,1,0,0.5334928035736083,0,False,False,False,The Misadventures of P.B. Winterbottom
40930,7834424,76561198044176427,such a little gem,True,0,0,0.4533678889274597,0,True,False,False,The Misadventures of P.B. Winterbottom
40930,7628693,76561198019781014,nice puzzler those shadow clones remind me of braid but winterbottom is far from being that good still its recommended for anyone who likes puzzles,True,10,0,0.5365813374519348,0,True,False,False,The Misadventures of P.B. Winterbottom
40930,7367261,76561198088444935,      breid     ,True,0,0,0.5,0,True,False,False,The Misadventures of P.B. Winterbottom
40930,7327912,76561198016420785,braid difficulty mode  check limbo art mode  check   910   quite a surprise wonderful game magnific soundtrack,True,0,0,0.5,0,True,False,False,The Misadventures of P.B. Winterbottom
40930,1362439,76561197992120094,braid lite basically which is not a bad thing,True,0,0,0.5,0,False,False,False,The Misadventures of P.B. Winterbottom
40930,2572061,76561198009430218,the misadventures is certainly mischevious this platform title was an unexpected surprise i havent beaten it yet but the gameplay keeps getting more interesting and the art style is certainly attention grabbing pb winterbottom is a gentleman that jumps across rooftops and buildings across a vast city that serves as a backdrop the game is also hilarious  8210,True,2,0,0.5129562616348265,0,True,False,False,The Misadventures of P.B. Winterbottom
40930,6259956,76561198062346127,very hard but very fun  d and very good music,True,0,0,0.5,0,True,False,False,The Misadventures of P.B. Winterbottom
40930,930770,76561197982355264,the only real puzzle here is why i bought this fucking game,True,0,0,0.5,1,True,False,False,The Misadventures of P.B. Winterbottom
40930,74382,76561197961167439,the misadventures of pb winterbottom feels almost exactly like braid its good fun brain food,True,0,0,0.5,0,True,False,False,The Misadventures of P.B. Winterbottom
40930,2984828,76561198015489880,what braid should have been,True,0,0,0.4761904776096343,0,True,False,False,The Misadventures of P.B. Winterbottom
40930,2522653,76561198008716718,you like pie you like pie you like pie  youre gunna friggin love pie after this or hate it if you dont like time manipulation puzzles,True,0,0,0.5,0,True,False,False,The Misadventures of P.B. Winterbottom
40930,5378775,76561198048820172,this one is a nice game good music but gets really hard after some time puzzles get too complicated too quickly,True,0,0,0.5,0,False,False,False,The Misadventures of P.B. Winterbottom
40930,6573566,76561198069421087,although it slightly spun me out i would agree that this is a fun game pb winterbottom is a creepy man even in movement and he sure does love his pies that whole concept was a really cute touch i very much like the art the music and details of this game its a very cool way to travel by umbrella i love the era theme and most of all i love pb winterbottoms gentlemanly moustache and top hat im not sure if id spend more than 399 to own it though,True,0,0,0.5,0,True,False,False,The Misadventures of P.B. Winterbottom
40930,2119059,76561198002554439,yeah this is pretty indie but thats not a good thing,True,0,0,0.5,0,True,False,False,The Misadventures of P.B. Winterbottom
40930,183617,76561197964431051,pie gobbling maniac in an exceptionally charming platformer,True,0,0,0.4552904665470123,0,True,False,False,The Misadventures of P.B. Winterbottom
40930,1808786,76561197998281238,a spiffy gimmick but the game was too damn easy,True,1,0,0.4884546995162963,0,True,False,False,The Misadventures of P.B. Winterbottom
40930,1484435,76561197993676094,kinda boring you collect those stupid pies or we and thats it 510,True,0,0,0.4646840095520019,0,True,False,False,The Misadventures of P.B. Winterbottom
40930,1982922,76561198000580811,really fun pussle game best ost ever d,True,0,0,0.5,0,True,False,False,The Misadventures of P.B. Winterbottom
40930,1146407,76561197987794960,                             ,True,0,0,0.5,0,True,False,False,The Misadventures of P.B. Winterbottom
40930,2098046,76561198002248555,this game is a must get for anyone who has a pulse or breathes air its a cheap and extremely well put together little game  very cool concept,True,1,0,0.5238095521926879,0,True,False,False,The Misadventures of P.B. Winterbottom
40930,5070653,76561198044748504,this game is clever and funny and you should all buy it yah cheapskates,True,0,0,0.5,0,False,False,False,The Misadventures of P.B. Winterbottom
40930,2285206,76561198005164374,a fun and funny puzzle game with pie everyone loves pie ,True,0,0,0.5,0,True,False,False,The Misadventures of P.B. Winterbottom
40930,721277,76561197976530450,this was a great little game soundtrack was a big plus and suitable dark comic themes dark at least for a pie chasing fat man interesting puzzles adapted in different ways to keep it goods cheap  fun   recommended,True,0,0,0.5,0,True,False,False,The Misadventures of P.B. Winterbottom
40930,2739097,76561198011900918,a nice and simple puzzle game with a quality art style really enjoyable and good value for money ,True,0,0,0.5,0,True,False,False,The Misadventures of P.B. Winterbottom
40930,3146255,76561198018188837,divertido y caricaturesco pero hay mejores titulos de plataformas,False,0,0,0.5,0,False,False,False,The Misadventures of P.B. Winterbottom
40930,257363,76561197966813656,really smart game makes you think to pass the later levels recommend it ,True,0,0,0.5,0,True,False,False,The Misadventures of P.B. Winterbottom
40930,5132860,76561198045428465,funny puzzle game and not that hard unlike braid ,True,0,0,0.5,0,False,False,False,The Misadventures of P.B. Winterbottom
40930,6198069,76561198061049806,really really fun reminds me of braid wish it was longer,True,0,0,0.5,0,True,False,False,The Misadventures of P.B. Winterbottom
40930,5076302,76561198044804866,ridiculously stupid fun youre a fat victorian era thief who loves pie you find a portal and gain the power to create clones of yourself to use for your own personal gaintogetthebestpieever definitely pick this one up,True,0,0,0.5,0,True,False,False,The Misadventures of P.B. Winterbottom
40930,1115541,76561197987075355,very nice reminds me of braid but simpler and more logical therefore less of a challenge in making perfect moves on every levels  which made me stopped playing braid  but rather think differently using 4th dimension always with a last second little twist you didnt see coming when you kick off very nice music too vintage style,True,1,0,0.5303030014038085,0,True,False,False,The Misadventures of P.B. Winterbottom
40930,4265516,76561198034739619,vintage fluid ingenious and a well done piece of code better than braid for me very  good  ps the tutorial is well done and after a while you will understand easily the game lhn  710,True,0,0,0.5,0,True,False,False,The Misadventures of P.B. Winterbottom
40930,799972,76561197978722135,very fun little game worth it especially if its on sale,True,0,0,0.5,0,True,False,False,The Misadventures of P.B. Winterbottom
40930,1393878,76561197992682717,this game has fun puzzles great music and a nifty art style  i thouroughly enjoyed it,True,0,0,0.5,0,True,False,False,The Misadventures of P.B. Winterbottom
40930,4667661,76561198040563849,old geezer chasin pies,True,0,0,0.5,0,True,False,False,The Misadventures of P.B. Winterbottom
40930,3070513,76561198016951288,great puzzle game,True,0,0,0.5,0,True,False,False,The Misadventures of P.B. Winterbottom
40930,5492419,76561198050684899,    ,True,0,1,0.5,1,True,False,False,The Misadventures of P.B. Winterbottom
40930,3500299,76561198023784707,one of the greatest and most original indie titles of our time it is truly a spectacle of both technical skill and artistic prowess,True,0,0,0.5,1,True,False,False,The Misadventures of P.B. Winterbottom
40930,1102335,76561197986779892,pie,True,0,0,0.5,0,True,False,False,The Misadventures of P.B. Winterbottom
40930,3692024,76561198026148196,amazing fun and above all unique platform game its cheap and it sometimes forces you to think outside the box to solve the puzzles a definite mustbuy,True,0,0,0.5,0,False,False,False,The Misadventures of P.B. Winterbottom
