appid,recommendationid,author_steamid,review,voted_up,votes_up,votes_funny,weighted_vote_score,comment_count,steam_purchase,received_for_free,written_during_early_access,game_title
593380,153909210,76561197987702972,one of the best dlcs ever made to what is probably the best ever made turnbased strategy game xcom2 this is an absolute must buy alongside xcom2 if you want the best experience possible,True,1,0,0.5019304752349854,0,True,False,False,XCOM 2: War of the Chosen
593380,153820043,76561198040745998,too hard but a lot of fun,True,0,0,0.5,0,True,False,False,XCOM 2: War of the Chosen
593380,153489509,76561198005274399,great game it hurts me in the core of my being i love it,True,0,0,0.5,0,True,False,False,XCOM 2: War of the Chosen
593380,152474218,76561198169504730,brought a rookie on a routine scouting mission to show him the ropes a wild berserker queen appeared,True,0,1,0.5,0,False,False,False,XCOM 2: War of the Chosen
593380,152172994,76561198045052715,this is still one of my all time favorite games in case anyone is wondering it is possible to grind your stats like health mobilitywill aim and dodge while playing a forever game  just keep the counter under control,True,0,0,0.5,0,True,False,False,XCOM 2: War of the Chosen
593380,151075581,76561198026419548,1010 expansion drastically improves the game  this is what a 40 dlc should look like,True,0,0,0.5,0,True,False,False,XCOM 2: War of the Chosen
593380,150980642,76561198885871116,the game kind of sucks mods makes it infinitely better though,True,0,0,0.5,0,True,False,False,XCOM 2: War of the Chosen
593380,149626947,76561199034396414,perfect,True,1,0,0.5238095521926879,0,True,False,False,XCOM 2: War of the Chosen
593380,149484770,76561199500424871,incredible dlc did you enjoy the game so prepare yourself to war of the chosen 910,True,0,0,0.5,0,True,False,False,XCOM 2: War of the Chosen
593380,149218475,76561198085115024,the voidmaiden got the gyatt she is hella bad frfr,True,3,0,0.4749175012111663,0,True,False,False,XCOM 2: War of the Chosen
593380,148564444,76561197999045600,its one of the best dlcs ive ever purchased for a game because it significantly changes the game for the better  not only do you get several new and powerful classes but there are great new enemies like the chosen to fight as well as the addition of zombies who can be very dangerous when combined with other enemy forces,True,0,0,0.5,0,True,False,False,XCOM 2: War of the Chosen
593380,147655363,76561197999455994,superbly rich and fulfilling gameplay and probably the most fun you can have with xcom full stop it makes the base game feel like an unfinished prototype whos sole purpose was to serve as a base for wotc the same way 2 did for eu,True,2,0,0.5238095521926879,0,True,False,False,XCOM 2: War of the Chosen
593380,146685730,76561198326718690,highly recommend this dlc is packed with value and is better than the base game in every way,True,1,0,0.5,0,True,False,False,XCOM 2: War of the Chosen
593380,146675022,76561198860645123,must buy dlc adds lots of additional content especially when you have finished the vanilla,True,1,0,0.5,0,True,False,False,XCOM 2: War of the Chosen
593380,146619148,76561198401918651, good ,True,1,0,0.4444444179534912,0,True,False,False,XCOM 2: War of the Chosen
