appid,recommendationid,author_steamid,review,voted_up,votes_up,votes_funny,weighted_vote_score,comment_count,steam_purchase,received_for_free,written_during_early_access,game_title
593380,201953133,76561198081270017,taketwo and 2k games have updated all their games terms of service turning this game as well as all of their other games into literal spyware,False,1,0,0.5238095521926879,0,True,False,False,XCOM 2: War of the Chosen
593380,201169187,76561199091535628,just finished the first mission pretty good so far,True,1,0,0.5,0,True,False,False,XCOM 2: War of the Chosen
593380,200977710,76561199756065124,keeps crashing,False,1,0,0.5,0,True,False,False,XCOM 2: War of the Chosen
593380,200612525,76561199077338465,takes a great game and elevates it to a another level,True,1,0,0.5,0,True,False,False,XCOM 2: War of the Chosen
593380,200398037,76561198294114007,my pud is flat from all the railroading,False,0,0,0.4526748657226562,0,True,False,False,XCOM 2: War of the Chosen
593380,200279267,76561197995983758,peak,True,1,0,0.5238095521926879,0,True,False,False,XCOM 2: War of the Chosen
593380,200229120,76561198025145635,tos controversies aside xcom 2 is awesome as a standalone game but wotc really gets it to shine   overall its a great dlc to get it restructures the game to add more objectives while also including additional classes enemies and background to the xcom world,True,2,0,0.5238095521926879,0,True,False,False,XCOM 2: War of the Chosen
593380,200111860,76561198421720063,me bad game good ,True,3,0,0.56521737575531,0,False,False,False,XCOM 2: War of the Chosen
593380,199301770,76561198188720998,instead of getting a job i play this,True,4,7,0.5833333134651184,0,True,False,False,XCOM 2: War of the Chosen
593380,198567102,76561198039305661,xcom 3 when,True,1,1,0.4856046140193939,0,True,False,False,XCOM 2: War of the Chosen
593380,198488523,76561198014485641,disgusting tos change,False,5,0,0.4970059692859649,0,False,False,False,XCOM 2: War of the Chosen
593380,198246146,76561198400777302,good game rate 88100,True,1,0,0.4562463164329528,0,True,False,False,XCOM 2: War of the Chosen
593380,198112836,76561198348635192,best dlc to a game of all time,True,1,0,0.4562463164329528,0,False,False,False,XCOM 2: War of the Chosen
593380,197564138,76561197992826305,great game but now its malwarespyware,False,7,1,0.5625,0,True,False,False,XCOM 2: War of the Chosen
593380,197418688,76561198000295532,eula change too scared to use mods now on single player gaming so it has become garbage,False,11,1,0.5824910402297973,0,True,False,False,XCOM 2: War of the Chosen
593380,196855341,76561198100144974,dont buy this 2k and taketwo has change all their games to spyware recent update to eula makes it can collect all the data on computer,False,7,1,0.5081791877746582,0,True,False,False,XCOM 2: War of the Chosen
593380,196770318,76561198120243427,uninstall take two spyware,False,4,1,0.4873663485050201,0,True,False,False,XCOM 2: War of the Chosen
593380,196547602,76561198041280940,considering the change of terms of service i can only not recommand this game and any other game from the involved compagnies  game is was great they removed mod support apparently even condamn it now game as a steam workshop that is now not functional  this kind of bss should not be endorsed by any self respecting player,False,4,0,0.5035294294357299,0,False,False,False,XCOM 2: War of the Chosen
593380,196355135,76561197994090837,very good edition to the base game couldnt imagine replaying xcom2 without this enabled,True,1,0,0.5038167834281921,0,True,False,False,XCOM 2: War of the Chosen
593380,195188529,76561198132398205,one of the best expansions produced,True,1,0,0.5238095521926879,0,True,False,False,XCOM 2: War of the Chosen
593380,194925015,76561198368859150,how do i play this game,True,0,0,0.5,0,True,False,False,XCOM 2: War of the Chosen
593380,194730338,76561198036486474,if its in my steam library ass holes where at it only shows xcom 2 when i run xcom 2 the game but the icon of xcom 2 wotc icon is not showing ,True,0,0,0.472312718629837,0,True,False,False,XCOM 2: War of the Chosen
593380,194348607,76561198125018627,dogshit i cant even play it,True,0,0,0.4779411852359771,0,True,False,False,XCOM 2: War of the Chosen
593380,194295392,76561198075337459,in my humble opinion this is the best expansion of all time,True,1,0,0.5,0,False,False,False,XCOM 2: War of the Chosen
593380,194241228,76561198044891467,loved xcom 1 enjoyed 2 the first time around but even though it was a little more complex something felt like it was missing  this expansion has rounded the game out beautifully im really impressed i wish all expansions were as considered and comprehensive as this  just finished my first ever ironman run on xbox and honestly it was one of the most rewarding gaming experiences ive had for sometime highly recommend and looking forward to the third if  when we get it,True,6,0,0.5744680762290953,0,True,False,False,XCOM 2: War of the Chosen
593380,194179057,76561199020007211,super fucking hard coming from a casual to turn based tactics strategy games i very very much enjoy strategy games of all caliber crusader kings 3 stellaris dune spice wars old fallout games etc i am still trying to get good at the game in terms of difficulty its on the same level of punishing as a souls game but with different gameplay obviously,True,2,0,0.5348837375640869,0,True,False,False,XCOM 2: War of the Chosen
593380,193880688,76561198016866230,this game needs a community patch to fix constant freezing well surrounded by badguys in combat other than that its all good,True,1,0,0.5121951103210449,0,False,False,False,XCOM 2: War of the Chosen
593380,192277514,76561198329483752,this is my whole time favorite game im obsessed and in love with it wish there was a xcom 3 if not ever in their plans ill offer to do it and im not joking this game is literally the bomb love it love it love it,True,0,0,0.5,0,True,False,False,XCOM 2: War of the Chosen
593380,190054227,76561198128102816,top expansion must have,True,0,0,0.4848866462707519,0,True,False,False,XCOM 2: War of the Chosen
593380,189930848,76561198962480305,let me get this simple xcom 2 without wotc is imperfect,True,0,0,0.4848866462707519,0,True,False,False,XCOM 2: War of the Chosen
593380,188810189,76561197974470693,great add on to xcom 2 wish they would make x com 3 would be really awesome great game as always get it you wont be disappointed,True,0,0,0.5,0,True,False,False,XCOM 2: War of the Chosen
593380,188503097,76561197974186303,an amazing expansion for a game that was already one of the best you can play on a pc just amazing and i truly hope that one day well get an xcom3 and these devs dont join the band wagon and try and make games that also work on a console,True,0,0,0.5,0,True,False,False,XCOM 2: War of the Chosen
593380,188470254,76561197971973824,probably the best dlc for any strategy game the content it adds is substantial fun and improves the base game in almost every way,True,0,0,0.5,0,False,False,False,XCOM 2: War of the Chosen
593380,188022815,76561197997208362,im absolutely pissed they changed the loadout music for another one i let the original xcom2 one plays for hours,True,0,0,0.5,0,True,False,False,XCOM 2: War of the Chosen
593380,187682870,76561198139770642,toppest tier dlc right here,True,0,0,0.5,0,True,False,False,XCOM 2: War of the Chosen
593380,187498445,76561198269158430,deeper and more challenging,True,2,0,0.548872172832489,0,True,False,False,XCOM 2: War of the Chosen
593380,187392848,76561197990752063,just awesome,True,0,0,0.5,0,True,False,False,XCOM 2: War of the Chosen
593380,187228337,76561198066710077,2k pushed a dog sht launcher and broke the game then 2k removed the launcher permanently breaking the war of the chosen dlc this game crashes and fails to launch for so many people keep that in mind because 2k has done absolutely nothing to fix this this is a broken game that will never see help,False,19,0,0.5521177053451538,0,True,False,False,XCOM 2: War of the Chosen
593380,186509373,76561198110650531,finally got around to playing wotc  810  maybe a 9  the only real complaint i have is the story and faction stuff felt a little weak  but definitely a huge bump up on an already badass game  a nobrainer if you like the base game  and the setup for the next game was cool,True,1,0,0.5238095521926879,0,False,False,False,XCOM 2: War of the Chosen
593380,186464493,76561198080106195,amazing dlc makes a timeless game even better,True,1,0,0.5238095521926879,0,True,False,False,XCOM 2: War of the Chosen
593380,186378880,76561198104587103,all time classic game great dlc,True,1,0,0.5258620381355285,0,False,False,False,XCOM 2: War of the Chosen
593380,185663463,76561198394091509,good,True,2,0,0.52173912525177,0,True,False,False,XCOM 2: War of the Chosen
593380,185149869,76561199047564526,love this game soo much fun to play,True,0,0,0.5,0,True,False,False,XCOM 2: War of the Chosen
593380,185130033,76561198044051576,the best superior dlc ever created whoever thinks otherwise have to be after lobotomy,True,0,1,0.4336735010147094,0,False,False,False,XCOM 2: War of the Chosen
593380,184808226,76561198024471688,best game of all time i grew up playing the 90s xcom games witch were far ahead of their time both the new xcom games toke it up several notches please make an xcom 3  d,True,1,0,0.5,0,True,False,False,XCOM 2: War of the Chosen
593380,184675969,76561198330496732,simply one of the best tactical games i ever played and then the modsgoodness the modsthey add so freakin much options enemycustomizationweaponoverhaulmusic you name it we have itand its so mod friendly great gamewe need xcom 3 man pleaaase,True,3,0,0.528171718120575,0,False,False,False,XCOM 2: War of the Chosen
593380,184193139,76561199637655839,an excellent and difficult game at all levels  for turnbased strategy games this is probably the best template all other games should look toward  very addicting game play its about maximizing your wins and minimizing your losses and its very satisfying whenever you pull that off  highly recommend,True,1,0,0.4761904776096343,0,True,False,False,XCOM 2: War of the Chosen
593380,184150273,76561198013610937,wotc is a musthave but for your first playthrough i would highly recommend playing the vanilla game first with mods to your liking but without wotc is what i mean as this expansion just adds so much stuff on top of the vanilla xcom2 experience that you really gotta know the ropes first to fully enjoy this expansion sort of similar to factorio and factorio space age dlc,True,4,0,0.5749613642692565,0,False,False,False,XCOM 2: War of the Chosen
593380,184064762,76561198199999457,nais,True,1,0,0.4841158390045166,0,True,False,False,XCOM 2: War of the Chosen
593380,182480721,76561198207412187,a solid enough dlc to the base xcom 2 game but not at the full price of 40 i was fortunate enough to get this at a heavy discount  edit its not showing in my review but id estimate i spent over 40 hours playing this dlc on top of the 34 hours from previously playing the base game back in the day,True,2,0,0.5352950692176818,0,True,False,False,XCOM 2: War of the Chosen
593380,181817564,76561198985684426,this is a must have if you wish to have the full xcom 2 experience 1010 dlc it is often on an about 90 sale so just wait for that even tho i think its worth full price,True,6,0,0.5809673070907592,0,True,False,False,XCOM 2: War of the Chosen
593380,181639794,76561198171966735,xcom and any other related games 100 rng meme right here funny shenanigans with mods load too many and pc crashes for the luls downside  high valuable repeatability  credits goes to the people who made the mods for this wotc extended dlc  helpful review try new experimental mods which some how makes it more fun evac alloverwatch all  i too would like to wish for xcom3 too when,True,0,0,0.5,0,False,False,False,XCOM 2: War of the Chosen
593380,180603898,76561198813485075,xcom2nin daha da stne koyan bir dlc,True,0,0,0.487352430820465,0,True,False,False,XCOM 2: War of the Chosen
593380,179827249,76561198028549799,i finished the vanilla xcom 2 twice already and just today i tried war of the chosen  i dont have much to say so this will be quick  i never had any gameplay issues with the vanilla game but in wotc i have nonstop graphics glitches and these weird red screen errors  but  as soon as i launched wotc i got 100 achievements for xcom 2 before the menu even loaded  hahahahahaha  1010,True,0,0,0.5,0,True,False,False,XCOM 2: War of the Chosen
593380,179523520,76561198174229817,i bought the whole bundle and i seriously have a hard time imagining xcom 2 without the resistance factions and the obnoxious alien champions this dlc adds huge depth to the game extremely recommended,True,0,0,0.5,0,False,False,False,XCOM 2: War of the Chosen
593380,178641433,76561198072218228,this dlc could easily be a whole new game it elevates the xcom experience to great cinematic heights  the new features are all awesome and engage the player making him connect with the soldiers worth it 100,True,2,0,0.5,0,True,False,False,XCOM 2: War of the Chosen
593380,178631016,76561197983623653,this is some of the best dlc ive ever purchased for a videogame it makes the replayability of an already epic game even better i really did not think this was possible but with the added enemies and tweaks to the progression it is almost like an entirely new game i absolutely loved every second of it,True,3,0,0.52173912525177,0,True,False,False,XCOM 2: War of the Chosen
593380,177637045,76561198052274144,while im not entirely happy about a dlc being required for a full experience of the base game it is just what was missing for me to enjoy it if you can get it on a large discount it makes xcom 2 a really fun turn based strategy game,True,4,0,0.5794824361801147,0,False,False,False,XCOM 2: War of the Chosen
593380,177529098,76561199188576079,the game is litterally unplayable without this dlc,True,0,0,0.5,0,True,False,False,XCOM 2: War of the Chosen
593380,177336735,76561198054798040,i like xcom but not this dlc some of the gameplay features like buddying  look good but when someone can teleport into your team and kill one of them then teleport out and theres nothing you can do it is just annoying some might see this as a challenge each to their own i guess it just stopped being fun at that point for me,False,9,2,0.568971037864685,0,True,False,False,XCOM 2: War of the Chosen
593380,176693179,76561199647860539,played on switch before 10 out of 10,True,0,0,0.5,0,True,False,False,XCOM 2: War of the Chosen
593380,176646652,76561198145824663,i wish this game had pvp multiplayer its like chess,True,1,0,0.5238095521926879,0,True,False,False,XCOM 2: War of the Chosen
593380,176189641,76561197990080017,fantastic and mods wow i wish these guys would make xcom 3,True,3,1,0.5372969508171082,0,True,False,False,XCOM 2: War of the Chosen
593380,175796798,76561198015835074,masterpiece,True,3,0,0.5555892586708068,0,True,False,False,XCOM 2: War of the Chosen
593380,175052164,76561199303377267,better than sex probably,True,5,11,0.4939034581184387,0,True,True,False,XCOM 2: War of the Chosen
593380,173661663,76561199181242629,its good,True,0,0,0.5,0,True,False,False,XCOM 2: War of the Chosen
593380,172926197,76561198047292289,hard as hell but its excellent if you enjoy turn based rpgs,True,0,0,0.5,0,True,False,False,XCOM 2: War of the Chosen
593380,172252874,76561198062009438,this dlc make an already great game even better,True,2,0,0.5338275432586669,0,True,False,False,XCOM 2: War of the Chosen
593380,171694744,76561198839966195,mods dont work,False,3,0,0.440577358007431,0,True,False,False,XCOM 2: War of the Chosen
593380,171032696,76561198219753897,xcom 2 war of the chosen is the best game i have ever played,True,1,0,0.5,0,True,False,False,XCOM 2: War of the Chosen
593380,171019544,76561198267883530,i cannot imagine playing xcom 2 without wotc for the ultimate experience get wotc shens last gift the alien hunters dlc and install the amazing lwotc long war of the chosen from steam workshop masochism simulator 1000,True,1,0,0.5,0,True,False,False,XCOM 2: War of the Chosen
593380,170019606,76561198859334436,i got the wotc dlc and it shows i need to launch xcom 2 to play it but when i do the normal xcom2  playsthere is no option to play wotc can anyone help,True,2,2,0.4862774312496185,0,True,False,False,XCOM 2: War of the Chosen
593380,169063546,76561198283741629,wheres xcom 3,True,1,0,0.4574374258518218,0,True,False,False,XCOM 2: War of the Chosen
593380,168714927,76561198444744885,start the game stare at 2k logo for 5 seconds game crashes  i dunno this thing isnt worth 3999 good thing i got it on a sale only for 279 although staring at a logo for 5 seconds its still quite an insane price to ask,False,5,1,0.5064786672592163,0,True,False,False,XCOM 2: War of the Chosen
593380,167861708,76561198347135573,the new classes are all unique and fun to use the chosen on top of being really fun characters are great adversaries with fun loot the lost are a great addition and i really like the new mission types and theres probably still some stuff im forgetting to mention  its really great but i would recommend playing through the vanilla game first this expansion adds a lot and it could be a bit overwhelming if you havent already played through the base game and understand the ropes,True,0,0,0.5,0,True,False,False,XCOM 2: War of the Chosen
593380,166390965,76561198813444404,savor the moment its looking like your last  honestly i had a blast playing this dlc not only does it add 3 new great classes to the game it adds 3 new bosses with each having their unique abilities and weapons you can use as rewards after defeating the said bosses overall great dlc would recommend,True,0,0,0.5,0,False,False,False,XCOM 2: War of the Chosen
593380,166361393,76561198041793589,this is a great dlc pity i couldnt play it it is 2024 and i went back to try and launch the expansion but it still fails i have the game installed on steam and even after following 2ks instructions to launch it it still does not work shame,False,10,0,0.5347158908843994,0,True,False,False,XCOM 2: War of the Chosen
593380,166230000,76561198046048594,great dlc it made significant changes to game,True,0,0,0.5,0,False,False,False,XCOM 2: War of the Chosen
593380,165431649,76561197996545316,recommended but i really wish they had an option of make the chosen shut up   after a hundred or so hours goddammit please shush,True,0,0,0.5,0,True,False,False,XCOM 2: War of the Chosen
593380,165246500,76561198052323462,great dlc,True,0,0,0.5,0,True,False,False,XCOM 2: War of the Chosen
593380,163010220,76561198126081939,absolutely a musthave if youve bought xcom 2 this dlc adds so much content to the game that it feels as completely different game,True,1,0,0.5199999809265136,0,False,False,False,XCOM 2: War of the Chosen
593380,162650945,76561198045407346,good,True,1,0,0.4261395335197448,0,False,False,False,XCOM 2: War of the Chosen
593380,162580224,76561198038389169,commander the aliens continue to make progress on the avatar project if were going to slow them down we need to move fast,True,0,1,0.4761904776096343,0,True,False,False,XCOM 2: War of the Chosen
593380,162577583,76561199093645011,love this game,True,0,0,0.5,0,True,False,False,XCOM 2: War of the Chosen
593380,162400455,76561198047532684,excellent addition to xcom 2,True,1,0,0.4905660152435302,0,True,False,False,XCOM 2: War of the Chosen
593380,162338960,76561199036279952,the best dlc besides those of the witcher 3 that i have ever played,True,2,0,0.5048596262931823,0,True,False,False,XCOM 2: War of the Chosen
593380,161960172,76561198036792064,a really cool dlc new maps new in game challenges really difficult stand alone challenges and even a few new scenes for the final cutscene,True,1,0,0.5250000357627868,0,True,False,False,XCOM 2: War of the Chosen
593380,161365574,76561199231239581,the new factions covert ops and fatigue are decent but the lost soldier bonds and those pesky chosen are just beyond annoying long war 2 is drastically better than such underwhelming expansion,False,3,0,0.4696095883846282,0,True,False,False,XCOM 2: War of the Chosen
593380,161253669,76561197978773337,id like to thank you all the modder community of this game the effort and depth they give to this pure perfection thank you to everyone involved for transforming a unique game into a perfect video game experience,True,1,0,0.5185185670852661,0,True,False,False,XCOM 2: War of the Chosen
593380,160725772,76561199434584592,i love the base game and this adds a whole bunch of interesting content including 3 totally special classes that makes each soldier feel more unique this is can be an incredible deal when it is on sale the ending of this dlc is a bit underwhelming but i still highly recommend it,True,1,0,0.5250000357627868,0,True,False,False,XCOM 2: War of the Chosen
593380,160624707,76561198157796191,great dlc it literally doubles the longevity of the game by transforming the main campaign in something completely new strongly suggested to anyone that has already finished the vanilla game and wants to replay it with a totally different setup,True,0,0,0.5,0,True,False,False,XCOM 2: War of the Chosen
593380,160590499,76561198079723817,xcom expansion at its peak nothing can top this,True,3,0,0.5304033756256104,0,False,False,False,XCOM 2: War of the Chosen
593380,160554894,76561198880385980,yeah its amazing,True,0,0,0.5,0,False,False,False,XCOM 2: War of the Chosen
593380,160491804,76561199226378633,fuck you warlock stop summong spectral army son of a bitch,True,0,0,0.5,0,True,False,False,XCOM 2: War of the Chosen
593380,160473229,76561198872264286,i have to admit i didnt expect this so this is what it means to be afraid not my style,True,0,0,0.5,0,True,False,False,XCOM 2: War of the Chosen
593380,160350194,76561198144717980,the base game and dlc are very fun but the mod support on steam alone makes this game replayable again and again,True,0,0,0.5,0,True,False,False,XCOM 2: War of the Chosen
593380,160168854,76561199169300091,must have dlc it adds more content to the base game such as zombie enemies that come in hordes 3 new amazing classes alien assassin that will appear in some missions there will be special mission to confront and defeat these assassins highrisk but highreward,True,0,0,0.5,0,True,False,False,XCOM 2: War of the Chosen
593380,159826598,76561198044453630,one of the best expansions ever made,True,0,0,0.5,0,True,False,False,XCOM 2: War of the Chosen
593380,159277614,76561199017245962,i failed a french test because i was so addicted to this,True,0,0,0.4603174626827239,0,True,False,False,XCOM 2: War of the Chosen
593380,159017194,76561198017622645,definitely worth buying and playing great expansion,True,0,0,0.5,0,True,False,False,XCOM 2: War of the Chosen
593380,157903030,76561197972060669,i found this dlc to be very good added new elements to the base game  glad i played it,True,0,0,0.4799999892711639,0,True,False,False,XCOM 2: War of the Chosen
593380,157364567,76561198254205622,turns a good game comical stupid and repetitive,False,0,0,0.4243897199630737,0,True,False,False,XCOM 2: War of the Chosen
593380,157095002,76561198000691853,steam states i played this dlc for 12 hours i wasnt able to play right as game loads dies did this with no mods checked verification of all files still nothing will not refund fucked 40 down the drain,False,0,0,0.4831715822219848,0,True,False,False,XCOM 2: War of the Chosen
593380,156522148,76561198086202924,a great expansion adds a lot of great content and qol changes after playing both backtoback i think playing base xcom2 is not necessary and you can go ahead and play this version,True,0,0,0.5,0,True,False,False,XCOM 2: War of the Chosen
593380,156174775,76561198035227132,this dlc adds so much replayability to the game 100 recommend getting it,True,0,0,0.5,0,True,False,False,XCOM 2: War of the Chosen
593380,156056498,76561197970562615,im not far into the content but i agree with others definitely a huge improvement over base game which i stopped playing back in 2016  my gripes  the game crashed my very first run erased my game  i still hate the only one mission at a time crap  the chosen villains are uber cheese p,True,0,0,0.5,0,True,False,False,XCOM 2: War of the Chosen
593380,155509069,76561198828923252,definitely get this dlc if youre going to play this game  dlc brings new classes and bosses that you can fight if you havent read the desc  1010 dlc expansion,True,0,0,0.5,0,True,False,False,XCOM 2: War of the Chosen
593380,155329399,76561199100912524,one of the best tun based games out there,True,0,0,0.5,0,True,False,False,XCOM 2: War of the Chosen
593380,155257379,76561198025866578,very fun just need to bypass the 2k launcher,True,0,0,0.5,0,True,False,False,XCOM 2: War of the Chosen
593380,154908606,76561198116248142,adds powerful new enemies zombies and hero units to the main campaign an essential dlc for the optimal xcom 2 experience,True,0,0,0.5,0,True,False,False,XCOM 2: War of the Chosen
593380,154753476,76561198096672307,top game,True,0,0,0.5,0,True,True,False,XCOM 2: War of the Chosen
593380,154491218,76561199589086762,i hate my fucking life,True,0,0,0.4585538208484649,0,True,False,False,XCOM 2: War of the Chosen
593380,154453832,76561198152529939,a must have for fans of the base game  adds enough new mechanics to make another playthrough fresh the chosen are interesting and the new faction heroes are good to add to the original soldier classes my only issue was that once you have plasma weapons and a team of 6 veterans the missions are fairly simple but that was always a problem with the base game too play it nevertheless,True,0,0,0.5,0,True,False,False,XCOM 2: War of the Chosen
